author_id,vol,nama,gelaran,parti,lantikan,negeri,kawasan,kod_kawasan,tahun_lahir,jantina,kumpulan_etnik,jawatan_kabinet,jawatan_parlimen,penggal,tempoh,tempoh_mula,tempoh_tamat
1,2,A. Arunasalam,TIADA,Perikatan - MIC,Dilantik Yang di-Pertuan Agong,TIADA,,,,,indian,TIADA,Ahli Dewan Negara,,,1964-09-11,
1,3,A. Arunasalam,TIADA,Perikatan - MIC,Dilantik Yang di-Pertuan Agong,TIADA,,,,,indian,TIADA,Ahli Dewan Negara,,,1964-09-11,1970-09-10
1,3,A. Arunasalam,TIADA,Perikatan - MIC,Dilantik Yang di-Pertuan Agong,TIADA,,,,,indian,TIADA,Ahli Dewan Negara,,,1971-02-20,1977-02-19
1,4,A. Arunasalam,TIADA,BN - MIC,Dilantik Yang di-Pertuan Agong,TIADA,,,,,indian,TIADA,Ahli Dewan Negara,,,1964-09-11,1967-09-10
1,4,A. Arunasalam,TIADA,BN - MIC,Dilantik Yang di-Pertuan Agong,TIADA,,,,,indian,TIADA,Ahli Dewan Negara,,,1971-02-20,1974-02-19
2,1,A. M. Abu Bakar,TIADA,Perikatan - UMNO,Dilantik Yang di-Pertuan Agong,TIADA,,,,,bumiputera,TIADA,Ahli Dewan Negara,,,1959-09-11,1962-09-10
3,6,A. Shaik Dawood Abu Bakar,TIADA,BN - UMNO,Dilantik Yang di-Pertuan Agong,TIADA,,,,,bumiputera,TIADA,Ahli Dewan Negara,,,1985-02-15,1988-02-14
3,7,A. Shaik Dawood Abu Bakar,TIADA,BN - UMNO,Dilantik Yang di-Pertuan Agong,TIADA,,,,,bumiputera,TIADA,Ahli Dewan Negara,,,1985-02-15,1988-02-14
4,6,Abang Ahmad Urai,TIADA,BN - PBB,Dipilih oleh Dewan Undangan Negeri,Sarawak,,,,,bumiputera,TIADA,Ahli Dewan Negara,,,1984-04-09,1987-04-08
4,7,Abang Ahmad Urai,TIADA,BN - PBB,Dipilih oleh Dewan Undangan Negeri,Sarawak,,,,,bumiputera,TIADA,Ahli Dewan Negara,,,1984-04-09,1987-04-08
4,7,Abang Ahmad Urai,TIADA,BN - PBB,Dipilih oleh Dewan Undangan Negeri,Sarawak,,,,,bumiputera,TIADA,Ahli Dewan Negara,,,1987-07-10,1990-07-09
5,1,Abang Mustapha Abang Moasili,TIADA,PANAS,Dilantik Yang di-Pertuan Agong,TIADA,,,,,bumiputera,TIADA,Ahli Dewan Negara,,,1963-12-27,1964-01-19
6,1,Abbas Mohamed,TIADA,PAS,Dipilih oleh Dewan Undangan Negeri,Terengganu,,,,,bumiputera,TIADA,Ahli Dewan Negara,,,1959-09-11,1962-09-10
7,9,Abdillah Abdul Rahim,TIADA,BN - PBB,Dipilih oleh Dewan Undangan Negeri,Sarawak,,,,,bumiputera,TIADA,Ahli Dewan Negara,,,1996-12-11,1999-12-10
7,10,Abdillah Abdul Rahim,TIADA,BN - PBB,Dipilih oleh Dewan Undangan Negeri,Sarawak,,,,,bumiputera,TIADA,Ahli Dewan Negara,,,1996-12-11,1999-12-10
7,10,Abdillah Abdul Rahim,TIADA,BN - PBB,Dipilih oleh Dewan Undangan Negeri,Sarawak,,,,,bumiputera,TIADA,Ahli Dewan Negara,,,1999-12-27,2002-12-26
8,9,Abdul Aziz Abdul Rahman,TIADA,BN - UMNO,Dilantik Yang di-Pertuan Agong,TIADA,,,,,bumiputera,TIADA,Ahli Dewan Negara,,,1995-09-04,1998-09-03
8,10,Abdul Aziz Abdul Rahman,TIADA,BN - UMNO,Dilantik Yang di-Pertuan Agong,TIADA,,,,,bumiputera,TIADA,Ahli Dewan Negara,,,1995-09-04,1998-09-03
9,10,Abdul Aziz Shamsuddin,TIADA,BN - UMNO,Dilantik Yang di-Pertuan Agong,TIADA,,,,,bumiputera,TIADA,Ahli Dewan Negara,,,1999-11-03,2002-11-02
10,4,Abdul Aziz Tapa,TIADA,BN - UMNO,Dipilih oleh Dewan Undangan Negeri,Melaka,,,,,bumiputera,TIADA,Ahli Dewan Negara,,,1975-07-22,1978-07-21
11,2,Abdul Ghafar Baba,TIADA,Perikatan - UMNO,Dilantik Yang di-Pertuan Agong,TIADA,,,,,bumiputera,TIADA,Ahli Dewan Negara,,,1968-03-04,
12,13,Abdul Ghani Bin Mohamed Yassin,YB Senator Datuk,BN - UMNO,Dipilih oleh Dewan Undangan Negeri,Sabah,,,,M,bumiputera,TIADA,TIADA,,05.01.2018 - 04.01.2021,2018-01-05,2021-01-04
13,6,Abdul Ghani Othman,TIADA,BN - UMNO,Dilantik Yang di-Pertuan Agong,TIADA,,,,,bumiputera,TIADA,Ahli Dewan Negara,,,1984-12-11,1987-12-10
14,13,Abdul Halim bin Abd. Samad,YB Senator Datuk Seri Haji,BN - UMNO,Dilantik Yang di-Pertuan Agong,TIADA,,,,M,bumiputera,TIADA,Timbalan Yang di-Pertua Dewan Negara,,03.11.2014 - 02.11.2017,2014-11-03,2017-11-02
15,15,Abdul Halim bin Haji Suleiman,YB Senator Dato' Haji,UMNO,Dipilih oleh Dewan Undangan Negeri,Johor,,,,M,bumiputera,TIADA,Ahli Dewan Negara,,23.11.2023 - 22.11.2026,2023-11-23,2026-11-22
16,4,Abdul Hamid Bidin,TIADA,BN - UMNO,Dilantik Yang di-Pertuan Agong,TIADA,,,,,bumiputera,TIADA,Ahli Dewan Negara,,,1976-08-09,1979-08-08
16,5,Abdul Hamid Bidin,TIADA,BN - UMNO,Dilantik Yang di-Pertuan Agong,TIADA,,,,,bumiputera,TIADA,Ahli Dewan Negara,,,1976-08-09,1979-08-08
16,6,Abdul Hamid Bidin,TIADA,BN - UMNO,Dilantik Yang di-Pertuan Agong,TIADA,,,,,bumiputera,TIADA,Ahli Dewan Negara,,,1976-08-09,1979-08-08
17,6,Abdul Hamid Ibrahim,TIADA,BN - UMNO,Dilantik Yang di-Pertuan Agong,TIADA,,,,,bumiputera,TIADA,Ahli Dewan Negara,,,1983-12-05,1986-12-04
17,7,Abdul Hamid Ibrahim,TIADA,BN - UMNO,Dilantik Yang di-Pertuan Agong,TIADA,,,,,bumiputera,TIADA,Ahli Dewan Negara,,,1983-12-05,1986-12-04
17,7,Abdul Hamid Ibrahim,TIADA,BN - UMNO,Dilantik Yang di-Pertuan Agong,TIADA,,,,,bumiputera,TIADA,Ahli Dewan Negara,,,1986-12-15,1989-12-14
18,3,Abdul Hamid Khan,TIADA,Perikatan - UMNO,Dilantik Yang di-Pertuan Agong,TIADA,,,,,bumiputera,TIADA,Ahli Dewan Negara,,,1971-02-20,1977-02-19
19,6,Abdul Hamid Latif,TIADA,BN - UMNO,Dilantik Yang di-Pertuan Agong,TIADA,,,,,bumiputera,TIADA,Ahli Dewan Negara,,,1984-12-11,1987-12-10
19,7,Abdul Hamid Latif,TIADA,BN - UMNO,Dilantik Yang di-Pertuan Agong,TIADA,,,,,bumiputera,TIADA,Ahli Dewan Negara,,,1984-12-11,1987-12-10
19,7,Abdul Hamid Latif,TIADA,BN - UMNO,Dilantik Yang di-Pertuan Agong,TIADA,,,,,bumiputera,TIADA,Ahli Dewan Negara,,,1987-12-10,1990-12-09
20,1,Abdul Hamid Mahmud,TIADA,Perikatan - UMNO,Dilantik Yang di-Pertuan Agong,TIADA,,,,,bumiputera,TIADA,Ahli Dewan Negara,,,1959-09-11,1962-09-10
21,10,Abdul Hamid Othman,TIADA,BN - UMNO,Dilantik Yang di-Pertuan Agong,TIADA,,,,,bumiputera,TIADA,Ahli Dewan Negara,,,1999-12-13,2002-12-12
22,10,Abdul Hamid Pawanteh,TIADA,BN - UMNO,Dilantik Yang di-Pertuan Agong,TIADA,,,,,bumiputera,TIADA,Ahli Dewan Negara,,,,
22,11,Abdul Hamid Pawanteh,TIADA,BN - UMNO,Dilantik Yang di-Pertuan Agong,TIADA,,,,,bumiputera,TIADA,Ahli Dewan Negara,,,2006-07-19,2009-07-18
23,5,Abdul Hamid Tahir,TIADA,BN - UMNO,Dipilih oleh Dewan Undangan Negeri,Kedah,,,,,bumiputera,TIADA,Ahli Dewan Negara,,,1980-12-15,1983-12-14
24,10,Abdul Hamid Zainal Abidin,TIADA,BN - UMNO,Dilantik Yang di-Pertuan Agong,TIADA,,,,,bumiputera,TIADA,Ahli Dewan Negara,,,,
25,6,Abdul Jalil Abdul Rahman,TIADA,BN - UMNO,Dilantik Yang di-Pertuan Agong,TIADA,,,,,bumiputera,TIADA,Ahli Dewan Negara,,,1982-07-19,1985-07-18
26,3,Abdul Kadir Yusuf,TIADA,Perikatan - UMNO,Dilantik Yang di-Pertuan Agong,TIADA,,,,,bumiputera,TIADA,Ahli Dewan Negara,,,1971-02-20,1977-02-19
26,3,Abdul Kadir Yusuf,TIADA,Perikatan - UMNO,Dilantik Yang di-Pertuan Agong,TIADA,,,,,bumiputera,TIADA,Ahli Dewan Negara,,,1971-12-20,1977-12-19
27,5,Abdul Latip Idris,TIADA,BN - UMNO,Dilantik Yang di-Pertuan Agong,TIADA,,,,,bumiputera,TIADA,Ahli Dewan Negara,,,1979-04-08,1982-04-07
27,6,Abdul Latip Idris @ Latip Dris,TIADA,BN - UMNO,Dilantik Yang di-Pertuan Agong,TIADA,,,,,bumiputera,TIADA,Ahli Dewan Negara,,,1979-04-08,1982-04-07
27,6,Abdul Latip Idris @ Latip Dris,TIADA,BN - UMNO,Dilantik Yang di-Pertuan Agong,TIADA,,,,,bumiputera,TIADA,Ahli Dewan Negara,,,1982-07-19,1985-07-18
28,7,Abdul Majid Abdullah,TIADA,BN - UMNO,Dipilih oleh Dewan Undangan Negeri,Johor,,,,,bumiputera,TIADA,Ahli Dewan Negara,,,1986-12-11,1989-12-10
28,7,Abdul Majid Abdullah,TIADA,BN - UMNO,Dipilih oleh Dewan Undangan Negeri,Johor,,,,,bumiputera,TIADA,Ahli Dewan Negara,,,1989-12-26,1992-12-25
28,8,Abdul Majid Abdullah,TIADA,BN - UMNO,Dipilih oleh Dewan Undangan Negeri,Johor,,,,,bumiputera,TIADA,Ahli Dewan Negara,,,1986-12-11,1989-12-10
28,8,Abdul Majid Abdullah,TIADA,BN - UMNO,Dipilih oleh Dewan Undangan Negeri,Johor,,,,,bumiputera,TIADA,Ahli Dewan Negara,,,1989-12-26,1992-12-25
29,9,Abdul Malek Abdul Ghani,TIADA,BN - UMNO,Dipilih oleh Dewan Undangan Negeri,Perlis,,,,,bumiputera,TIADA,Ahli Dewan Negara,,,1999-05-03,2002-05-02
29,10,Abdul Malek Abdul Ghani,TIADA,BN - UMNO,Dipilih oleh Dewan Undangan Negeri,Perlis,,,,,bumiputera,TIADA,Ahli Dewan Negara,,,1999-05-03,2002-05-02
30,7,Abdul Manap Hashim,TIADA,BN - UMNO,Dipilih oleh Dewan Undangan Negeri,Kedah,,,,,bumiputera,TIADA,Ahli Dewan Negara,,,1986-12-09,1989-12-08
31,15,Abdul Nasir bin Haji Idris,YB Senator Tuan Haji,PAS,Dipilih oleh Dewan Undangan Negeri,Kedah,,,,M,bumiputera,TIADA,Ahli Dewan Negara,,20.03.2023 - 19.03.2026,2023-03-20,2026-03-19
32,2,Abdul Rahim Abdul Manan,TIADA,Perikatan - UMNO,Dipilih oleh Dewan Undangan Negeri,Negeri Sembilan,,,,,bumiputera,TIADA,Ahli Dewan Negara,,,1967-03-06,
32,3,Abdul Rahim Abdul Manan,TIADA,Perikatan - UMNO,Dipilih oleh Dewan Undangan Negeri,Negeri Sembilan,,,,,bumiputera,TIADA,Ahli Dewan Negara,,,1967-03-06,1973-03-05
32,3,Abdul Rahim Abdul Manan,TIADA,Perikatan - UMNO,Dipilih oleh Dewan Undangan Negeri,Negeri Sembilan,,,,,bumiputera,TIADA,Ahli Dewan Negara,,,1971-12-20,1977-12-19
32,4,Abdul Rahim Abdul Manan,TIADA,BN - UMNO,Dipilih oleh Dewan Undangan Negeri,Negri Sembilan,,,,,bumiputera,TIADA,Ahli Dewan Negara,,,1967-03-06,1970-03-05
32,4,Abdul Rahim Abdul Manan,TIADA,BN - UMNO,Dipilih oleh Dewan Undangan Negeri,Negri Sembilan,,,,,bumiputera,TIADA,Ahli Dewan Negara,,,1971-12-20,1974-12-19
33,1,Abdul Rahman Ahmad,TIADA,Perikatan - UMNO,Dipilih oleh Dewan Undangan Negeri,Perlis,,,,,bumiputera,TIADA,Ahli Dewan Negara,,,1963-03-15,1969-03-14
33,2,Abdul Rahman Ahmad,TIADA,Perikatan - UMNO,Dipilih oleh Dewan Undangan Negeri,Perlis,,,,,bumiputera,TIADA,Ahli Dewan Negara,,,1963-03-15,1969-03-14
34,13,Abdul Rahman Bin Mat Yasin,YB Senator Dato' Haji,BN - UMNO,Dipilih oleh Dewan Undangan Negeri,Terengganu,,,,M,bumiputera,TIADA,TIADA,,22.06.2015 - 21.06.2018,2015-06-22,2018-06-21
35,1,Abdul Rahman Mohamed Yasin,TIADA,Perikatan - UMNO,Dipilih oleh Dewan Undangan Negeri,Johor,,,,,bumiputera,TIADA,Ahli Dewan Negara,,,1959-09-11,1965-09-10
35,2,Abdul Rahman Mohamed Yasin,TIADA,Perikatan - UMNO,Dipilih oleh Dewan Undangan Negeri,Johor,,,,,bumiputera,TIADA,Ahli Dewan Negara,,,1959-09-11,1965-09-10
35,2,Abdul Rahman Mohamed Yasin,TIADA,Perikatan - UMNO,Dipilih oleh Dewan Undangan Negeri,Johor,,,,,bumiputera,TIADA,Ahli Dewan Negara,,,1965-10-18,1970-05-24
36,10,Abdul Rahman Palit,TIADA,BN - UMNO,Dilantik Yang di-Pertuan Agong,TIADA,,,,,bumiputera,TIADA,Ahli Dewan Negara,,,,
37,12,Abdul Rahman bin Bakar,YB Senator Dato' Haji,BN - UMNO,Dilantik Yang di-Pertuan Agong,TIADA,,,,M,bumiputera,TIADA,TIADA,,18.07.2011 - 17.07.2014,2011-07-18,2014-07-17
38,11,Abdul Raman Suliman,TIADA,BN - UMNO,Dilantik Yang di-Pertuan Agong,TIADA,,,,,bumiputera,TIADA,Ahli Dewan Negara,,,2004-08-26,2007-08-25
39,7,Abdul Rashid Ismail,TIADA,BN - UMNO,Dipilih oleh Dewan Undangan Negeri,Pulau Pinang,,,,,bumiputera,TIADA,Ahli Dewan Negara,,,1990-03-19,1993-03-18
39,8,Abdul Rashid Ismail,TIADA,BN - UMNO,Dipilih oleh Dewan Undangan Negeri,Pulau Pinang,,,,,bumiputera,TIADA,Ahli Dewan Negara,,,1990-03-19,1993-03-18
40,11,Abdul Rashid Ngah,TIADA,BN - UMNO,Dilantik Yang di-Pertuan Agong,TIADA,,,,,bumiputera,TIADA,Ahli Dewan Negara,,,2004-12-06,2007-12-05
40,11,Abdul Rashid Ngah,TIADA,BN - UMNO,Dilantik Yang di-Pertuan Agong,TIADA,,,,,bumiputera,TIADA,Ahli Dewan Negara,,,2007-12-13,2010-12-12
41,5,Abdul Razak Abu Samah,TIADA,BN - UMNO,Dilantik Yang di-Pertuan Agong,TIADA,,,,,bumiputera,TIADA,Ahli Dewan Negara,,,1979-04-06,1982-04-05
41,6,Abdul Razak Abu Samah,TIADA,BN - UMNO,Dilantik Yang di-Pertuan Agong,TIADA,,,,,bumiputera,TIADA,Ahli Dewan Negara,,,1979-04-06,1982-04-05
41,6,Abdul Razak Abu Samah,TIADA,BN - UMNO,Dilantik Yang di-Pertuan Agong,TIADA,,,,,bumiputera,TIADA,Ahli Dewan Negara,,,1982-07-19,1985-07-18
42,3,Abdul Razak Hussin,TIADA,Perikatan - UMNO,Dilantik Yang di-Pertuan Agong,TIADA,,,,,bumiputera,TIADA,Ahli Dewan Negara,,,1972-05-10,1978-05-09
42,4,Abdul Razak Hussin,TIADA,BN - UMNO,Dilantik Yang di-Pertuan Agong,TIADA,,,,,bumiputera,TIADA,Ahli Dewan Negara,,,1972-05-10,1975-05-09
42,4,Abdul Razak Hussin,TIADA,BN - UMNO,Dilantik Yang di-Pertuan Agong,TIADA,,,,,bumiputera,TIADA,Ahli Dewan Negara,,,1977-11-09,1980-11-08
42,5,Abdul Razak Hussin,TIADA,BN - UMNO,Dilantik Yang di-Pertuan Agong,TIADA,,,,,bumiputera,TIADA,Ahli Dewan Negara,,,1972-05-10,1975-05-09
42,5,Abdul Razak Hussin,TIADA,BN - UMNO,Dilantik Yang di-Pertuan Agong,TIADA,,,,,bumiputera,TIADA,Ahli Dewan Negara,,,1977-11-09,1980-11-08
43,8,Abdul Salam Awang,TIADA,BN - UMNO,Dilantik Yang di-Pertuan Agong,TIADA,,,,,bumiputera,TIADA,Ahli Dewan Negara,,,1991-02-18,1994-02-17
43,8,Abdul Salam Awang,TIADA,BN - UMNO,Dilantik Yang di-Pertuan Agong,TIADA,,,,,bumiputera,TIADA,Ahli Dewan Negara,,,1994-07-20,1997-07-19
44,2,Abdul Samad Osman,TIADA,Perikatan - UMNO,Dilantik Yang di-Pertuan Agong,TIADA,,,,,bumiputera,TIADA,Ahli Dewan Negara,,,1964-05-18,
44,3,Abdul Samad Osman,TIADA,Perikatan - UMNO,Dilantik Yang di-Pertuan Agong,TIADA,,,,,bumiputera,TIADA,Ahli Dewan Negara,,,1964-05-18,1970-05-17
44,3,Abdul Samad Osman,TIADA,Perikatan - UMNO,Dilantik Yang di-Pertuan Agong,TIADA,,,,,bumiputera,TIADA,Ahli Dewan Negara,,,1971-02-20,1977-02-19
44,4,Abdul Samad Osman,TIADA,BN - UMNO,Dilantik Yang di-Pertuan Agong,TIADA,,,,,bumiputera,TIADA,Ahli Dewan Negara,,,1964-05-18,1967-05-17
44,4,Abdul Samad Osman,TIADA,BN - UMNO,Dilantik Yang di-Pertuan Agong,TIADA,,,,,bumiputera,TIADA,Ahli Dewan Negara,,,1971-02-20,1974-02-19
45,5,Abdul Samad Said,TIADA,BN - UMNO,Dilantik Yang di-Pertuan Agong,TIADA,,,,,bumiputera,TIADA,Ahli Dewan Negara,,,,
46,12,Abdul Shukor bin P A Mohd Sultan,YB Senator Tuan Haji,BN - UMNO,Dipilih oleh Dewan Undangan Negeri,Perlis,,,,M,bumiputera,TIADA,TIADA,,25.04.2012 - 24.04.2015,2012-04-25,2015-04-24
47,6,Abdul Wahab Abu Bakar,TIADA,BN - UMNO,Dilantik Yang di-Pertuan Agong,TIADA,,,,,bumiputera,TIADA,Ahli Dewan Negara,,,1982-07-19,1985-07-18
47,6,Abdul Wahab Abu Bakar,TIADA,BN - UMNO,Dilantik Yang di-Pertuan Agong,TIADA,,,,,bumiputera,TIADA,Ahli Dewan Negara,,,1983-12-09,1986-12-08
47,7,Abdul Wahab Abu Bakar,TIADA,BN - UMNO,Dilantik Yang di-Pertuan Agong,TIADA,,,,,bumiputera,TIADA,Ahli Dewan Negara,,,1982-07-19,1985-07-18
47,7,Abdul Wahab Abu Bakar,TIADA,BN - UMNO,Dilantik Yang di-Pertuan Agong,TIADA,,,,,bumiputera,TIADA,Ahli Dewan Negara,,,1983-12-09,1986-12-08
48,1,Abdul Wahab Idus,TIADA,Perikatan - UMNO,Dipilih oleh Dewan Undangan Negeri,Negeri Sembilan,,,,,bumiputera,TIADA,Ahli Dewan Negara,,,1959-09-11,1965-09-10
48,2,Abdul Wahab Idus,TIADA,Perikatan - UMNO,Dipilih oleh Dewan Undangan Negeri,Negeri Sembilan,,,,,bumiputera,TIADA,Ahli Dewan Negara,,,1959-09-11,1965-09-10
49,10,Abdul Wahid Vartan Syed Ghany,TIADA,BN - UMNO,Dilantik Yang di-Pertuan Agong,TIADA,,,,,bumiputera,TIADA,Ahli Dewan Negara,,,1998-02-05,2001-02-04
49,9,Abdul Wahid Varthan Syed Ghany,TIADA,BN - UMNO,Dilantik Yang di-Pertuan Agong,TIADA,,,,,bumiputera,TIADA,Ahli Dewan Negara,,,1998-02-05,2001-02-04
50,2,Abdullah Abdul Rahman,TIADA,Perikatan - UMNO,Dipilih oleh Dewan Undangan Negeri,Johor,,,,,bumiputera,TIADA,Ahli Dewan Negara,,,1968-12-09,1971-12-08
50,3,Abdullah Abdul Rahman,TIADA,Perikatan - UMNO,Dipilih oleh Dewan Undangan Negeri,Johor,,,,,bumiputera,TIADA,Ahli Dewan Negara,,,,
51,10,Abdullah Ayub,TIADA,BN - UMNO,Dilantik Yang di-Pertuan Agong,TIADA,,,,,bumiputera,TIADA,Ahli Dewan Negara,,,,
52,6,Abdullah Fadzil Che Wan,TIADA,BN - UMNO,Dilantik Yang di-Pertuan Agong,TIADA,,,,,bumiputera,TIADA,Ahli Dewan Negara,,,1982-12-16,1985-12-15
52,6,Abdullah Fadzil Che Wan,TIADA,BN - UMNO,Dilantik Yang di-Pertuan Agong,TIADA,,,,,bumiputera,TIADA,Ahli Dewan Negara,,,1986-02-18,1989-02-17
52,7,Abdullah Fadzil Che Wan,TIADA,BN - UMNO,Dilantik Yang di-Pertuan Agong,TIADA,,,,,bumiputera,TIADA,Ahli Dewan Negara,,,1982-12-16,1985-12-15
52,7,Abdullah Fadzil Che Wan,TIADA,BN - UMNO,Dilantik Yang di-Pertuan Agong,TIADA,,,,,bumiputera,TIADA,Ahli Dewan Negara,,,1986-02-18,1989-02-17
53,1,Abdullah Ishak,TIADA,Perikatan - UMNO,Dipilih oleh Dewan Undangan Negeri,Perlis,,,,,bumiputera,TIADA,Ahli Dewan Negara,,,1960-12-21,1962-08-20
54,5,Abdullah Salleh,TIADA,BN - UMNO,Dipilih oleh Dewan Undangan Negeri,Perlis,,,,,bumiputera,TIADA,Ahli Dewan Negara,,,1978-10-09,1981-10-08
55,13,Abidullah Bin Salleh,YB Senator Datuk Haji,BN - UMNO,Dipilih oleh Dewan Undangan Negeri,Melaka,,,,M,bumiputera,TIADA,Ahli Dewan Negara,,27.10.2016 - 26.10.2019,2016-10-27,2019-10-26
56,2,Abu Bakar Ahmad,TIADA,Perikatan - UMNO,Dipilih oleh Dewan Undangan Negeri,Terengganu,,,,,bumiputera,TIADA,Ahli Dewan Negara,,,1968-12-09,1974-12-08
56,3,Abu Bakar Ahmad,TIADA,Perikatan - UMNO,Dipilih oleh Dewan Undangan Negeri,Terengganu,,,,,bumiputera,TIADA,Ahli Dewan Negara,,,,
57,3,Abu Bakar Hamzah,TIADA,PAS,Dipilih oleh Dewan Undangan Negeri,Kelantan,,,,,bumiputera,TIADA,Ahli Dewan Negara,,,1971-12-20,1977-12-19
57,4,Abu Bakar Hamzah,TIADA,BN - PAS,Dipilih oleh Dewan Undangan Negeri,Kelantan,,,,,bumiputera,TIADA,Ahli Dewan Negara,,,1971-12-20,1974-12-19
58,9,Abu Bakar Ismail,TIADA,BN - UMNO,Dipilih oleh Dewan Undangan Negeri,Perlis,,,,,bumiputera,TIADA,Ahli Dewan Negara,,,,
59,6,Abu Bakar Lajim,TIADA,BN - UMNO,Dilantik Yang di-Pertuan Agong,TIADA,,,,,bumiputera,TIADA,Ahli Dewan Negara,,,1984-12-11,1987-12-10
59,7,Abu Bakar Lajim,TIADA,BN - UMNO,Dilantik Yang di-Pertuan Agong,TIADA,,,,,bumiputera,TIADA,Ahli Dewan Negara,,,1984-12-11,1987-12-10
59,7,Abu Bakar Lajim,TIADA,BN - UMNO,Dilantik Yang di-Pertuan Agong,TIADA,,,,,bumiputera,TIADA,Ahli Dewan Negara,,,1987-12-10,1990-12-09
60,4,Abu Bakar Titingan Damsani,TIADA,USNO,Dilantik Yang di-Pertuan Agong,TIADA,,,,,bumiputera,TIADA,Ahli Dewan Negara,,,1976-01-22,1979-01-21
60,5,Abu Bakar Titingan Damsani,TIADA,USNO,Dilantik Yang di-Pertuan Agong,TIADA,,,,,bumiputera,TIADA,Ahli Dewan Negara,,,1976-01-22,1979-01-21
60,5,Abu Bakar Titingan Damsani,TIADA,USNO,Dilantik Yang di-Pertuan Agong,TIADA,,,,,bumiputera,TIADA,Ahli Dewan Negara,,,,1980-01-20
61,12,Abu Zahar Ujang,YB Senator Tan Sri,BN - UMNO,Dilantik Yang di-Pertuan Agong,TIADA,,,,M,bumiputera,TIADA,Yang Dipertua Dewan Negara,,26.04.2013 - 25.04.2016,2013-04-26,2016-04-25
61,12,Abu Zahar Ujang,YB Senator Tan Sri,TIADA,,TIADA,,,,M,bumiputera,TIADA,TIADA,,,,
62,15,Abun Sui Anyit,YB Senator Tuan,PKR,Dilantik Yang di-Pertuan Agong,TIADA,,,,M,bumiputera,TIADA,Ahli Dewan Negara,,20.03.2023 - 19.03.2026,2023-03-20,2026-03-19
63,7,Adam Kadir,TIADA,BN - UMNO,Dilantik Yang di-Pertuan Agong,TIADA,,,,,bumiputera,TIADA,Ahli Dewan Negara,,,1990-12-17,1993-12-16
63,8,Adam Kadir,TIADA,BN - UMNO,Dilantik Yang di-Pertuan Agong,TIADA,,,,,bumiputera,TIADA,Ahli Dewan Negara,,,1990-12-17,1993-12-16
63,8,Adam Kadir,TIADA,BN - UMNO,Dilantik Yang di-Pertuan Agong,TIADA,,,,,bumiputera,TIADA,Ahli Dewan Negara,,,1993-12-09,1996-12-08
64,10,Agnes Shim Tshin Nyuk,TIADA,BN - MCA,Dilantik Yang di-Pertuan Agong,TIADA,,,,,chinese,TIADA,Ahli Dewan Negara,,,,
64,11,Agnes Shim Tshin Nyuk,TIADA,BN - MCA,Dilantik Yang di-Pertuan Agong,TIADA,,,,,chinese,TIADA,Ahli Dewan Negara,,,,
65,12,Ahamat @ Ahamad bin Yusop,YB Senator Tuan Haji,BN - UMNO,Dipilih oleh Dewan Undangan Negeri,Johor,,,,M,bumiputera,TIADA,TIADA,,04.07.2011 - 03.07.2014,2011-07-04,2014-07-03
66,2,Ahmad Abdul Manap,TIADA,Perikatan - UMNO,Dipilih oleh Dewan Undangan Negeri,Melaka,,,,,bumiputera,TIADA,Ahli Dewan Negara,,,1965-12-18,1971-12-17
67,8,Ahmad Abdullah,TIADA,BN - UMNO,Dilantik Yang di-Pertuan Agong,TIADA,,,,,bumiputera,TIADA,Ahli Dewan Negara,,,1991-03-29,1994-03-28
67,8,Ahmad Abdullah,TIADA,BN - UMNO,Dilantik Yang di-Pertuan Agong,TIADA,,,,,bumiputera,TIADA,Ahli Dewan Negara,,,1991-12-16,1994-12-15
68,4,Ahmad Arshad,TIADA,BN - UMNO,Dipilih oleh Dewan Undangan Negeri,Johor,,,,,bumiputera,TIADA,Ahli Dewan Negara,,,1975-01-06,1978-01-05
68,5,Ahmad Arshad,TIADA,BN - UMNO,Dipilih oleh Dewan Undangan Negeri,Johor,,,,,bumiputera,TIADA,Ahli Dewan Negara,,,1975-01-06,1978-01-05
69,14,Ahmad Azam bin Hamzah,YB Senator Dato' Dr.,PKR,Dipilih oleh Dewan Undangan Negeri,Negeri Sembilan,,,,M,bumiputera,TIADA,Ahli Dewan Negara,,09.05.2019 hingga 08.05.2022,2019-05-09,
69,15,Ahmad Azam bin Hamzah,YB Senator Dato' Dr.,PKR,Dipilih oleh Dewan Undangan Negeri,Negeri Sembilan,,,,M,bumiputera,TIADA,Ahli Dewan Negara,,09.05.2019 hingga 08.05.2022,2019-05-09,
70,4,Ahmad Azizuddin Zainal Abidin,TIADA,BN - UMNO,Dilantik Yang di-Pertuan Agong,TIADA,,,,,bumiputera,TIADA,Ahli Dewan Negara,,,1976-08-10,1979-08-09
67,1,Ahmad Badawi Abdullah,TIADA,Perikatan - UMNO,Dipilih oleh Dewan Undangan Negeri,Pulau Pinang,,,,,bumiputera,TIADA,Ahli Dewan Negara,,,1962-10-15,1968-10-14
67,2,Ahmad Badawi Abdullah,TIADA,Perikatan - UMNO,Dipilih oleh Dewan Undangan Negeri,Pulau Pinang,,,,,bumiputera,TIADA,Ahli Dewan Negara,,,1962-10-15,1968-10-14
71,11,Ahmad Husin,TIADA,BN - UMNO,Dipilih oleh Dewan Undangan Negeri,Perlis,,,,,bumiputera,TIADA,Ahli Dewan Negara,,,2006-05-08,2009-05-07
72,9,Ahmad Ismail,TIADA,BN - UMNO,Dipilih oleh Dewan Undangan Negeri,Pulau Pinang,,,,,bumiputera,TIADA,Ahli Dewan Negara,,,1996-12-16,1999-12-15
72,10,Ahmad Ismail,TIADA,BN - UMNO,Dipilih oleh Dewan Undangan Negeri,Penang,,,,,bumiputera,TIADA,Ahli Dewan Negara,,,1996-12-16,1999-12-15
73,5,Ahmad Ithnin,TIADA,BN - UMNO,Dilantik Yang di-Pertuan Agong,TIADA,,,,,bumiputera,TIADA,Ahli Dewan Negara,,,1979-04-06,1982-04-05
74,14,Ahmad Masrizal Muhammad,YB Senator Dato' Dr.,UMNO,Dilantik Yang di-Pertuan Agong,TIADA,,,,M,bumiputera,Timbalan Menteri Pengajian Tinggi,TIADA,,09.03.2020 hingga 08.03.2023,2020-03-09,
75,6,Ahmad Othman,TIADA,BN - UMNO,Dipilih oleh Dewan Undangan Negeri,Kedah,,,,,bumiputera,TIADA,Ahli Dewan Negara,,,,
75,7,Ahmad Othman,TIADA,BN - UMNO,Dipilih oleh Dewan Undangan Negeri,Kedah,,,,,bumiputera,TIADA,Ahli Dewan Negara,,,,
76,1,Ahmad Said,TIADA,Perikatan - UMNO,Dipilih oleh Dewan Undangan Negeri,Perak,,,,,bumiputera,TIADA,Ahli Dewan Negara,,,1959-09-11,1965-09-10
77,1,Ahmad Taff,TIADA,Perikatan - UMNO,Dipilih oleh Dewan Undangan Negeri,Singapura,,,,,bumiputera,TIADA,Ahli Dewan Negara,,,1963-11-02,1965-08-08
77,2,Ahmad Taff,TIADA,Perikatan - UMNO,Dipilih oleh Dewan Undangan Negeri,Singapura,,,,,bumiputera,TIADA,Ahli Dewan Negara,,,1963-11-02,1965-08-08
78,8,Ahmad Zahid Hamidi,TIADA,BN - UMNO,Dilantik Yang di-Pertuan Agong,TIADA,,,,,bumiputera,TIADA,Ahli Dewan Negara,,,1991-07-24,1994-07-23
79,14,Ahmad bin Dato' Sri Hj Ibrahim,YB Senator Dato',PBB,Dipilih oleh Dewan Undangan Negeri,Sarawak,,,,M,bumiputera,TIADA,Ahli Dewan Negara,,22.07.2022 - 21.07.2025,2022-07-22,2025-07-21
79,15,Ahmad bin Dato' Sri Hj Ibrahim,YB Senator Dato',PBB,Dipilih oleh Dewan Undangan Negeri,Sarawak,,,,M,bumiputera,TIADA,Ahli Dewan Negara,,22.07.2022 - 21.07.2025,2022-07-22,2025-07-21
80,6,Ainon Ariffin,TIADA,BN - UMNO,Dilantik Yang di-Pertuan Agong,TIADA,,,,,bumiputera,TIADA,Ahli Dewan Negara,,,1986-02-18,1989-02-17
80,7,Ainon Ariffin,TIADA,BN - UMNO,Dilantik Yang di-Pertuan Agong,TIADA,,,,,bumiputera,TIADA,Ahli Dewan Negara,,,1986-02-18,1989-02-17
80,7,Ainon Ariffin,TIADA,BN - UMNO,Dilantik Yang di-Pertuan Agong,TIADA,,,,,bumiputera,TIADA,Ahli Dewan Negara,,,1989-03-27,1992-03-26
80,8,Ainon Ariffin,TIADA,BN - UMNO,Dilantik Yang di-Pertuan Agong,TIADA,,,,,bumiputera,TIADA,Ahli Dewan Negara,,,1986-02-18,1989-02-17
80,8,Ainon Ariffin,TIADA,BN - UMNO,Dilantik Yang di-Pertuan Agong,TIADA,,,,,bumiputera,TIADA,Ahli Dewan Negara,,,1989-03-27,1992-03-26
81,1,Aishah Ghani,TIADA,Perikatan - UMNO,Dilantik Yang di-Pertuan Agong,TIADA,,,,,bumiputera,TIADA,Ahli Dewan Negara,,,1962-10-15,1968-10-14
81,2,Aishah Ghani,TIADA,Perikatan - UMNO,Dilantik Yang di-Pertuan Agong,TIADA,,,,,bumiputera,TIADA,Ahli Dewan Negara,,,1962-10-15,1968-10-14
81,2,Aishah Ghani,TIADA,Perikatan - UMNO,Dilantik Yang di-Pertuan Agong,TIADA,,,,,bumiputera,TIADA,Ahli Dewan Negara,,,1968-10-22,
81,3,Aishah Ghani,TIADA,Perikatan - UMNO,Dilantik Yang di-Pertuan Agong,TIADA,,,,,bumiputera,TIADA,Ahli Dewan Negara,,,1962-10-15,1968-10-14
81,3,Aishah Ghani,TIADA,Perikatan - UMNO,Dilantik Yang di-Pertuan Agong,TIADA,,,,,bumiputera,TIADA,Ahli Dewan Negara,,,1968-10-22,1974-10-21
82,14,Ajis bin Sitin,YB Senator Dato',UMNO,Dipilih oleh Dewan Undangan Negeri,Pahang,,,,M,bumiputera,TIADA,Ahli Dewan Negara,,25.08.2021 - 24.08.2024,2021-08-25,2024-08-24
83,14,Ak Nan A/L Eh Took,YB Senator Tuan,BERSATU,Dilantik Yang di-Pertuan Agong,TIADA,,,,M,indian,TIADA,Ahli Dewan Negara,,15.12.2016 - 14.12.2019,2016-12-15,2019-12-14
84,13,Aknan A/L Ehtook,YB Senator Tuan,Wakil Masyarakat Siam,Dilantik Yang di-Pertuan Agong,TIADA,,,,M,indian,TIADA,Ahli Dewan Negara,,15.12.2016 - 14.12.2019,2016-12-15,2019-12-14
85,5,Alexander Y. L. Lee,TIADA,BN - MCA,Dilantik Yang di-Pertuan Agong,TIADA,,,,,chinese,TIADA,Ahli Dewan Negara,,,1979-05-11,1982-05-10
85,6,Alexander Y. L. Lee,TIADA,BN - MCA,Dilantik Yang di-Pertuan Agong,TIADA,,,,,chinese,TIADA,Ahli Dewan Negara,,,1979-05-11,1982-05-10
85,6,Alexander Y. L. Lee,TIADA,BN - MCA,Dilantik Yang di-Pertuan Agong,TIADA,,,,,chinese,TIADA,Ahli Dewan Negara,,,1982-07-19,1985-07-18
86,4,Ali Ahmad,TIADA,BN - UMNO,Dipilih oleh Dewan Undangan Negeri,Perlis,,,,,bumiputera,TIADA,Ahli Dewan Negara,,,1977-08-03,1980-08-02
87,3,Ali Ismail,TIADA,Perikatan - UMNO,Dipilih oleh Dewan Undangan Negeri,Kedah,,,,,bumiputera,TIADA,Ahli Dewan Negara,,,1971-12-20,1977-12-19
88,1,Amaluddin Darus,TIADA,PAS,Dipilih oleh Dewan Undangan Negeri,Kelantan,,,,,bumiputera,TIADA,Ahli Dewan Negara,,,1959-09-11,1965-09-10
88,2,Amaluddin Darus,TIADA,PMIP,Dipilih oleh Dewan Undangan Negeri,Kelantan,,,,,bumiputera,TIADA,Ahli Dewan Negara,,,1959-09-11,1965-09-10
88,2,Amaluddin Darus,TIADA,PMIP,Dipilih oleh Dewan Undangan Negeri,Kelantan,,,,,bumiputera,TIADA,Ahli Dewan Negara,,,1968-10-22,1974-10-21
88,3,Amaluddin Darus,TIADA,PAS,Dipilih oleh Dewan Undangan Negeri,Kelantan,,,,,bumiputera,TIADA,Ahli Dewan Negara,,,1968-10-22,1974-10-21
89,15,Amir Hamzah Azizan,YB Senator Datuk Seri,PROFESIONAL,Dilantik Yang di-Pertuan Agong,TIADA,,,,M,bumiputera,Menteri Kewangan Dua (2),Ahli Dewan Negara,,12.12.2023 - 11.12.2026,2023-12-12,2026-12-11
90,15,Amir bin Md Ghazali,YB Senator Tuan,PKR,Dipilih oleh Dewan Undangan Negeri,Pulau Pinang,,,,M,bumiputera,TIADA,Ahli Dewan Negara,,07.03.2023 - 06.03.2026,2023-03-07,2026-03-06
91,13,Ananthan A/L Somasundaram,YB. Senator Dato' Dr.,BN - MIC,Dipilih oleh Dewan Undangan Negeri,Kedah,,,,M,indian,TIADA,TIADA,,15.08.2017 - 14.08.2020,2017-08-15,2020-08-14
92,2,Andrew Jika Landau,TIADA,PESAKA,Dilantik Yang di-Pertuan Agong,TIADA,,,,,other,TIADA,Ahli Dewan Negara,,,1964-05-18,1965-08-16
92,2,Andrew Jika Landau,TIADA,PESAKA,Dilantik Yang di-Pertuan Agong,TIADA,,,,,other,TIADA,Ahli Dewan Negara,,,1965-10-18,
92,3,Andrew Jika Landau,TIADA,TIADA,Dilantik Yang di-Pertuan Agong,TIADA,,,,,other,TIADA,Ahli Dewan Negara,,,1964-05-18,1970-05-17
92,3,Andrew Jika Landau,TIADA,TIADA,Dilantik Yang di-Pertuan Agong,TIADA,,,,,other,TIADA,Ahli Dewan Negara,,,1965-10-18,1971-10-17
93,15,Anifah bin Aman @ Haniff Amman,YB Senator Tan Sri Datuk Seri Panglima,PCS,Dilantik Yang di-Pertuan Agong,TIADA,,,,M,bumiputera,TIADA,Ahli Dewan Negara,,20.03.2023 - 19.03.2026,2023-03-20,2026-03-19
94,15,Anna Bell @ Suzieana binti Perian,YB Senator Puan,GRS,Dilantik Yang di-Pertuan Agong,TIADA,,,,M,bumiputera,TIADA,Ahli Dwan Negara,,05.03.2024 - 04.03.2027,2024-03-05,2027-03-04
95,7,Annuar Musa,TIADA,BN - UMNO,Dilantik Yang di-Pertuan Agong,TIADA,,,,,bumiputera,TIADA,Ahli Dewan Negara,,,1990-12-17,1993-12-16
95,8,Annuar Musa,TIADA,BN - UMNO,Dilantik Yang di-Pertuan Agong,TIADA,,,,,bumiputera,TIADA,Ahli Dewan Negara,,,1990-12-17,1993-12-16
95,8,Annuar Musa,TIADA,BN - UMNO,Dilantik Yang di-Pertuan Agong,TIADA,,,,,bumiputera,TIADA,Ahli Dewan Negara,,,1993-10-27,1996-10-26
96,10,Appala Naidu Rajoo,TIADA,BN - MIC,Dilantik Yang di-Pertuan Agong,TIADA,,,,,other,TIADA,Ahli Dewan Negara,,,2001-05-22,2004-05-21
97,7,Appointed,TIADA,TIADA,Dilantik Yang di-Pertuan Agong,TIADA,,,,,other,TIADA,Ahli Dewan Negara,,,,
98,5,Ariffin Salleh,TIADA,BN - UMNO,Dilantik Yang di-Pertuan Agong,TIADA,,,,,bumiputera,TIADA,Ahli Dewan Negara,,,1979-04-08,1982-04-07
98,6,Ariffin Salleh,TIADA,BN - UMNO,Dilantik Yang di-Pertuan Agong,TIADA,,,,,bumiputera,TIADA,Ahli Dewan Negara,,,1979-04-08,1982-04-07
98,6,Ariffin Salleh,TIADA,BN - UMNO,Dilantik Yang di-Pertuan Agong,TIADA,,,,,bumiputera,TIADA,Ahli Dewan Negara,,,1982-07-19,1985-07-18
99,12,Ariffin bin S.M. Omar,YB Senator Dr.,DAP,Dipilih oleh Dewan Undangan Negeri,Pulau Pinang,,,,M,bumiputera,TIADA,TIADA,,01.06.2012 - 31.05.2015,2012-06-01,2015-05-31
99,13,Ariffin bin S.M. Omar,YB Senator Dr.,DAP,Dipilih oleh Dewan Undangan Negeri,Pulau Pinang,,,,M,bumiputera,TIADA,TIADA,,01.06.2012 - 31.05.2015,2012-06-01,2015-05-31
100,14,Arman Azha bin Abu Hanifah,YB Senator Dato',BN - UMNO,Dilantik Yang di-Pertuan Agong,TIADA,,,,M,bumiputera,TIADA,Ahli Dewan Negara,,26.10.2021 - 25.10.2024,2021-10-26,2024-10-25
101,11,Armani Mahiruddin,TIADA,BN - UMNO,Dipilih oleh Dewan Undangan Negeri,Sabah,,,,,bumiputera,TIADA,Ahli Dewan Negara,,,2005-12-20,2008-12-19
102,11,Arzmi Abd Hamid,TIADA,BN - UMNO,Dipilih oleh Dewan Undangan Negeri,Kedah,,,,,bumiputera,TIADA,Ahli Dewan Negara,,,,
103,10,Arzmi Abdul Hamid,TIADA,BN - UMNO,Dipilih oleh Dewan Undangan Negeri,Kedah,,,,,bumiputera,TIADA,Ahli Dewan Negara,,,,
104,7,Asmah Ismail,TIADA,BN - UMNO,Dipilih oleh Dewan Undangan Negeri,Pahang,,,,,bumiputera,TIADA,Ahli Dewan Negara,,,1990-06-25,1993-06-24
104,8,Asmah Ismail,TIADA,BN - UMNO,Dipilih oleh Dewan Undangan Negeri,Pahang,,,,,bumiputera,TIADA,Ahli Dewan Negara,,,1990-06-25,1993-06-24
105,1,Athi Nahappan,TIADA,Perikatan - MIC,Dilantik Yang di-Pertuan Agong,TIADA,,,,,indian,TIADA,Ahli Dewan Negara,,,1959-12-05,1965-12-04
105,2,Athi Nahappan,TIADA,Perikatan - MIC,Dilantik Yang di-Pertuan Agong,TIADA,,,,,indian,TIADA,Ahli Dewan Negara,,,1959-12-05,
105,2,Athi Nahappan,TIADA,Perikatan - MIC,Dilantik Yang di-Pertuan Agong,TIADA,,,,,indian,TIADA,Ahli Dewan Negara,,,1968-10-22,
105,3,Athi Nahappan,TIADA,Perikatan - MIC,Dilantik Yang di-Pertuan Agong,TIADA,,,,,indian,TIADA,Ahli Dewan Negara,,,,1968-01-01
105,3,Athi Nahappan,TIADA,Perikatan - MIC,Dilantik Yang di-Pertuan Agong,TIADA,,,,,indian,TIADA,Ahli Dewan Negara,,,1968-10-22,1974-10-21
105,4,Athi Nahappan,TIADA,BN - MIC,Dilantik Yang di-Pertuan Agong,TIADA,,,,,indian,TIADA,Ahli Dewan Negara,,,,1968-01-01
105,4,Athi Nahappan,TIADA,BN - MIC,Dilantik Yang di-Pertuan Agong,TIADA,,,,,indian,TIADA,Ahli Dewan Negara,,,1968-10-22,1971-10-21
105,4,Athi Nahappan,TIADA,BN - MIC,Dilantik Yang di-Pertuan Agong,TIADA,,,,,indian,TIADA,Ahli Dewan Negara,,,1975-01-06,1976-05-09
106,15,Awang Bemee bin Awang Ali Basah,YB Senator Dato,PBB,Dilantik Yang di-Pertuan Agong,TIADA,,,,M, bumiputera,TIADA,Yang di-Pertua Dewan Negara,,15.07.2024 - 14.07.2027,2024-07-15,2027-07-14
107,2,Awang Daud Matusin,TIADA,Bumiputera,Dilantik Yang di-Pertuan Agong,TIADA,,,,, bumiputera,TIADA,Ahli Dewan Negara,,,1964-10-19,
107,3,Awang Daud Matusin,TIADA,TIADA,Dilantik Yang di-Pertuan Agong,TIADA,,,,, bumiputera,TIADA,Ahli Dewan Negara,,,1964-10-19,1970-10-18
107,3,Awang Daud Matusin,TIADA,TIADA,Dilantik Yang di-Pertuan Agong,TIADA,,,,, bumiputera,TIADA,Ahli Dewan Negara,,,1971-02-20,1977-02-19
108,15,Awang bin Sariyan,YB Senator Datuk Seri Prof. Emeritus Dr.,PROFESIONAL,Dilantik Yang di-Pertuan Agong,TIADA,,,,M,bumiputera,TIADA,Ahli Dewan Negara,,20.03.2023 - 19.03.2026,2023-03-20,2026-03-19
109,15,Azahar bin Hassan,YB Senator Tuan,BERSATU,Dipilih oleh Dewan Undangan Negeri,Perlis,,,,M,bumiputera,TIADA,Ahli Dewan Negara,,10.09.2024 - 09.09.2027,2024-09-10,2027-09-09
110,14,Azhar Bin Ahmad,YB Senator Datuk Dr.,BN - UMNO,Dilantik Yang di-Pertuan Agong,TIADA,,,,M,bumiputera,TIADA,Ahli Dewan Negara,,21.03.2022 - 20.03.2025,2022-03-21,2025-03-20
110,15,Azhar bin Ahmad,YB Senator Datuk Dr.,UMNO,Dilantik Yang di-Pertuan Agong,TIADA,,,,M,bumiputera,TIADA,Ahli Dewan Negara,,21.03.2022 - 20.03.2025,2022-03-21,2025-03-20
111,14,Aziz bin Ariffin,YB Senator Tuan Haji,UMNO,Dipilih oleh Dewan Undangan Negeri,Perlis,,,,M,bumiputera,TIADA,Ahli Dewan Negara,,26.08.2021 - 25.08.2024,2021-08-26,2024-08-25
112,11,Azizah Abdul Samad,TIADA,BN - UMNO,Dilantik Yang di-Pertuan Agong,TIADA,,,,,bumiputera,TIADA,Ahli Dewan Negara,,,2004-08-26,2007-08-25
113,10,Azizah Mohd Dun,TIADA,BN - UMNO,Dilantik Yang di-Pertuan Agong,TIADA,,,,,bumiputera,TIADA,Ahli Dewan Negara,,,2000-07-04,2003-07-03
113,10,Azizah Mohd Dun,TIADA,BN - UMNO,Dilantik Yang di-Pertuan Agong,TIADA,,,,,bumiputera,TIADA,Ahli Dewan Negara,,,2003-08-12,2006-08-11
114,6,Azizah Mohd. Said,TIADA,BN - UMNO,Dilantik Yang di-Pertuan Agong,TIADA,,,,,bumiputera,TIADA,Ahli Dewan Negara,,,1985-07-29,1988-07-28
114,7,Azizah Mohd. Said,TIADA,BN - UMNO,Dilantik Yang di-Pertuan Agong,TIADA,,,,,bumiputera,TIADA,Ahli Dewan Negara,,,1985-07-29,1988-07-28
115,13,Azizah binti Haji Harun,YB Senator Puan Hajah,BN - UMNO,Dilantik Yang di-Pertuan Agong,TIADA,,,,M,bumiputera,TIADA,TIADA,,06.07.2015 - 05.07.2018,2015-07-06,2018-07-05
116,5,Azlan Kinjawan @ Philip Meja,TIADA,TIADA,Dilantik Yang di-Pertuan Agong,TIADA,,,,,bumiputera,TIADA,Ahli Dewan Negara,,,1979-04-06,1982-04-05
117,11,Azlan Osman,TIADA,BN - UMNO,Dipilih oleh Dewan Undangan Negeri,Perak,,,,,bumiputera,TIADA,Ahli Dewan Negara,,,2006-11-14,2009-11-13
118,7,Azman Atar Othman,TIADA,BN - UMNO,Dilantik Yang di-Pertuan Agong,TIADA,,,,,bumiputera,TIADA,Ahli Dewan Negara,,,1987-02-23,1990-02-22
118,7,Azman Atar Othman,TIADA,BN - UMNO,Dilantik Yang di-Pertuan Agong,TIADA,,,,,bumiputera,TIADA,Ahli Dewan Negara,,,1990-03-19,1993-03-18
118,8,Azman Attar Othman,TIADA,BN - UMNO,Dilantik Yang di-Pertuan Agong,TIADA,,,,,bumiputera,TIADA,Ahli Dewan Negara,,,1987-02-23,1990-02-22
118,8,Azman Attar Othman,TIADA,BN - UMNO,Dilantik Yang di-Pertuan Agong,TIADA,,,,,bumiputera,TIADA,Ahli Dewan Negara,,,1990-03-19,1993-03-18
119,7,Azumu Tak,TIADA,BN - UMNO,Dipilih oleh Dewan Undangan Negeri,Perak,,,,,bumiputera,TIADA,Ahli Dewan Negara,,,1987-11-30,1990-11-29
119,8,Azumu Tak,TIADA,BN - UMNO,Dipilih oleh Dewan Undangan Negeri,Perak,,,,,bumiputera,TIADA,Ahli Dewan Negara,,,1987-11-30,1990-11-29
120,15,Baharuddin bin Ahmad,YB Senator Tuan Haji,PAS,Dipilih oleh Dewan Undangan Negeri,Perlis,,,,M,bumiputera,TIADA,Ahli Dewan Negara,,10.09.2024 - 09.09.2027,2024-09-10,2027-09-09
121,12,Baharudin bin Hj. Abu Bakar,YB Senator Tuan,BN - UMNO,Dilantik Yang di-Pertuan Agong,TIADA,,,,M,bumiputera,TIADA,TIADA,,06.09.2011 - 05.09.2014,2011-09-06,2014-09-05
122,9,Bakri Ali Mahamad,TIADA,BN - UMNO,Dipilih oleh Dewan Undangan Negeri,Kedah,,,,,bumiputera,TIADA,Ahli Dewan Negara,Kedua,,1998-12-07,2001-12-06
122,10,Bakri Ali Mahamad,TIADA,BN - UMNO,Dipilih oleh Dewan Undangan Negeri,Kedah,,,,,bumiputera,TIADA,Ahli Dewan Negara,,,1995-12-13,1998-12-12
122,10,Bakri Ali Mahamad,TIADA,BN - UMNO,Dipilih oleh Dewan Undangan Negeri,Kedah,,,,,bumiputera,TIADA,Ahli Dewan Negara,,,1998-12-07,2001-12-06
123,7,Balaram Pethanaidu,TIADA,BN - MIC,Dipilih oleh Dewan Undangan Negeri,Kedah,,,,,other,TIADA,Ahli Dewan Negara,,,1988-07-11,1991-07-10
123,8,Balaram Pethanaidu,TIADA,BN - MIC,Dipilih oleh Dewan Undangan Negeri,Kedah,,,,,other,TIADA,Ahli Dewan Negara,,,1988-07-11,1991-07-10
124,14,Balasubramaniam A/L Nachiappan,YB Senator Tuan,PAS,Dilantik Yang di-Pertuan Agong,TIADA,,,,M,indian,TIADA,Ahli Dewan Negara,,16.06.2020 - 15.06.2023,2020-06-16,2023-06-15
125,5,Basharon Hanapiah,TIADA,BN - UMNO,Dilantik Yang di-Pertuan Agong,TIADA,,,,,bumiputera,TIADA,Ahli Dewan Negara,,,1981-12-09,1984-12-08
126,13,Bashir bin Haji Alias,YB. Senator Datuk Haji,BN - UMNO,Dilantik Yang di-Pertuan Agong,TIADA,,,,M,bumiputera,TIADA,TIADA,,05.06.2017 - 04.06.2020,2017-06-05,2020-06-04
127,13,Bathmavathi Krishnan,YB Senator Puan,Wakil OKU,Dilantik Yang di-Pertuan Agong,TIADA,,,,M,indian,TIADA,TIADA,,18.11.2013 - 17.11.2016,2013-11-18,2016-11-17
128,6,Bee Yang Sek,TIADA,BN - MCA,Dipilih oleh Dewan Undangan Negeri,Kedah,,,,,chinese,TIADA,Ahli Dewan Negara,,,1985-07-29,1988-07-28
128,7,Bee Yang Sek,TIADA,BN - MCA,Dipilih oleh Dewan Undangan Negeri,Kedah,,,,,chinese,TIADA,Ahli Dewan Negara,,,1985-07-29,1988-07-28
129,10,Benedict Bujang Tembak,TIADA,BN - PBB,Dipilih oleh Dewan Undangan Negeri,Sarawak,,,,,bumiputera,TIADA,Ahli Dewan Negara,,,1999-12-27,2002-12-26
129,10,Benedict Bujang Tembak,TIADA,BN - PBB,Dipilih oleh Dewan Undangan Negeri,Sarawak,,,,,bumiputera,TIADA,Ahli Dewan Negara,,,2002-11-18,2005-11-17
129,11,Benedict Bujang Tembak,TIADA,BN - PBB,Dipilih oleh Dewan Undangan Negeri,Sarawak,,,,,bumiputera,TIADA,Ahli Dewan Negara,,,1999-12-27,2002-12-26
129,11,Benedict Bujang Tembak,TIADA,BN - PBB,Dipilih oleh Dewan Undangan Negeri,Sarawak,,,,,bumiputera,TIADA,Ahli Dewan Negara,,,2002-11-18,2005-11-17
130,6,Benedict Stephens,TIADA,TIADA,Dilantik Yang di-Pertuan Agong,TIADA,,,,,other,TIADA,Ahli Dewan Negara,,,1985-04-12,1988-04-11
130,7,Benedict Stephens,TIADA,TIADA,Dilantik Yang di-Pertuan Agong,TIADA,,,,,other,TIADA,Ahli Dewan Negara,,,1985-04-12,1988-04-11
131,2,Bibi Aishah Hamid Don,TIADA,Perikatan - UMNO,Dilantik Yang di-Pertuan Agong,TIADA,,,,,bumiputera,TIADA,Ahli Dewan Negara,,,1964-10-19,
132,14,Bobbey Ah Fang Bin Suan,YB Senator Datuk,BERSATU,Dipilih oleh Dewan Undangan Negeri,Sabah,,,,M,bumiputera,TIADA,Ahli Dewan Negara,,05.01.2021 - 04.01.2024,2021-01-05,2024-01-04
132,15,Bobbey Ah Fang bin Suan,YB Senator Datuk,GRS,Dipilih oleh Dewan Undangan Negeri,Sabah,,,,M,bumiputera,TIADA,Ahli Dewan Negara,,05.01.2021 - 04.01.2024,2021-01-05,2024-01-04
133,12,Boon Som a/l Inong,YB Senator Dato',BN - UMNO,Dilantik Yang di-Pertuan Agong,TIADA,,,,M,indian,TIADA,TIADA,,15.12.2010 - 14.12.2013,2010-12-15,2013-12-14
134,2,C. D. Ismail,TIADA,Perikatan - UMNO,Dilantik Yang di-Pertuan Agong,TIADA,,,,,bumiputera,TIADA,Ahli Dewan Negara,,,1964-09-11,
134,3,C. D. Ismail,TIADA,Perikatan - UMNO,Dilantik Yang di-Pertuan Agong,TIADA,,,,,bumiputera,TIADA,Ahli Dewan Negara,,,1964-09-11,1970-09-10
134,3,C. D. Ismail,TIADA,Perikatan - UMNO,Dilantik Yang di-Pertuan Agong,TIADA,,,,,bumiputera,TIADA,Ahli Dewan Negara,,,1971-02-20,1977-02-19
134,4,C. D. Ismail,TIADA,BN - UMNO,Dilantik Yang di-Pertuan Agong,TIADA,,,,,bumiputera,TIADA,Ahli Dewan Negara,,,1964-09-11,1967-09-10
134,4,C. D. Ismail,TIADA,BN - UMNO,Dilantik Yang di-Pertuan Agong,TIADA,,,,,bumiputera,TIADA,Ahli Dewan Negara,,,1971-02-20,1974-02-19
135,7,C. Krishnan,TIADA,BN - MIC,Dilantik Yang di-Pertuan Agong,TIADA,,,,,indian,TIADA,Ahli Dewan Negara,,,1986-12-15,1989-12-14
135,7,C. Krishnan,TIADA,BN - MIC,Dilantik Yang di-Pertuan Agong,TIADA,,,,,indian,TIADA,Ahli Dewan Negara,,,1989-12-18,1992-12-17
135,8,C. Krishnan,TIADA,BN - MIC,Dilantik Yang di-Pertuan Agong,TIADA,,,,,indian,TIADA,Ahli Dewan Negara,,,1986-12-15,1989-12-14
135,8,C. Krishnan,TIADA,BN - MIC,Dilantik Yang di-Pertuan Agong,TIADA,,,,,indian,TIADA,Ahli Dewan Negara,,,1989-12-18,1992-12-17
136,6,C. Selvarajah,TIADA,BN - MIC,Dilantik Yang di-Pertuan Agong,TIADA,,,,,indian,TIADA,Ahli Dewan Negara,,,1983-12-05,1986-12-04
136,7,C. Selvarajah,TIADA,BN - MIC,Dilantik Yang di-Pertuan Agong,TIADA,,,,,indian,TIADA,Ahli Dewan Negara,,,1983-12-05,1986-12-04
137,4,C. Sinnadurai,TIADA,BN - MIC,Dilantik Yang di-Pertuan Agong,TIADA,,,,,indian,TIADA,Ahli Dewan Negara,,,1975-01-06,1978-01-05
137,5,C. Sinnadurai,TIADA,BN - MIC,Dilantik Yang di-Pertuan Agong,TIADA,,,,,indian,TIADA,Ahli Dewan Negara,,,1975-01-06,1978-01-05
137,5,C. Sinnadurai,TIADA,BN - MIC,Dilantik Yang di-Pertuan Agong,TIADA,,,,,indian,TIADA,Ahli Dewan Negara,,,1980-12-15,1983-12-14
138,13,Chai Kim Sen,YB Senator Dato`,BN - MCA,Dilantik Yang di-Pertuan Agong,TIADA,,,,M,chinese,TIADA,TIADA,,23.06.2014 - 22.06.2017,2014-06-23,2017-06-22
139,6,Chan Choong Tak,TIADA,BN - MCA,Dilantik Yang di-Pertuan Agong,TIADA,,,,,chinese,TIADA,Ahli Dewan Negara,,,1986-02-18,1989-02-17
139,7,Chan Choong Tak,TIADA,BN - MCA,Dilantik Yang di-Pertuan Agong,TIADA,,,,,chinese,TIADA,Ahli Dewan Negara,,,1986-02-18,1989-02-17
139,7,Chan Choong Tak,TIADA,BN - MCA,Dilantik Yang di-Pertuan Agong,TIADA,,,,,chinese,TIADA,Ahli Dewan Negara,,,1989-04-03,1992-04-02
139,8,Chan Choong Tak,TIADA,BN - MCA,Dilantik Yang di-Pertuan Agong,TIADA,,,,,chinese,TIADA,Ahli Dewan Negara,,,1986-02-18,1989-02-17
139,8,Chan Choong Tak,TIADA,BN - MCA,Dilantik Yang di-Pertuan Agong,TIADA,,,,,chinese,TIADA,Ahli Dewan Negara,,,1989-04-03,1992-04-02
140,2,Chan Keong Hon,TIADA,Perikatan - MCA,Dilantik Yang di-Pertuan Agong,TIADA,,,,,chinese,TIADA,Ahli Dewan Negara,,,1965-12-18,
141,1,Chan Kwong Hon,TIADA,Perikatan - MCA,Dipilih oleh Dewan Undangan Negeri,Selangor,,,,,chinese,TIADA,Ahli Dewan Negara,,,1959-09-11,1965-09-10
141,2,Chan Kwong Hon,TIADA,Perikatan - MCA,Dipilih oleh Dewan Undangan Negeri,Selangor,,,,,chinese,TIADA,Ahli Dewan Negara,,,1959-09-11,1965-09-10
141,2,Chan Kwong Hon,TIADA,Perikatan - MCA,Dipilih oleh Dewan Undangan Negeri,Selangor,,,,,chinese,TIADA,Ahli Dewan Negara,,,1965-12-18,1971-12-17
141,3,Chan Kwong Hon,TIADA,Perikatan - MCA,Dipilih oleh Dewan Undangan Negeri,Selangor,,,,,chinese,TIADA,Ahli Dewan Negara,,,1965-12-18,1971-12-17
141,4,Chan Kwong Hon,TIADA,BN - MCA,Dipilih oleh Dewan Undangan Negeri,Selangor,,,,,chinese,TIADA,Ahli Dewan Negara,,,1965-12-18,1968-12-17
141,4,Chan Kwong Hon,TIADA,BN - MCA,Dipilih oleh Dewan Undangan Negeri,Selangor,,,,,chinese,TIADA,Ahli Dewan Negara,,,,1978-05-29
142,12,Chandra Mohan a/l S. Tambirajah,YB Senator Tuan,DAP,,TIADA,,,,M,indian,TIADA,TIADA,,17.12.2012 - 16.12.2015,2012-12-17,2015-12-16
142,13,Chandra Mohan a/l S. Thambirajah,YB Senator Tuan,DAP,Dipilih oleh Dewan Undangan Negeri,Selangor,,,,M,indian,TIADA,TIADA,,17.12.2012 - 16.12.2015,2012-12-17,2015-12-16
143,9,Charern Intachat,TIADA,BN - UMNO,Dilantik Yang di-Pertuan Agong,TIADA,,,,,other,Orang Siam,Ahli Dewan Negara,,,1999-05-19,2002-05-18
143,10,Charern Intachat,TIADA,BN - UMNO,Dilantik Yang di-Pertuan Agong,TIADA,,,,,other,TIADA,Ahli Dewan Negara,,,1996-05-14,1999-05-13
143,10,Charern Intachat,TIADA,BN - UMNO,Dilantik Yang di-Pertuan Agong,TIADA,,,,,other,TIADA,Ahli Dewan Negara,,,1999-05-19,2002-05-18
144,9,Charlie Chau-Lap Chang,TIADA,BN - MCA,Dilantik Yang di-Pertuan Agong,TIADA,,,,,other,TIADA,Ahli Dewan Negara,,,1999-07-27,2002-07-26
144,10,Charlie Chau-Lap Chang,TIADA,BN - MCA,Dilantik Yang di-Pertuan Agong,TIADA,,,,,other,TIADA,Ahli Dewan Negara,,,1999-07-27,2002-07-26
145,15,Che Alias bin Hamid,YB Senator Tuan,PAS,Dipilih oleh Dewan Undangan Negeri,Terengganu,,,,M,bumiputera,TIADA,TIADA,,21.11.2024 - 20.11.2027,2024-11-21,2027-11-20
146,9,Che Jam Haron,TIADA,BN - UMNO,Dilantik Yang di-Pertuan Agong,TIADA,,,,,bumiputera,TIADA,Ahli Dewan Negara,,,1999-07-27,2002-07-26
146,10,Che Jam Haron,TIADA,BN - UMNO,Dilantik Yang di-Pertuan Agong,TIADA,,,,,bumiputera,TIADA,Ahli Dewan Negara,,,1999-07-27,2002-07-26
146,11,Che Jam Haron,TIADA,BN - UMNO,Dilantik Yang di-Pertuan Agong,TIADA,,,,,bumiputera,TIADA,Ahli Dewan Negara,,,1999-07-27,2002-07-26
147,8,Che Pora Omar,TIADA,BN - UMNO,Dilantik Yang di-Pertuan Agong,TIADA,,,,,bumiputera,TIADA,Ahli Dewan Negara,,,1991-02-21,1994-02-20
147,8,Che Pora Omar,TIADA,BN - UMNO,Dilantik Yang di-Pertuan Agong,TIADA,,,,,bumiputera,TIADA,Ahli Dewan Negara,,,1994-03-31,1997-03-30
148,1,Cheah Seng Khim,TIADA,Perikatan - MCA,Dipilih oleh Dewan Undangan Negeri,Pulau Pinang,,,,,chinese,TIADA,Ahli Dewan Negara,,,1959-09-11,1965-09-10
148,2,Cheah Seng Khim,TIADA,Perikatan - MCA,Dipilih oleh Dewan Undangan Negeri,Pulau Pinang,,,,,chinese,TIADA,Ahli Dewan Negara,,,1959-09-11,1965-09-10
148,2,Cheah Seng Khim,TIADA,Perikatan - MCA,Dipilih oleh Dewan Undangan Negeri,Pulau Pinang,,,,,chinese,TIADA,Ahli Dewan Negara,,,1965-10-18,1971-10-17
149,1,Cheah Toon Lok,TIADA,Perikatan - MCA,Dilantik Yang di-Pertuan Agong,TIADA,,,,,chinese,TIADA,Ahli Dewan Negara,,,1959-09-11,1965-09-10
149,2,Cheah Toon Lok,TIADA,Perikatan - MCA,Dilantik Yang di-Pertuan Agong,TIADA,,,,,chinese,TIADA,Ahli Dewan Negara,,,1959-09-11,
149,2,Cheah Toon Lok,TIADA,Perikatan - MCA,Dilantik Yang di-Pertuan Agong,TIADA,,,,,chinese,TIADA,Ahli Dewan Negara,,,1968-10-22,
149,3,Cheah Toon Lok,TIADA,Perikatan - MCA,Dilantik Yang di-Pertuan Agong,TIADA,,,,,chinese,TIADA,Ahli Dewan Negara,,,,1968-01-01
149,3,Cheah Toon Lok,TIADA,Perikatan - MCA,Dilantik Yang di-Pertuan Agong,TIADA,,,,,chinese,TIADA,Ahli Dewan Negara,,,1968-10-22,1974-10-21
150,9,Chet Singh Karam Singh,TIADA,BN - Gerakan,Dipilih oleh Dewan Undangan Negeri,Pulau Pinang,,,,,other,TIADA,Ahli Dewan Negara,,,1996-12-16,1999-12-15
151,12,Chew Lee Giok,YB Senator Puan,BN - MCA,Dilantik Yang di-Pertuan Agong,TIADA,,,,F,chinese,TIADA,TIADA,,13.12.2010 - 12.12.2013,2010-12-13,2013-12-12
152,9,Chew Poh Thoi,TIADA,BN - MCA,Dilantik Yang di-Pertuan Agong,TIADA,,,,,chinese,TIADA,Ahli Dewan Negara,,,,
152,10,Chew Poh Thoi,TIADA,BN - MCA,Dilantik Yang di-Pertuan Agong,TIADA,,,,,chinese,TIADA,Ahli Dewan Negara,,,,
153,11,Chew Vun Ming,TIADA,BN - MCA,Dilantik Yang di-Pertuan Agong,TIADA,,,,,chinese,TIADA,Ahli Dewan Negara,,,2006-02-22,2009-02-21
154,11,Chiam Yong Tee,TIADA,BN - MCA,Dipilih oleh Dewan Undangan Negeri,Perak,,,,,chinese,TIADA,Ahli Dewan Negara,,,2004-01-08,2007-01-07
155,12,Chiew Lian Keng,YB Senator Tuan,BN - MCA,Dilantik Yang di-Pertuan Agong,TIADA,,,,M,chinese,TIADA,TIADA,,02.11.2011 - 01.11.2014,2011-11-02,2014-11-01
156,10,Chin Fook Weng,TIADA,BN - Gerakan,Dipilih oleh Dewan Undangan Negeri,Penang,,,,,chinese,TIADA,Ahli Dewan Negara,,,,
156,11,Chin Fook Weng,TIADA,BN - Gerakan,Dipilih oleh Dewan Undangan Negeri,Penang,,,,,chinese,TIADA,Ahli Dewan Negara,,,,
157,5,Chin Kim Yoong,TIADA,BN - MCA,Dipilih oleh Dewan Undangan Negeri,Perak,,,,,chinese,TIADA,Ahli Dewan Negara,,,1981-06-22,1984-06-21
158,12,Chin Su Phin,YB Senator Datuk,BN - LDP,Dilantik Yang di-Pertuan Agong,TIADA,,,,M,chinese,TIADA,TIADA,,30.05.2011 - 29.05.2014,2011-05-30,2014-05-29
159,11,Chiw Tiang Chai,TIADA,BN - PPP,Dilantik Yang di-Pertuan Agong,TIADA,,,,,chinese,TIADA,Ahli Dewan Negara,,,2005-10-14,2008-10-13
159,12,Chiw Tiang Chai,YB Senator Datuk,BN - PPP,Dilantik Yang di-Pertuan Agong,TIADA,,,,M,chinese,TIADA,TIADA,,22.08.2011 - 21.08.2014,2011-08-22,2014-08-21
160,7,Chong Chi Siong,TIADA,BN - MCA,Dipilih oleh Dewan Undangan Negeri,Negeri Sembilan,,,,,chinese,TIADA,Ahli Dewan Negara,,,1989-08-25,1992-08-24
160,8,Chong Chi Siong,TIADA,BN - MCA,Dipilih oleh Dewan Undangan Negeri,Negeri Sembilan,,,,,chinese,TIADA,Ahli Dewan Negara,,,1989-08-25,1992-08-24
161,7,Chong Eng Leong,TIADA,TIADA,Dipilih oleh Dewan Undangan Negeri,Sabah,,,,,chinese,TIADA,Ahli Dewan Negara,,,1988-03-07,1991-03-06
162,2,Chong Foo Khin,TIADA,Perikatan - MCA,Dipilih oleh Dewan Undangan Negeri,Negeri Sembilan,,,,,chinese,TIADA,Ahli Dewan Negara,,,1968-10-22,1974-10-21
162,3,Chong Foo Khin,TIADA,Perikatan - MCA,Dipilih oleh Dewan Undangan Negeri,Negeri Sembilan,,,,,chinese,TIADA,Ahli Dewan Negara,,,1968-10-22,1974-10-21
162,4,Chong Foo Khin,TIADA,BN - MCA,Dipilih oleh Dewan Undangan Negeri,Negri Sembilan,,,,,chinese,TIADA,Ahli Dewan Negara,,,1968-10-22,1971-10-21
162,4,Chong Foo Khin,TIADA,BN - MCA,Dipilih oleh Dewan Undangan Negeri,Negri Sembilan,,,,,chinese,TIADA,Ahli Dewan Negara,,,1975-01-06,1978-01-05
162,5,Chong Foo Khin,TIADA,BN - MCA,Dipilih oleh Dewan Undangan Negeri,Negeri Sembilan,,,,,chinese,TIADA,Ahli Dewan Negara,,,1968-10-22,1971-10-21
162,5,Chong Foo Khin,TIADA,BN - MCA,Dipilih oleh Dewan Undangan Negeri,Negeri Sembilan,,,,,chinese,TIADA,Ahli Dewan Negara,,,1975-01-06,1978-01-05
163,8,Chong Kah Kiat,TIADA,BN - LDP,Dilantik Yang di-Pertuan Agong,TIADA,,,,,chinese,TIADA,Ahli Dewan Negara,,,1994-12-14,1997-12-13
164,4,Choo Ching Hwa,TIADA,BN - MCA,Dilantik Yang di-Pertuan Agong,TIADA,,,,,chinese,TIADA,Ahli Dewan Negara,,,1977-11-09,1980-11-08
164,5,Choo Ching Hwa,TIADA,BN - MCA,Dilantik Yang di-Pertuan Agong,TIADA,,,,,chinese,TIADA,Ahli Dewan Negara,,,1977-11-09,1980-11-08
165,1,Choo Kok Leong,TIADA,Perikatan - MCA,Dilantik Yang di-Pertuan Agong,TIADA,,,,,chinese,TIADA,Ahli Dewan Negara,,,1959-09-11,1965-09-10
165,2,Choo Kok Leong,TIADA,Perikatan - MCA,Dilantik Yang di-Pertuan Agong,TIADA,,,,,chinese,TIADA,Ahli Dewan Negara,,,1959-09-11,1965-08-16
166,5,Choo Kooi Fook,TIADA,BN - MCA,Dilantik Yang di-Pertuan Agong,TIADA,,,,,chinese,TIADA,Ahli Dewan Negara,,,1979-04-06,1982-04-05
167,10,Christina Lorline Tibok @ Christine Vanhouten,TIADA,BN - UPKO,Dipilih oleh Dewan Undangan Negeri,Sabah,,,,,chinese,TIADA,Ahli Dewan Negara,,,2000-07-31,2003-07-30
167,9,Christina Lorline Tibok@ Christine Vanhouten,TIADA,BN - PDS,Dipilih oleh Dewan Undangan Negeri,Sabah,,,,,chinese,TIADA,Ahli Dewan Negara,,,,
168,3,Chua Ching Cheng,TIADA,Perikatan - MCA,Dipilih oleh Dewan Undangan Negeri,Melaka,,,,,chinese,TIADA,Ahli Dewan Negara,,,1971-08-02,1977-08-01
168,4,Chua Ching Cheng,TIADA,BN - MCA,Dipilih oleh Dewan Undangan Negeri,Melaka,,,,,chinese,TIADA,Ahli Dewan Negara,,,1971-08-02,1974-08-01
168,4,Chua Ching Cheng,TIADA,BN - MCA,Dipilih oleh Dewan Undangan Negeri,Melaka,,,,,chinese,TIADA,Ahli Dewan Negara,,,1975-01-06,1978-01-05
168,5,Chua Ching Cheng,TIADA,BN - MCA,Dipilih oleh Dewan Undangan Negeri,Melaka,,,,,chinese,TIADA,Ahli Dewan Negara,,,1971-08-02,1974-08-01
168,5,Chua Ching Cheng,TIADA,BN - MCA,Dipilih oleh Dewan Undangan Negeri,Melaka,,,,,chinese,TIADA,Ahli Dewan Negara,,,1975-01-06,1978-01-05
169,11,Chua Kim Chuan,TIADA,BN - MCA,Dipilih oleh Dewan Undangan Negeri,Kedah,,,,,chinese,TIADA,Ahli Dewan Negara,,,2005-05-03,2008-05-02
170,4,Chua Song Lim,TIADA,BN - MCA,Dipilih oleh Dewan Undangan Negeri,Johor,,,,,chinese,TIADA,Ahli Dewan Negara,,,1978-04-17,1981-04-16
170,5,Chua Song Lim,TIADA,BN - MCA,Dipilih oleh Dewan Undangan Negeri,Johor,,,,,chinese,TIADA,Ahli Dewan Negara,,,1978-04-17,1981-04-16
171,6,D. P. Vijandran,TIADA,BN - MIC,Dilantik Yang di-Pertuan Agong,TIADA,,,,,indian,TIADA,Ahli Dewan Negara,,,1982-12-09,1985-12-08
171,6,D. P. Vijandran,TIADA,BN - MIC,Dilantik Yang di-Pertuan Agong,TIADA,,,,,indian,TIADA,Ahli Dewan Negara,,,1985-12-02,1988-12-01
171,7,D. P. Vijandran,TIADA,BN - MIC,Dilantik Yang di-Pertuan Agong,TIADA,,,,,indian,TIADA,Ahli Dewan Negara,,,1982-12-09,1985-12-08
171,7,D. P. Vijandran,TIADA,BN - MIC,Dilantik Yang di-Pertuan Agong,TIADA,,,,,indian,TIADA,Ahli Dewan Negara,,,1985-12-02,1988-12-01
172,2,D. S. Dorai Raj,TIADA,Perikatan - MIC,Dilantik Yang di-Pertuan Agong,TIADA,,,,,indian,TIADA,Ahli Dewan Negara,,,1964-09-11,1967-03-11
173,1,Da Abdul Jalil Awang,TIADA,PAS,Dipilih oleh Dewan Undangan Negeri,Terengganu,,,,,bumiputera,TIADA,Ahli Dewan Negara,,,1959-09-11,1965-09-10
173,2,Da Abdul Jalil Awang,TIADA,PMIP,Dipilih oleh Dewan Undangan Negeri,Terengganu,,,,,bumiputera,TIADA,Ahli Dewan Negara,,,1959-09-11,1965-09-10
174,7,Dahalan Embun,TIADA,BN - UMNO,Dipilih oleh Dewan Undangan Negeri,Perlis,,,,,bumiputera,TIADA,Ahli Dewan Negara,,,1987-03-23,1990-03-22
174,8,Dahalan Embun,TIADA,BN - UMNO,Dipilih oleh Dewan Undangan Negeri,Perlis,,,,,bumiputera,TIADA,Ahli Dewan Negara,,,1987-03-23,1990-03-22
175,5,Daim Zainuddin,TIADA,BN - UMNO,Dilantik Yang di-Pertuan Agong,TIADA,,,,,bumiputera,TIADA,Ahli Dewan Negara,,,1980-12-15,1983-12-14
176,3,Dasimah Dasir,TIADA,Perikatan - UMNO,Dilantik Yang di-Pertuan Agong,TIADA,,,,,bumiputera,TIADA,Ahli Dewan Negara,,,1971-02-20,1977-02-19
176,4,Dasimah Dasir,TIADA,BN - UMNO,Dilantik Yang di-Pertuan Agong,TIADA,,,,,bumiputera,TIADA,Ahli Dewan Negara,,,1971-02-20,1974-02-19
176,5,Dasimah Dasir,TIADA,BN - UMNO,Dilantik Yang di-Pertuan Agong,TIADA,,,,,bumiputera,TIADA,Ahli Dewan Negara,,,1971-02-20,1974-02-19
176,5,Dasimah Dasir,TIADA,BN - UMNO,Dilantik Yang di-Pertuan Agong,TIADA,,,,,bumiputera,TIADA,Ahli Dewan Negara,,,,1980-10-07
177,12,Datuk Zamani Bin Hj. Sulaiman,TIADA,TIADA,,TIADA,,,,M,bumiputera,TIADA,TIADA,,,,
178,7,David Yeoh Eng Hock,TIADA,BN - MCA,Dilantik Yang di-Pertuan Agong,TIADA,,,,,bumiputera,TIADA,Ahli Dewan Negara,,,1989-10-19,1992-10-18
178,8,David Yeoh Eng Hock,TIADA,BN - MCA,Dilantik Yang di-Pertuan Agong,TIADA,,,,,bumiputera,TIADA,Ahli Dewan Negara,,,1989-10-19,1992-10-18
178,8,David Yeoh Eng Hock,TIADA,BN - MCA,Dilantik Yang di-Pertuan Agong,TIADA,,,,,bumiputera,TIADA,Ahli Dewan Negara,,,1992-10-27,1995-10-26
179,12,Dayang Madinah binti Tun Abang Haji Openg,YB Senator Puan,BN - PBB,Dipilih oleh Dewan Undangan Negeri,Sarawak,,,,M,bumiputera,TIADA,TIADA,,19.07.2010 - 18.07.2013,2010-07-19,2013-07-18
180,10,Dayang Mahani Pengiran Ahmad Raffae,TIADA,BN - UMNO,Dilantik Yang di-Pertuan Agong,TIADA,,,,,bumiputera,TIADA,Ahli Dewan Negara,,,,
180,11,Dayang Mahani Pengiran Ahmad Raffae,TIADA,BN - UMNO,Dilantik Yang di-Pertuan Agong,TIADA,,,,,bumiputera,TIADA,Ahli Dewan Negara,,,2004-07-21,2007-07-20
181,8,Ding Seling,TIADA,BN - PBB,Dilantik Yang di-Pertuan Agong,TIADA,,,,,other,TIADA,Ahli Dewan Negara,,,1991-12-16,1994-12-15
181,8,Ding Seling,TIADA,BN - PBB,Dilantik Yang di-Pertuan Agong,TIADA,,,,,other,TIADA,Ahli Dewan Negara,,,1994-12-14,1997-12-13
182,7,Dol Dollah,TIADA,BN - UMNO,Dipilih oleh Dewan Undangan Negeri,Melaka,,,,,bumiputera,TIADA,Ahli Dewan Negara,,,1989-12-19,1992-12-18
182,8,Dol Dollah,TIADA,BN - UMNO,Dipilih oleh Dewan Undangan Negeri,Melaka,,,,,bumiputera,TIADA,Ahli Dewan Negara,,,1989-12-19,1992-12-18
183,14,Dominic Lau Hoe Chai,YB Senator Datuk Dr.,GERAKAN,Dilantik Yang di-Pertuan Agong,TIADA,,,,M,chinese,TIADA,Ahli Dewan Negara,,23.11.2021 - 22.11.2024,2021-11-23,2024-11-22
184,12,Doris Sophia Ak Brodi,YB Senator Datuk,BN - PRS,Dilantik Yang di-Pertuan Agong,TIADA,,,,F,chinese,TIADA,Timbalan Yang di-Pertua Dewan Negara,,12.03.2010 - 11.03.2013,2010-03-12,2013-03-11
185,7,Douglas Sullang Ganda,TIADA,BN - PBB,Dipilih oleh Dewan Undangan Negeri,Sarawak,,,,,chinese,TIADA,Ahli Dewan Negara,,,1987-11-30,1990-11-29
185,8,Douglas Sullang Ganda,TIADA,BN - PBB,Dipilih oleh Dewan Undangan Negeri,Sarawak,,,,,chinese,TIADA,Ahli Dewan Negara,,,1987-11-30,1990-11-29
186,3,Dzulkifli Abdul Hamid,TIADA,Perikatan - UMNO,Dilantik Yang di-Pertuan Agong,TIADA,,,,,bumiputera,TIADA,Ahli Dewan Negara,,,,
187,1,E. E. C. Thuraisingham,TIADA,TIADA,Dilantik Yang di-Pertuan Agong,TIADA,,,,,indian,TIADA,Ahli Dewan Negara,,,1959-09-11,1965-09-10
187,2,E. E. C. Thuraisingham,TIADA,TIADA,Dilantik Yang di-Pertuan Agong,TIADA,,,,,indian,TIADA,Ahli Dewan Negara,,,1959-09-11,
187,2,E. E. C. Thuraisingham,TIADA,TIADA,Dilantik Yang di-Pertuan Agong,TIADA,,,,,indian,TIADA,Ahli Dewan Negara,,,1968-10-22,
187,3,E. E. C. Thuraisingham,TIADA,TIADA,Dilantik Yang di-Pertuan Agong,TIADA,,,,,indian,TIADA,Ahli Dewan Negara,,,,1968-01-01
187,3,E. E. C. Thuraisingham,TIADA,TIADA,Dilantik Yang di-Pertuan Agong,TIADA,,,,,indian,TIADA,Ahli Dewan Negara,,,1968-10-22,1974-10-21
188,6,Eban Salleh,TIADA,BN - UMNO,Dipilih oleh Dewan Undangan Negeri,Johor,,,,,bumiputera,TIADA,Ahli Dewan Negara,,,1983-03-28,1983-04-06
189,15,Edward Linggu Bukut,YB Senator Datuk,STAR,Dipilih oleh Dewan Undangan Negeri,Sabah,,,,M,bumiputera,TIADA,TIADA,,10.12.2024 - 09.12.2027,2024-12-10,2027-12-09
190,11,Empiang Jabu,TIADA,BN - PBB,Dipilih oleh Dewan Undangan Negeri,Sarawak,,,,,bumiputera,TIADA,Ahli Dewan Negara,,,2004-06-28,2007-06-27
190,11,Empiang Jabu,TIADA,BN - PBB,Dipilih oleh Dewan Undangan Negeri,Sarawak,,,,,bumiputera,TIADA,Ahli Dewan Negara,,,2007-07-11,2010-07-10
191,1,Engku Muhsein Abdul Kadir,TIADA,Perikatan - UMNO,Dilantik Yang di-Pertuan Agong,TIADA,,,,,bumiputera,TIADA,Ahli Dewan Negara,,,1959-09-11,1964-01-01
192,13,Engku Naimah Binti Engku Taib,YB Senator Y.M.,BN - UMNO,Dipilih oleh Dewan Undangan Negeri,Terengganu,,,,M,bumiputera,TIADA,TIADA,,06.11.2015 - 05.11.2018,2015-11-06,2018-11-05
193,5,Fadzil Ahmad,TIADA,BN - UMNO,Dipilih oleh Dewan Undangan Negeri,Kedah,,,,,bumiputera,TIADA,Ahli Dewan Negara,,,1978-10-23,1981-10-22
194,5,Fadzil Mahmood,TIADA,BN - UMNO,Dipilih oleh Dewan Undangan Negeri,Perlis,,,,,bumiputera,TIADA,Ahli Dewan Negara,,,1981-12-09,1984-12-08
194,6,Fadzil Mahmood,TIADA,BN - UMNO,Dipilih oleh Dewan Undangan Negeri,Perlis,,,,,bumiputera,TIADA,Ahli Dewan Negara,,,1981-12-09,1984-12-08
194,6,Fadzil Mahmood,TIADA,BN - UMNO,Dipilih oleh Dewan Undangan Negeri,Perlis,,,,,bumiputera,TIADA,Ahli Dewan Negara,,,1984-01-10,1987-01-09
194,7,Fadzil Mahmood,TIADA,BN - UMNO,Dipilih oleh Dewan Undangan Negeri,Perlis,,,,,bumiputera,TIADA,Ahli Dewan Negara,,,1981-12-09,1984-12-08
194,7,Fadzil Mahmood,TIADA,BN - UMNO,Dipilih oleh Dewan Undangan Negeri,Perlis,,,,,bumiputera,TIADA,Ahli Dewan Negara,,,1984-01-10,1987-01-09
195,13,Fahariyah Binti Hj. Md Nordin,YB Senator Dato',BN - UMNO,Dilantik Yang di-Pertuan Agong,TIADA,,,,M,bumiputera,TIADA,Ahli Dewan Negara,,07.12.2016 - 06.12.2019,2016-12-07,2019-12-06
196,9,Faridah Abu Hassan,TIADA,BN - UMNO,Dilantik Yang di-Pertuan Agong,TIADA,,,,,bumiputera,TIADA,Ahli Dewan Negara,,,1995-09-04,1998-09-03
196,10,Faridah Abu Hassan,TIADA,BN - UMNO,Dilantik Yang di-Pertuan Agong,TIADA,,,,,bumiputera,TIADA,Ahli Dewan Negara,,,1995-09-04,1998-09-03
197,11,Fatanah Ahmad,TIADA,BN - UMNO,Dilantik Yang di-Pertuan Agong,TIADA,,,,,bumiputera,TIADA,Ahli Dewan Negara,,,2004-12-13,2007-12-12
198,4,Fatimah Salim,TIADA,BN - UMNO,Dilantik Yang di-Pertuan Agong,TIADA,,,,,bumiputera,TIADA,Ahli Dewan Negara,,,,
198,5,Fatimah Salim,TIADA,BN - UMNO,Dilantik Yang di-Pertuan Agong,TIADA,,,,,bumiputera,TIADA,Ahli Dewan Negara,,,,
199,12,Firdaus bin Haji Abdullah,YB Senator Dato' Dr.,BN - UMNO,Dilantik Yang di-Pertuan Agong,TIADA,,,,M,bumiputera,TIADA,TIADA,,26.01.2012 - 25.01.2015,2012-01-26,2015-01-25
200,7,Foo Boon Liang,TIADA,BN - MCA,Dipilih oleh Dewan Undangan Negeri,Pahang,,,,,chinese,TIADA,Ahli Dewan Negara,,,1987-07-13,1990-07-12
200,7,Foo Boon Liang,TIADA,BN - MCA,Dipilih oleh Dewan Undangan Negeri,Pahang,,,,,chinese,TIADA,Ahli Dewan Negara,,,1990-06-25,1993-06-24
200,8,Foo Boon Liang,TIADA,BN - MCA,Dipilih oleh Dewan Undangan Negeri,Pahang,,,,,chinese,TIADA,Ahli Dewan Negara,,,1987-07-13,1990-07-12
200,8,Foo Boon Liang,TIADA,BN - MCA,Dipilih oleh Dewan Undangan Negeri,Pahang,,,,,chinese,TIADA,Ahli Dewan Negara,,,1990-06-25,1993-06-24
201,2,Foo See Moi,TIADA,Perikatan - MCA,Dilantik Yang di-Pertuan Agong,TIADA,,,,,chinese,TIADA,Ahli Dewan Negara,,,1964-09-11,
201,2,Foo See Moi,TIADA,Perikatan - MCA,Dilantik Yang di-Pertuan Agong,TIADA,,,,,chinese,TIADA,Ahli Dewan Negara,,,1968-10-22,
201,3,Foo See Moi,TIADA,Perikatan - MCA,Dilantik Yang di-Pertuan Agong,TIADA,,,,,chinese,TIADA,Ahli Dewan Negara,,,1964-09-11,1970-09-10
201,3,Foo See Moi,TIADA,Perikatan - MCA,Dilantik Yang di-Pertuan Agong,TIADA,,,,,chinese,TIADA,Ahli Dewan Negara,,,1968-10-22,1974-10-21
202,7,Frankie Chong Yu Chee,TIADA,TIADA,Dipilih oleh Dewan Undangan Negeri,Sabah,,,,,chinese,TIADA,Ahli Dewan Negara,,,1990-12-17,1993-12-16
202,8,Frankie Chong Yu Chee,TIADA,BN - SAPP,Dipilih oleh Dewan Undangan Negeri,Sabah,,,,,chinese,TIADA,Ahli Dewan Negara,,,1990-12-17,1993-12-16
202,8,Frankie Chong Yu Chee,TIADA,BN - SAPP,Dipilih oleh Dewan Undangan Negeri,Sabah,,,,,chinese,TIADA,Ahli Dewan Negara,,,1994-05-09,1997-05-08
203,8,Fu Ah Kiow,TIADA,BN - MCA,Dilantik Yang di-Pertuan Agong,TIADA,,,,,chinese,TIADA,Ahli Dewan Negara,,,,
204,15,Fuziah binti Salleh,YB Senator Dr. Hajah,PKR,Dilantik Yang di-Pertuan Agong,TIADA,,,,M,bumiputera,Timbalan Menteri Perdagangan Dalam Negeri dan Kos Sara Hidup,Timbalan Menteri Perdagangan Dalam Negeri dan Kos Sara Hidup,,10.12.2022 - 09.12.2025,2022-12-10,2025-12-09
205,2,G. Louis,TIADA,TIADA,Dilantik Yang di-Pertuan Agong,TIADA,,,,,chinese,TIADA,Ahli Dewan Negara,,,1968-10-22,
205,3,G. Louis,TIADA,TIADA,Dilantik Yang di-Pertuan Agong,TIADA,,,,,chinese,TIADA,Ahli Dewan Negara,,,1968-10-22,1974-10-21
206,5,G. Pasamanickam,TIADA,BN - MIC,Dilantik Yang di-Pertuan Agong,TIADA,,,,,indian,TIADA,Ahli Dewan Negara,,,1980-12-15,1983-12-14
206,6,G. Pasamanickam,TIADA,BN - MIC,Dilantik Yang di-Pertuan Agong,TIADA,,,,,indian,TIADA,Ahli Dewan Negara,,,1980-12-15,1983-12-14
206,6,G. Pasamanickam,TIADA,BN - MIC,Dilantik Yang di-Pertuan Agong,TIADA,,,,,indian,TIADA,Ahli Dewan Negara,,,1983-12-05,1986-12-04
206,7,G. Pasamanickam,TIADA,BN - MIC,Dilantik Yang di-Pertuan Agong,TIADA,,,,,indian,TIADA,Ahli Dewan Negara,,,1980-12-15,1983-12-14
206,7,G. Pasamanickam,TIADA,BN - MIC,Dilantik Yang di-Pertuan Agong,TIADA,,,,,indian,TIADA,Ahli Dewan Negara,,,1983-12-05,1986-12-04
207,1,G. Shelley,TIADA,TIADA,Dilantik Yang di-Pertuan Agong,TIADA,,,,,other,TIADA,Ahli Dewan Negara,,,1959-09-11,1965-09-10
207,2,G. Shelley,TIADA,TIADA,Dilantik Yang di-Pertuan Agong,TIADA,,,,,other,TIADA,Ahli Dewan Negara,,,1959-09-11,1968-08-26
208,5,Gan Kong Seng,TIADA,BN - MCA,Dipilih oleh Dewan Undangan Negeri,Negeri Sembilan,,,,,chinese,TIADA,Ahli Dewan Negara,,,1981-06-22,1984-06-21
209,12,Gan Ping Shou @ Gan Ping Sieu,YB Senator Tuan,BN - MCA,Dilantik Yang di-Pertuan Agong,TIADA,,,,M,chinese,Timbalan Menteri Belia Dan Sukan,TIADA,,02.06.2010 - 01.06.2013,2010-06-02,2013-06-01
210,2,Gan Teck Yeow,TIADA,Perikatan - MCA,Dilantik Yang di-Pertuan Agong,TIADA,,,,,chinese,TIADA,Ahli Dewan Negara,,,1964-10-19,
210,3,Gan Teck Yeow,TIADA,Perikatan - MCA,Dilantik Yang di-Pertuan Agong,TIADA,,,,,chinese,TIADA,Ahli Dewan Negara,,,1964-10-19,1970-10-18
210,3,Gan Teck Yeow,TIADA,Perikatan - MCA,Dilantik Yang di-Pertuan Agong,TIADA,,,,,chinese,TIADA,Ahli Dewan Negara,,,1971-02-20,1977-02-19
210,4,Gan Teck Yeow,TIADA,BN - MCA,Dilantik Yang di-Pertuan Agong,TIADA,,,,,chinese,TIADA,Ahli Dewan Negara,,,1964-10-19,1967-10-18
210,4,Gan Teck Yeow,TIADA,BN - MCA,Dilantik Yang di-Pertuan Agong,TIADA,,,,,chinese,TIADA,Ahli Dewan Negara,,,1971-02-20,1974-02-19
211,9,Gapar Gurrohu,TIADA,BN - UMNO,Dilantik Yang di-Pertuan Agong,TIADA,,,,,other,TIADA,Ahli Dewan Negara,,,1997-10-06,2000-10-05
211,10,Gapar Gurrohu,TIADA,BN - UMNO,Dilantik Yang di-Pertuan Agong,TIADA,,,,,other,TIADA,Ahli Dewan Negara,,,1997-10-06,2000-10-05
211,10,Gapar Gurrohu,TIADA,BN - UMNO,Dilantik Yang di-Pertuan Agong,TIADA,,,,,other,TIADA,Ahli Dewan Negara,,,2000-11-02,2003-11-01
212,8,Ghazali Embong,TIADA,BN - UMNO,Dilantik Yang di-Pertuan Agong,TIADA,,,,,bumiputera,TIADA,Ahli Dewan Negara,,,1991-07-24,1994-07-23
212,8,Ghazali Embong,TIADA,BN - UMNO,Dilantik Yang di-Pertuan Agong,TIADA,,,,,bumiputera,TIADA,Ahli Dewan Negara,,,1994-07-20,1997-07-19
213,9,Ghazi @ Hasbullah Ramli,TIADA,BN - UMNO,Dipilih oleh Dewan Undangan Negeri,Selangor,,,,,bumiputera,TIADA,Ahli Dewan Negara,,,1997-08-11,2000-08-10
213,10,Ghazi @ Hasbullah Ramli,TIADA,BN - UMNO,Dipilih oleh Dewan Undangan Negeri,Selangor,,,,,bumiputera,TIADA,Ahli Dewan Negara,,,1997-08-11,2000-08-10
213,10,Ghazi @ Hasbullah Ramli,TIADA,BN - UMNO,Dipilih oleh Dewan Undangan Negeri,Selangor,,,,,bumiputera,TIADA,Ahli Dewan Negara,,,2000-09-08,2003-09-07
214,2,Goh Chek Kin,TIADA,Perikatan - MCA,Dipilih oleh Dewan Undangan Negeri,Terengganu,,,,,chinese,TIADA,Ahli Dewan Negara,,,1965-10-18,1971-10-17
214,3,Goh Chek Kin,TIADA,Perikatan - MCA,Dipilih oleh Dewan Undangan Negeri,Terengganu,,,,,chinese,TIADA,Ahli Dewan Negara,,,1965-10-18,1971-10-17
215,11,Gooi Hoe Hin,TIADA,BN - Gerakan,Dipilih oleh Dewan Undangan Negeri,Penang,,,,,chinese,TIADA,Ahli Dewan Negara,,,2006-06-16,2009-06-15
216,6,H'ng Hung Yong,TIADA,BN - MCA,Dilantik Yang di-Pertuan Agong,TIADA,,,,,chinese,TIADA,Ahli Dewan Negara,,,1982-07-19,1985-07-18
217,6,Habibah Abdul Ghani,TIADA,BN - UMNO,Dipilih oleh Dewan Undangan Negeri,Pahang,,,,,bumiputera,TIADA,Ahli Dewan Negara,,,1983-12-19,1986-12-18
217,7,Habibah Abdul Ghani,TIADA,BN - UMNO,Dipilih oleh Dewan Undangan Negeri,Pahang,,,,,bumiputera,TIADA,Ahli Dewan Negara,,,1983-12-19,1986-12-18
218,7,Habidah Jusoh,TIADA,BN - UMNO,Dipilih oleh Dewan Undangan Negeri,Terengganu,,,,,bumiputera,TIADA,Ahli Dewan Negara,,,1987-02-23,1990-02-22
218,7,Habidah Jusoh,TIADA,BN - UMNO,Dipilih oleh Dewan Undangan Negeri,Terengganu,,,,,bumiputera,TIADA,Ahli Dewan Negara,,,1989-12-26,1992-12-25
218,8,Habidah Jusoh,TIADA,BN - UMNO,Dipilih oleh Dewan Undangan Negeri,Terengganu,,,,,bumiputera,TIADA,Ahli Dewan Negara,,,1987-02-23,1990-02-22
218,8,Habidah Jusoh,TIADA,BN - UMNO,Dipilih oleh Dewan Undangan Negeri,Terengganu,,,,,bumiputera,TIADA,Ahli Dewan Negara,,,1989-12-26,1992-12-25
219,8,Habshah Osman,TIADA,BN - UMNO,Dilantik Yang di-Pertuan Agong,TIADA,,,,,bumiputera,TIADA,Ahli Dewan Negara,,,1992-10-27,1995-10-26
220,6,Hafsah Othman,TIADA,BN - UMNO,Dilantik Yang di-Pertuan Agong,TIADA,,,,,bumiputera,TIADA,Ahli Dewan Negara,,,1982-07-19,1985-07-18
221,10,Halimah Hamzah,TIADA,BN - UMNO,Dipilih oleh Dewan Undangan Negeri,Pahang,,,,,bumiputera,TIADA,Ahli Dewan Negara,,,,
221,11,Halimah Hamzah,TIADA,BN - UMNO,Dipilih oleh Dewan Undangan Negeri,Pahang,,,,,bumiputera,TIADA,Ahli Dewan Negara,,,,
222,7,Hamid Araby Md. Salih,TIADA,BN - UMNO,Dipilih oleh Dewan Undangan Negeri,Pulau Pinang,,,,,bumiputera,TIADA,Ahli Dewan Negara,,,,
223,9,Hamzah Mohamed Zain,TIADA,BN - UMNO,Dilantik Yang di-Pertuan Agong,TIADA,,,,,bumiputera,TIADA,Ahli Dewan Negara,,,1998-02-05,2001-02-04
224,10,Hamzah Zainudin,TIADA,BN - UMNO,Dipilih oleh Dewan Undangan Negeri,Perak,,,,,bumiputera,TIADA,Ahli Dewan Negara,,,2000-09-08,2003-09-07
224,10,Hamzah Zainudin,TIADA,BN - UMNO,Dipilih oleh Dewan Undangan Negeri,Perak,,,,,bumiputera,TIADA,Ahli Dewan Negara,,,2003-09-17,2006-09-16
224,11,Hamzah Zainudin,TIADA,BN - UMNO,Dipilih oleh Dewan Undangan Negeri,Perak,,,,,bumiputera,TIADA,Ahli Dewan Negara,,,2000-09-08,2003-09-07
224,11,Hamzah Zainudin,TIADA,BN - UMNO,Dipilih oleh Dewan Undangan Negeri,Perak,,,,,bumiputera,TIADA,Ahli Dewan Negara,,,2003-09-17,2006-09-16
225,13,Hanafi Bin Haji Mamat,YB Senator Datuk Sr. Haji,BN - UMNO,Dilantik Yang di-Pertuan Agong,TIADA,,,,M,bumiputera,TIADA,Ahli Dewan Negara,,07.12.2016 - 06.12.2019,2016-12-07,2019-12-06
226,8,Hanipah Ahmad,TIADA,BN - UMNO,Dipilih oleh Dewan Undangan Negeri,Perlis,,,,,bumiputera,TIADA,Ahli Dewan Negara,,,1993-04-19,1996-04-18
227,10,Haris Salleh,TIADA,BN - UMNO,Dipilih oleh Dewan Undangan Negeri,Johor,,,,,bumiputera,TIADA,Ahli Dewan Negara,,,,
228,6,Harun Hassan,TIADA,BN - UMNO,Dipilih oleh Dewan Undangan Negeri,Terengganu,,,,,bumiputera,TIADA,Ahli Dewan Negara,,,1985-07-29,1988-07-28
228,7,Harun Hassan,TIADA,BN - UMNO,Dipilih oleh Dewan Undangan Negeri,Terengganu,,,,,bumiputera,TIADA,Ahli Dewan Negara,,,1985-07-29,1988-07-28
229,1,Hashim Awang,TIADA,Perikatan - UMNO,Dipilih oleh Dewan Undangan Negeri,Pulau Pinang,,,,,bumiputera,TIADA,Ahli Dewan Negara,,,1959-09-11,1962-09-10
230,9,Hashim Safin @ Shafin,TIADA,BN - UMNO,Dilantik Yang di-Pertuan Agong,TIADA,,,,,bumiputera,TIADA,Ahli Dewan Negara,,,1997-05-12,2000-05-11
231,5,Hasnah Fatimah Mohd Kasim,TIADA,BN - UMNO,Dipilih oleh Dewan Undangan Negeri,Terengganu,,,,,bumiputera,TIADA,Ahli Dewan Negara,,,,
231,6,Hasnah Fatimah Mohd Kasim,TIADA,BN - UMNO,Dipilih oleh Dewan Undangan Negeri,Terengganu,,,,,bumiputera,TIADA,Ahli Dewan Negara,,,1984-01-10,1987-01-09
231,7,Hasnah Fatimah Mohd Kasim,TIADA,BN - UMNO,Dipilih oleh Dewan Undangan Negeri,Terengganu,,,,,bumiputera,TIADA,Ahli Dewan Negara,,,1984-01-10,1987-01-09
232,7,Hassan Alban Sandukong,TIADA,TIADA,Dipilih oleh Dewan Undangan Negeri,Sabah,,,,,bumiputera,TIADA,Ahli Dewan Negara,,,1986-12-15,1989-12-14
228,7,Hassan Harun,TIADA,BN - UMNO,Dipilih oleh Dewan Undangan Negeri,Kelantan,,,,,bumiputera,TIADA,Ahli Dewan Negara,,,1988-03-28,1991-03-27
228,8,Hassan Harun,TIADA,BN - UMNO,Dipilih oleh Dewan Undangan Negeri,Kelantan,,,,,bumiputera,TIADA,Ahli Dewan Negara,,,1988-03-28,1991-03-27
233,6,Hassan Nam,TIADA,TIADA,Dilantik Yang di-Pertuan Agong,TIADA,,,,,bumiputera,TIADA,Ahli Dewan Negara,,,1984-04-09,1987-04-08
233,7,Hassan Nam,TIADA,TIADA,Dilantik Yang di-Pertuan Agong,TIADA,,,,,bumiputera,TIADA,Ahli Dewan Negara,,,1984-04-09,1987-04-08
233,7,Hassan Nam,TIADA,TIADA,Dilantik Yang di-Pertuan Agong,TIADA,,,,,bumiputera,TIADA,Ahli Dewan Negara,,,1987-03-23,1990-03-22
234,10,Hassan Shukri,TIADA,PAS,Dipilih oleh Dewan Undangan Negeri,Terengganu,,,,,bumiputera,TIADA,Ahli Dewan Negara,,,1999-12-27,2002-12-26
234,11,Hassan Shukri,TIADA,PAS,Dipilih oleh Dewan Undangan Negeri,Terengganu,,,,,bumiputera,TIADA,Ahli Dewan Negara,,,1999-12-27,2002-12-26
235,3,Hassan Yaakub,TIADA,Perikatan - UMNO,Dipilih oleh Dewan Undangan Negeri,Melaka,,,,,bumiputera,TIADA,Ahli Dewan Negara,,,1971-08-02,1977-08-01
236,11,Hazizah Mohd Sultan,TIADA,BN - UMNO,Dipilih oleh Dewan Undangan Negeri,Malacca,,,,,bumiputera,TIADA,Ahli Dewan Negara,,,1999-12-27,2002-12-26
236,10,Hazizah Mohd. Sultan,TIADA,BN - UMNO,Dipilih oleh Dewan Undangan Negeri,Malacca,,,,,bumiputera,TIADA,Ahli Dewan Negara,,,1999-12-27,2002-12-26
237,11,Heng Seai Kie,TIADA,BN - MCA,Dipilih oleh Dewan Undangan Negeri,Perak,,,,,chinese,TIADA,Ahli Dewan Negara,,,2006-12-06,2009-12-05
238,11,Hiang A Li,TIADA,BN - MCA,Dipilih oleh Dewan Undangan Negeri,Pahang,,,,,chinese,TIADA,Ahli Dewan Negara,,,2006-05-08,2009-05-07
239,11,Hii Tiong Kuoh,TIADA,BN - SUPP,Dilantik Yang di-Pertuan Agong,TIADA,,,,,chinese,TIADA,Ahli Dewan Negara,,,2004-12-06,2007-12-05
240,8,Ho Cheng Wang,TIADA,BN - MCA,Dipilih oleh Dewan Undangan Negeri,Perak,,,,,chinese,TIADA,Ahli Dewan Negara,,,1991-07-24,1994-07-23
241,10,Ho Lim Teck,TIADA,BN - MCA,Dipilih oleh Dewan Undangan Negeri,Malacca,,,,,chinese,TIADA,Ahli Dewan Negara,,,1999-10-12,2002-10-11
242,1,Hoh Chee Cheong,TIADA,Perikatan - MCA,Dipilih oleh Dewan Undangan Negeri,Pahang,,,,,chinese,TIADA,Ahli Dewan Negara,,,1962-10-15,1968-10-14
242,2,Hoh Chee Cheong,TIADA,Perikatan - MCA,Dipilih oleh Dewan Undangan Negeri,Pahang,,,,,chinese,TIADA,Ahli Dewan Negara,,,1962-10-15,1968-10-14
243,13,Hoh Khai Mun,YB Senator Dato' Indera,BN - MCA,Dipilih oleh Dewan Undangan Negeri,Pahang,,,,M,chinese,TIADA,TIADA,,29.05.2015 - 28.05.2018,2015-05-29,2018-05-28
244,2,Hong Kim Sui,TIADA,Perikatan - MCA,Dilantik Yang di-Pertuan Agong,TIADA,,,,,chinese,TIADA,Ahli Dewan Negara,,,1965-12-18,
244,3,Hong Kim Sui,TIADA,Perikatan - MCA,Dilantik Yang di-Pertuan Agong,TIADA,,,,,chinese,TIADA,Ahli Dewan Negara,,,1966-03-17,1972-03-16
245,2,Hong Teck Guan,TIADA,Perikatan - MCA,Dilantik Yang di-Pertuan Agong,TIADA,,,,,chinese,TIADA,Ahli Dewan Negara,,,1964-05-18,1965-08-16
246,9,Hunaizah Mohd Noor,TIADA,PAS,Dipilih oleh Dewan Undangan Negeri,Kelantan,,,,,chinese,TIADA,Ahli Dewan Negara,,,1997-08-04,2000-08-03
246,10,Hunaizah Mohd. Noor,TIADA,PAS,Dipilih oleh Dewan Undangan Negeri,Kelantan,,,,,bumiputera,TIADA,Ahli Dewan Negara,,,1997-08-04,2000-08-03
247,14,Husain Bin Awang,YB Senator Dato',PAS,Dipilih oleh Dewan Undangan Negeri,Terengganu,,,,M,bumiputera,TIADA,Ahli Dewan Negara,,17.07.2018 - 16.07.2021,2018-07-17,2021-07-16
71,6,Husein Ahmad,TIADA,BN - UMNO,Dilantik Yang di-Pertuan Agong,TIADA,,,,,bumiputera,TIADA,Ahli Dewan Negara,,,1984-12-11,1987-12-10
71,7,Husein Ahmad,TIADA,BN - UMNO,Dilantik Yang di-Pertuan Agong,TIADA,,,,,bumiputera,TIADA,Ahli Dewan Negara,,,1984-12-11,1987-12-10
71,7,Husein Ahmad,TIADA,BN - UMNO,Dilantik Yang di-Pertuan Agong,TIADA,,,,,bumiputera,TIADA,Ahli Dewan Negara,,,1987-12-10,1990-12-09
248,4,Hussein Mohd. Nordin,TIADA,BN - UMNO,Dilantik Yang di-Pertuan Agong,TIADA,,,,,bumiputera,TIADA,Ahli Dewan Negara,,,1976-08-09,1979-08-08
248,5,Hussein Mohd. Nordin,TIADA,BN - UMNO,Dilantik Yang di-Pertuan Agong,TIADA,,,,,bumiputera,TIADA,Ahli Dewan Negara,,,1976-08-09,1979-08-08
248,6,Hussein Mohd. Nordin,TIADA,BN - UMNO,Dilantik Yang di-Pertuan Agong,TIADA,,,,,bumiputera,TIADA,Ahli Dewan Negara,,,1976-08-09,1979-08-08
248,6,Hussein Mohd. Nordin,TIADA,BN - UMNO,Dilantik Yang di-Pertuan Agong,TIADA,,,,,bumiputera,TIADA,Ahli Dewan Negara,,,,1984-04-08
249,15,Hussin bin Ismail,YB Senator Tuan Haji,PAS,Dipilih oleh Dewan Undangan Negeri,Terengganu,,,,M,,TIADA,Ahli Dewan Negara,,15.03.2023 - 14.03.2026,2023-03-15,2026-03-14
250,6,Ibrahim @ Ahmed bin Mat Saman @ Othman,TIADA,BN - UMNO,Dipilih oleh Dewan Undangan Negeri,Kedah,,,,,,TIADA,Ahli Dewan Negara,,,1983-12-05,1986-12-04
251,4,Ibrahim Abdullah,TIADA,BN - UMNO,Dipilih oleh Dewan Undangan Negeri,Perak,,,,,bumiputera,TIADA,Ahli Dewan Negara,,,1977-11-09,1980-11-08
251,5,Ibrahim Abdullah,TIADA,BN - UMNO,Dipilih oleh Dewan Undangan Negeri,Perak,,,,,bumiputera,TIADA,Ahli Dewan Negara,,,1977-11-09,1980-11-08
252,9,Ibrahim Ali,TIADA,BN - UMNO,Dilantik Yang di-Pertuan Agong,TIADA,,,,,bumiputera,Timbalan Menteri Kabinet,Ahli Dewan Negara,,,1996-10-29,1999-10-28
253,8,Ibrahim Daud,TIADA,BN - UMNO,Dipilih oleh Dewan Undangan Negeri,Johor,,,,,bumiputera,TIADA,Ahli Dewan Negara,,,1993-04-19,1996-04-18
254,7,Ibrahim Jendol,TIADA,BN - UMNO,Dilantik Yang di-Pertuan Agong,TIADA,,,,,bumiputera,TIADA,Ahli Dewan Negara,,,1988-08-25,1991-08-24
255,5,Ibrahim Salleh,TIADA,BN - UMNO,Dilantik Yang di-Pertuan Agong,TIADA,,,,,bumiputera,TIADA,Ahli Dewan Negara,,,1980-12-15,1983-12-14
255,6,Ibrahim Salleh,TIADA,BN - UMNO,Dilantik Yang di-Pertuan Agong,TIADA,,,,,bumiputera,TIADA,Ahli Dewan Negara,,,1980-12-15,1983-12-14
255,6,Ibrahim Salleh,TIADA,BN - UMNO,Dilantik Yang di-Pertuan Agong,TIADA,,,,,bumiputera,TIADA,Ahli Dewan Negara,,,1982-07-19,1985-07-18
256,13,Ibrahim Shah bin Abu Shah,YB Senator Prof. Emeritus Tan Sri Dato` Seri Dr.,BN - UMNO,Dilantik Yang di-Pertuan Agong,TIADA,,,,M,bumiputera,TIADA,TIADA,,03.11.2014 - 02.11.2017,2014-11-03,2017-11-02
257,6,Ibrahim Ujang,TIADA,BN - UMNO,Dipilih oleh Dewan Undangan Negeri,Negeri Sembilan,,,,,bumiputera,TIADA,Ahli Dewan Negara,,,1984-12-03,1987-12-02
257,7,Ibrahim Ujang,TIADA,BN - UMNO,Dipilih oleh Dewan Undangan Negeri,Negeri Sembilan,,,,,bumiputera,TIADA,Ahli Dewan Negara,,,1984-12-03,1987-12-02
257,7,Ibrahim Ujang,TIADA,BN - UMNO,Dipilih oleh Dewan Undangan Negeri,Negeri Sembilan,,,,,bumiputera,TIADA,Ahli Dewan Negara,,,1987-11-30,1990-11-29
258,2,Ibrahim Yaacob,TIADA,Perikatan - UMNO,Dipilih oleh Dewan Undangan Negeri,Selangor,,,,,bumiputera,TIADA,Ahli Dewan Negara,,,1969-01-27,1975-01-26
258,3,Ibrahim Yaacob,TIADA,Perikatan - UMNO,Dipilih oleh Dewan Undangan Negeri,Selangor,,,,,bumiputera,TIADA,Ahli Dewan Negara,,,1969-01-27,1975-01-26
258,4,Ibrahim Yaacob,TIADA,BN - UMNO,Dilantik Yang di-Pertuan Agong,TIADA,,,,,bumiputera,TIADA,Ahli Dewan Negara,,,1969-01-27,1972-01-26
258,4,Ibrahim Yaacob,TIADA,BN - UMNO,Dilantik Yang di-Pertuan Agong,TIADA,,,,,bumiputera,TIADA,Ahli Dewan Negara,,,1975-01-06,1978-01-05
258,5,Ibrahim Yaacob,TIADA,BN - UMNO,Dilantik Yang di-Pertuan Agong,TIADA,,,,,bumiputera,TIADA,Ahli Dewan Negara,,,1969-01-27,1972-01-26
258,5,Ibrahim Yaacob,TIADA,BN - UMNO,Dilantik Yang di-Pertuan Agong,TIADA,,,,,bumiputera,TIADA,Ahli Dewan Negara,,,1975-01-06,1978-01-05
259,7,Ida Dumpangal ne Ida Undan,TIADA,TIADA,Dipilih oleh Dewan Undangan Negeri,Sabah,,,,,other,TIADA,Ahli Dewan Negara,,,1989-12-29,1992-12-28
259,8,Ida Dumpangal ne Ida Undan,TIADA,TIADA,Dipilih oleh Dewan Undangan Negeri,Sabah,,,,,other,TIADA,Ahli Dewan Negara,,,1989-12-29,1992-12-28
260,11,Idris Buang,TIADA,BN - PBB,Dipilih oleh Dewan Undangan Negeri,Sarawak,,,,,bumiputera,TIADA,Ahli Dewan Negara,,,2005-12-07,2008-12-06
261,12,Idris Jala,YB Senator Dato' Sri,TIADA,Dilantik Yang di-Pertuan Agong,TIADA,,,,M,bumiputera,Menteri di Jabatan Perdana Menteri,TIADA,,03.09.2012 - 2.09.2015,2012-09-03,2015-09-02
262,11,Ikhwan Salim Sujak,TIADA,BN - UMNO,Dipilih oleh Dewan Undangan Negeri,Selangor,,,,,bumiputera,TIADA,Ahli Dewan Negara,,,2004-01-08,2007-01-07
262,11,Ikhwan Salim Sujak,TIADA,BN - UMNO,Dipilih oleh Dewan Undangan Negeri,Selangor,,,,,bumiputera,TIADA,Ahli Dewan Negara,,,2006-12-06,2009-12-05
263,2,Indan Kari,TIADA,USNO,Dilantik Yang di-Pertuan Agong,TIADA,,,,,other,TIADA,Ahli Dewan Negara,,,1967-11-20,
264,13,Isa bin Ab. Hamid,YB Senator Dato',Wakil Masyarakat Orang Asli,Dilantik Yang di-Pertuan Agong,TIADA,,,,M,bumiputera,TIADA,TIADA,,18.04.2016 - 17.04.2019,2016-04-18,2019-04-17
265,15,Isaiah a/l D.Jacob,YB Senator Tuan,PKR,Dilantik Yang di-Pertuan Agong,TIADA,,,,M,indian,TIADA,Ahli Dewan Negara,,20.03.2023 - 19.03.2026,2023-03-20,2026-03-19
266,5,Ishak Abdul Rahman,TIADA,BN - UMNO,Dipilih oleh Dewan Undangan Negeri,Pulau Pinang,,,,,bumiputera,TIADA,Ahli Dewan Negara,,,1980-12-15,1983-12-14
266,6,Ishak Abdul Rahman,TIADA,BN - UMNO,Dipilih oleh Dewan Undangan Negeri,Pulau Pinang,,,,,bumiputera,TIADA,Ahli Dewan Negara,,,1980-12-15,1983-12-14
266,6,Ishak Abdul Rahman,TIADA,BN - UMNO,Dipilih oleh Dewan Undangan Negeri,Pulau Pinang,,,,,bumiputera,TIADA,Ahli Dewan Negara,,,1984-01-10,1987-01-09
266,7,Ishak Abdul Rahman,TIADA,BN - UMNO,Dipilih oleh Dewan Undangan Negeri,Pulau Pinang,,,,,bumiputera,TIADA,Ahli Dewan Negara,,,1980-12-15,1983-12-14
266,7,Ishak Abdul Rahman,TIADA,BN - UMNO,Dipilih oleh Dewan Undangan Negeri,Pulau Pinang,,,,,bumiputera,TIADA,Ahli Dewan Negara,,,1984-01-10,1987-01-09
267,7,Isli Siput,TIADA,TIADA,Dilantik Yang di-Pertuan Agong,TIADA,,,,,bumiputera,TIADA,Ahli Dewan Negara,,,,
267,8,Isli Siput,TIADA,TIADA,Dilantik Yang di-Pertuan Agong,TIADA,,,,,bumiputera,TIADA,Ahli Dewan Negara,,,1993-12-20,1996-12-19
268,4,Ismail Hashim,TIADA,BN - UMNO,Dipilih oleh Dewan Undangan Negeri,Melaka,,,,,bumiputera,TIADA,Ahli Dewan Negara,,,,
268,5,Ismail Hashim,TIADA,BN - UMNO,Dipilih oleh Dewan Undangan Negeri,Melaka,,,,,bumiputera,TIADA,Ahli Dewan Negara,,,,
269,5,Ismail Hassan,TIADA,BN - UMNO,Dipilih oleh Dewan Undangan Negeri,Johor,,,,,bumiputera,TIADA,Ahli Dewan Negara,,,1980-12-15,1983-12-14
269,6,Ismail Hassan,TIADA,BN - UMNO,Dipilih oleh Dewan Undangan Negeri,Johor,,,,,bumiputera,TIADA,Ahli Dewan Negara,,,1980-12-15,1982-10-04
270,10,Ismail Kassim,TIADA,BN - UMNO,Dilantik Yang di-Pertuan Agong,TIADA,,,,,bumiputera,TIADA,Ahli Dewan Negara,,,,
270,11,Ismail Kassim,TIADA,BN - UMNO,Dipilih oleh Dewan Undangan Negeri,Perlis,,,,,bumiputera,TIADA,Ahli Dewan Negara,,,2006-05-15,2009-05-14
271,5,Ismail Khan,TIADA,BN - UMNO,Dilantik Yang di-Pertuan Agong,TIADA,,,,,bumiputera,TIADA,Ahli Dewan Negara,,,1980-12-15,1983-12-14
271,6,Ismail Khan,TIADA,BN - UMNO,Dilantik Yang di-Pertuan Agong,TIADA,,,,,bumiputera,TIADA,Ahli Dewan Negara,,,1980-12-15,1983-12-14
271,6,Ismail Khan,TIADA,BN - UMNO,Dilantik Yang di-Pertuan Agong,TIADA,,,,,bumiputera,TIADA,Ahli Dewan Negara,,,1983-12-15,1986-12-14
271,7,Ismail Khan,TIADA,BN - UMNO,Dilantik Yang di-Pertuan Agong,TIADA,,,,,bumiputera,TIADA,Ahli Dewan Negara,,,1980-12-15,1983-12-14
271,7,Ismail Khan,TIADA,BN - UMNO,Dilantik Yang di-Pertuan Agong,TIADA,,,,,bumiputera,TIADA,Ahli Dewan Negara,,,1983-12-15,1986-12-14
272,11,Ismail Md. Salleh,TIADA,IND,Dilantik Yang di-Pertuan Agong,TIADA,,,,,bumiputera,TIADA,Ahli Dewan Negara,,,2007-12-18,2010-12-17
273,7,Ismail Nagore,TIADA,BN - UMNO,Dilantik Yang di-Pertuan Agong,TIADA,,,,,bumiputera,TIADA,Ahli Dewan Negara,,,1987-02-23,1987-06-03
274,3,Ismail Sheikh Ibrahim,TIADA,Perikatan - UMNO,Dipilih oleh Dewan Undangan Negeri,Perlis,,,,,bumiputera,TIADA,Ahli Dewan Negara,,,1971-12-20,1977-12-19
274,4,Ismail Sheikh Ibrahim,TIADA,BN - UMNO,Dipilih oleh Dewan Undangan Negeri,Perlis,,,,,bumiputera,TIADA,Ahli Dewan Negara,,,,
274,5,Ismail Sheikh Ibrahim,TIADA,BN - UMNO,Dipilih oleh Dewan Undangan Negeri,Perlis,,,,,bumiputera,TIADA,Ahli Dewan Negara,,,,1981-06-17
275,7,Itam Wali Nawan,TIADA,TIADA,Dilantik Yang di-Pertuan Agong,TIADA,,,,,bumiputera,TIADA,Ahli Dewan Negara,,,,
275,8,Itam Wali Nawan,TIADA,TIADA,Dilantik Yang di-Pertuan Agong,TIADA,,,,,bumiputera,TIADA,Ahli Dewan Negara,,,1993-12-20,1996-12-19
276,3,J. E. S. Crawford,TIADA,TIADA,Dilantik Yang di-Pertuan Agong,TIADA,,,,,other,TIADA,Ahli Dewan Negara,,,,1965-01-01
276,3,J. E. S. Crawford,TIADA,TIADA,Dilantik Yang di-Pertuan Agong,TIADA,,,,,other,TIADA,Ahli Dewan Negara,,,1965-10-18,1971-10-17
276,3,J. E. S. Crawford,TIADA,TIADA,Dilantik Yang di-Pertuan Agong,TIADA,,,,,other,TIADA,Ahli Dewan Negara,,,1971-12-20,1977-12-19
276,4,J. E. S. Crawford,TIADA,TIADA,Dilantik Yang di-Pertuan Agong,TIADA,,,,,other,TIADA,Ahli Dewan Negara,,,,1965-01-01
276,4,J. E. S. Crawford,TIADA,TIADA,Dilantik Yang di-Pertuan Agong,TIADA,,,,,other,TIADA,Ahli Dewan Negara,,,1965-10-18,1968-10-17
276,4,J. E. S. Crawford,TIADA,TIADA,Dilantik Yang di-Pertuan Agong,TIADA,,,,,other,TIADA,Ahli Dewan Negara,,,1971-12-20,1974-12-19
277,6,Jaafar Harun,TIADA,BN - UMNO,Dilantik Yang di-Pertuan Agong,TIADA,,,,,bumiputera,TIADA,Ahli Dewan Negara,,,1982-12-17,1985-12-16
277,7,Jaafar Harun,TIADA,BN - UMNO,Dilantik Yang di-Pertuan Agong,TIADA,,,,,bumiputera,TIADA,Ahli Dewan Negara,,,1982-12-17,1985-12-16
277,7,Jaafar Harun,TIADA,BN - UMNO,Dilantik Yang di-Pertuan Agong,TIADA,,,,,bumiputera,TIADA,Ahli Dewan Negara,,,1986-12-15,1989-12-14
278,8,Jamaluddin Ahmad,TIADA,BN - UMNO,Dipilih oleh Dewan Undangan Negeri,Negeri Sembilan,,,,,bumiputera,TIADA,Ahli Dewan Negara,,,1991-02-18,1994-02-17
278,8,Jamaluddin Ahmad,TIADA,BN - UMNO,Dipilih oleh Dewan Undangan Negeri,Negeri Sembilan,,,,,bumiputera,TIADA,Ahli Dewan Negara,,,1994-05-09,1997-05-08
279,6,James Bernard Willie,TIADA,TIADA,Dipilih oleh Dewan Undangan Negeri,Sabah,,,,,other,TIADA,Ahli Dewan Negara,,,1981-04-22,1984-04-21
279,6,James Bernard Willie,TIADA,TIADA,Dipilih oleh Dewan Undangan Negeri,Sabah,,,,,other,TIADA,Ahli Dewan Negara,,,1983-12-22,1986-12-21
279,7,James Bernard Willie,TIADA,TIADA,Dipilih oleh Dewan Undangan Negeri,Sabah,,,,,other,TIADA,Ahli Dewan Negara,,,1981-04-22,1984-04-21
279,7,James Bernard Willie,TIADA,TIADA,Dipilih oleh Dewan Undangan Negeri,Sabah,,,,,other,TIADA,Ahli Dewan Negara,,,1983-12-22,1986-12-21
280,1,James Edward Seymour Crawford,TIADA,TIADA,Dilantik Yang di-Pertuan Agong,TIADA,,,,,other,TIADA,Ahli Dewan Negara,,,1959-09-11,1965-09-10
280,2,James Edward Seymour Crawford,TIADA,TIADA,Dilantik Yang di-Pertuan Agong,TIADA,,,,,other,TIADA,Ahli Dewan Negara,,,1959-09-11,1965-09-10
280,2,James Edward Seymour Crawford,TIADA,TIADA,Dilantik Yang di-Pertuan Agong,TIADA,,,,,other,TIADA,Ahli Dewan Negara,,,1965-10-18,
279,5,James Willie,TIADA,TIADA,Dipilih oleh Dewan Undangan Negeri,Sabah,,,,,other,TIADA,Ahli Dewan Negara,,,1981-04-22,1984-04-21
281,13,Jamilah @ Halimah binti Sulaiman,YB Senator Datuk,BN - PBS,Dilantik Yang di-Pertuan Agong,TIADA,,,,M,bumiputera,TIADA,TIADA,,07.11.2012 - 06.11.2015,2012-11-07,2015-11-06
282,9,Jamilah Ibrahim,TIADA,PAS,Dipilih oleh Dewan Undangan Negeri,Kelantan,,,,,bumiputera,TIADA,Ahli Dewan Negara,,,1997-08-04,2000-08-03
282,10,Jamilah Ibrahim,TIADA,PAS,Dipilih oleh Dewan Undangan Negeri,Kelantan,,,,,bumiputera,TIADA,Ahli Dewan Negara,,,1997-08-04,2000-08-03
282,10,Jamilah Ibrahim,TIADA,PAS,Dipilih oleh Dewan Undangan Negeri,Kelantan,,,,,bumiputera,TIADA,Ahli Dewan Negara,,,2000-07-18,2003-07-17
281,12,Jamilah@Halimah binti Sulaiman,YB Senator Datuk,BN - PBS,Dilantik Yang di-Pertuan Agong,TIADA,,,,M,bumiputera,TIADA,TIADA,,07.11.2012 - 06.11.2015,2012-11-07,2015-11-06
283,6,Janaky Athi Nahappan,TIADA,BN - MIC,Dilantik Yang di-Pertuan Agong,TIADA,,,,,indian,TIADA,Ahli Dewan Negara,,,1982-07-19,1985-07-18
283,6,Janaky Athi Nahappan,TIADA,BN - MIC,Dilantik Yang di-Pertuan Agong,TIADA,,,,,indian,TIADA,Ahli Dewan Negara,,,1983-12-05,1986-12-04
283,7,Janaky Athi Nahappan,TIADA,BN - MIC,Dilantik Yang di-Pertuan Agong,TIADA,,,,,indian,TIADA,Ahli Dewan Negara,,,1982-07-19,1985-07-18
283,7,Janaky Athi Nahappan,TIADA,BN - MIC,Dilantik Yang di-Pertuan Agong,TIADA,,,,,indian,TIADA,Ahli Dewan Negara,,,1983-12-05,1986-12-04
284,9,Jang Chow Thye @ Yio Chow Thye,TIADA,BN - Gerakan,Dilantik Yang di-Pertuan Agong,TIADA,,,,,chinese,TIADA,Ahli Dewan Negara,,,1999-05-19,2002-05-18
284,10,Jang Chow Thye @ Yio Chow Thye,TIADA,BN - Gerakan,Dilantik Yang di-Pertuan Agong,TIADA,,,,,chinese,TIADA,Ahli Dewan Negara,,,1996-05-14,1999-05-13
284,10,Jang Chow Thye @ Yio Chow Thye,TIADA,BN - Gerakan,Dilantik Yang di-Pertuan Agong,TIADA,,,,,chinese,TIADA,Ahli Dewan Negara,,,1999-05-19,2002-05-18
285,8,Janggu Banyang,TIADA,BN - PBB,Dipilih oleh Dewan Undangan Negeri,Sarawak,,,,,bumiputera,TIADA,Ahli Dewan Negara,,,1993-12-13,1996-12-12
285,9,Janggu Banyang,TIADA,BN - PBB,Dipilih oleh Dewan Undangan Negeri,Sarawak,,,,,bumiputera,TIADA,Ahli Dewan Negara,Kedua,,1996-12-11,1999-12-10
286,12,Jaspal Singh a/l Gurbakhes Singh,YB Senator Dato',BN - MIC,Dilantik Yang di-Pertuan Agong,TIADA,,,,M,indian,TIADA,TIADA,,02.11.2011 - 01.11.2014,2011-11-02,2014-11-01
287,9,Jaya Parthiban,TIADA,BN - MIC,Dilantik Yang di-Pertuan Agong,TIADA,,,,,indian,TIADA,Ahli Dewan Negara,,,,
287,10,Jaya Parthiban,TIADA,BN - MIC,Dilantik Yang di-Pertuan Agong,TIADA,,,,,indian,TIADA,Ahli Dewan Negara,,,,
287,11,Jaya Partiban,TIADA,BN - MIC,Dilantik Yang di-Pertuan Agong,TIADA,,,,,indian,TIADA,Ahli Dewan Negara,,,,
288,14,Jaziri Alkaf Abdillah Suffian,YB Senator Tuan,BERSATU,Dilantik Yang di-Pertuan Agong,TIADA,,,,M,bumiputera,TIADA,Ahli Dewan Negara,,21.12.2020 - 20.12.2023,2020-12-21,2023-12-20
289,8,Jeffrey Gapari Kitingan,TIADA,TIADA,Dilantik Yang di-Pertuan Agong,TIADA,,,,,bumiputera,TIADA,Ahli Dewan Negara,,,1994-08-11,1997-08-10
290,14,Jefridin Bin Atan,YB Senator Dato`,UMNO,Dipilih oleh Dewan Undangan Negeri,Johor,,,,M,bumiputera,TIADA,TIADA,,13.09.2020 - 12.09.2023,2020-09-13,2023-09-12
291,11,Jins Shamsuddin,TIADA,BN - UMNO,Dilantik Yang di-Pertuan Agong,TIADA,,,,,bumiputera,TIADA,Ahli Dewan Negara,,,2004-10-13,2007-10-12
292,8,Johan Ghani,TIADA,BN - UMNO,Dilantik Yang di-Pertuan Agong,TIADA,,,,,bumiputera,TIADA,Ahli Dewan Negara,,,1991-07-24,1994-07-23
292,8,Johan Ghani,TIADA,BN - UMNO,Dilantik Yang di-Pertuan Agong,TIADA,,,,,bumiputera,TIADA,Ahli Dewan Negara,,,1994-12-14,1997-12-13
293,12,Johari bin Mat,YB Senator Dato' Dr,PAS,Dipilih oleh Dewan Undangan Negeri,Kelantan,,,,M,bumiputera,TIADA,TIADA,,07.07.2011 - 06.07.2014,2011-07-07,2014-07-06
294,13,John Ambrose,YB Senator Datuk,BN - UMNO,Dilantik Yang di-Pertuan Agong,TIADA,,,,M,bumiputera,TIADA,TIADA,,16.01.2018 - 15.01.2021,2018-01-16,2021-01-15
294,14,John Ambrose,YB Senator Datuk,BERSATU,Dilantik Yang di-Pertuan Agong,TIADA,,,,M,bumiputera,TIADA,Ahli Dewan Negara,,16.01.2018 - 15.01.2021,2018-01-16,2021-01-15
295,1,Joseph Augustine Angian Andulag,TIADA,UNKO,Dipilih oleh Dewan Undangan Negeri,Sabah,,,,,bumiputera,TIADA,Ahli Dewan Negara,,,1963-11-02,1969-11-01
295,2,Joseph Augustine Angian Andulag,TIADA,UNKO,Dipilih oleh Dewan Undangan Negeri,Sabah,,,,,bumiputera,TIADA,Ahli Dewan Negara,,,1963-11-02,
295,2,Joseph Augustine Angian Andulag,TIADA,UNKO,Dipilih oleh Dewan Undangan Negeri,Sabah,,,,,bumiputera,TIADA,Ahli Dewan Negara,,,1965-12-18,
296,9,Joseph Balan Seling,TIADA,BN - PBB,Dilantik Yang di-Pertuan Agong,TIADA,,,,,bumiputera,TIADA,Ahli Dewan Negara,,,,
296,10,Joseph Balan Seling,TIADA,BN - PBB,Dilantik Yang di-Pertuan Agong,TIADA,,,,,bumiputera,TIADA,Ahli Dewan Negara,,,,
297,7,Joseph Lau Keng Seong,TIADA,BN - MCA,Dipilih oleh Dewan Undangan Negeri,Johor,,,,,chinese,TIADA,Ahli Dewan Negara,,,1987-11-30,1990-11-29
298,3,Joseph Ogosine Angian Andulag,TIADA,TIADA,Dipilih oleh Dewan Undangan Negeri,Sabah,,,,,other,TIADA,Ahli Dewan Negara,,,1963-11-02,1969-11-01
298,3,Joseph Ogosine Angian Andulag,TIADA,TIADA,Dipilih oleh Dewan Undangan Negeri,Sabah,,,,,other,TIADA,Ahli Dewan Negara,,,1965-12-18,1971-12-17
299,4,Joseph Unting Umang,TIADA,TIADA,Dipilih oleh Dewan Undangan Negeri,Sarawak,,,,,other,TIADA,Ahli Dewan Negara,,,1975-01-06,1978-01-05
299,5,Joseph Unting Umang,TIADA,TIADA,Dipilih oleh Dewan Undangan Negeri,Sarawak,,,,,other,TIADA,Ahli Dewan Negara,,,1975-01-06,1978-01-05
300,14,Judiet binti Fidilis @ Noraini Binti Idris,YB Senator Datuk,BN - UMNO,Dipilih oleh Dewan Undangan Negeri,Sabah,,,,M,bumiputera,TIADA,Ahli Dewan Negara,,10.12.2021 - 09.12.2024,2021-12-10,2024-12-09
301,14,Juhanis binti Abd Aziz,YB Senator Dato',UMNO,Dipilih oleh Dewan Undangan Negeri,Pahang,,,,M,bumiputera,TIADA,Ahli Dewan Negara,,25.08.2021 - 24.08.2024,2021-08-25,2024-08-24
302,10,K. R. A. Naidu,TIADA,BN - MIC,Dilantik Yang di-Pertuan Agong,TIADA,,,,,other,TIADA,Ahli Dewan Negara,,,,
303,2,K. R. Somasundram,TIADA,Perikatan - MIC,Dipilih oleh Dewan Undangan Negeri,Kedah,,,,,other,TIADA,Ahli Dewan Negara,,,1968-01-19,1971-01-18
303,3,K. R. Somasundram,TIADA,Perikatan - MIC,Dipilih oleh Dewan Undangan Negeri,Kedah,,,,,other,TIADA,Ahli Dewan Negara,,,1968-03-04,1974-03-03
304,6,K. S. Nijhar,TIADA,BN - MIC,Dilantik Yang di-Pertuan Agong,TIADA,,,,,other,TIADA,Ahli Dewan Negara,,,1985-08-02,1988-08-01
304,7,K. S. Nijhar,TIADA,BN - MIC,Dilantik Yang di-Pertuan Agong,TIADA,,,,,other,TIADA,Ahli Dewan Negara,,,1985-08-02,1988-08-01
304,7,K. S. Nijhar,TIADA,BN - MIC,Dilantik Yang di-Pertuan Agong,TIADA,,,,,other,TIADA,Ahli Dewan Negara,,,1988-08-25,1991-08-24
304,8,K. S. Nijhar,TIADA,BN - MIC,Dilantik Yang di-Pertuan Agong,TIADA,,,,,other,TIADA,Ahli Dewan Negara,,,1985-08-02,1988-08-01
304,8,K. S. Nijhar,TIADA,BN - MIC,Dilantik Yang di-Pertuan Agong,TIADA,,,,,other,TIADA,Ahli Dewan Negara,,,1988-08-25,1991-08-24
305,8,K. Vijayanathan Kesava Pillai,TIADA,BN - MIC,Dilantik Yang di-Pertuan Agong,TIADA,,,,,indian,TIADA,Ahli Dewan Negara,,,1991-02-18,1994-02-17
305,8,K. Vijayanathan Kesava Pillai,TIADA,BN - MIC,Dilantik Yang di-Pertuan Agong,TIADA,,,,,indian,TIADA,Ahli Dewan Negara,,,1992-12-16,1995-12-15
306,12,Kadzim bin M.Yahya,YB Senator Datuk,BN - UMNO,Dipilih oleh Dewan Undangan Negeri,Sabah,,,,M,bumiputera,TIADA,TIADA,,22.12.2011 - 21.12.2014,2011-12-22,2014-12-21
307,10,Kalakau Untol,TIADA,BN - UPKO,Dipilih oleh Dewan Undangan Negeri,Sabah,,,,,bumiputera,TIADA,Ahli Dewan Negara,,,2003-11-03,2006-11-02
307,11,Kalakau Untol,TIADA,BN - UPKO,Dipilih oleh Dewan Undangan Negeri,Sabah,,,,,bumiputera,TIADA,Ahli Dewan Negara,,,2003-11-03,2006-11-02
308,8,Kalthom Othman,TIADA,PAS,Dipilih oleh Dewan Undangan Negeri,Kelantan,,,,,bumiputera,TIADA,Ahli Dewan Negara,,,1991-07-24,1994-07-23
308,8,Kalthom Othman,TIADA,PAS,Dipilih oleh Dewan Undangan Negeri,Kelantan,,,,,bumiputera,TIADA,Ahli Dewan Negara,,,1994-05-09,1997-05-08
309,4,Kam Woon Wah,TIADA,BN - MCA,Dilantik Yang di-Pertuan Agong,TIADA,,,,,chinese,TIADA,Ahli Dewan Negara,,,1975-01-06,1978-01-05
309,4,Kam Woon Wah,TIADA,BN - MCA,Dilantik Yang di-Pertuan Agong,TIADA,,,,,chinese,TIADA,Ahli Dewan Negara,,,1977-11-09,1980-11-08
309,5,Kam Woon Wah,TIADA,BN - MCA,Dilantik Yang di-Pertuan Agong,TIADA,,,,,chinese,TIADA,Ahli Dewan Negara,,,1975-01-06,1978-01-05
309,5,Kam Woon Wah,TIADA,BN - MCA,Dilantik Yang di-Pertuan Agong,TIADA,,,,,chinese,TIADA,Ahli Dewan Negara,,,1977-11-09,1980-11-08
310,11,Kamaruddin Ambok,TIADA,BN - UMNO,Dilantik Yang di-Pertuan Agong,TIADA,,,,,chinese,TIADA,Ahli Dewan Negara,,,2004-08-26,2007-08-25
311,3,Kamarul Ariffin Mohd Yassin,TIADA,Perikatan - UMNO,Dilantik Yang di-Pertuan Agong,TIADA,,,,,bumiputera,TIADA,Ahli Dewan Negara,,,1971-02-20,1977-02-19
311,4,Kamarul Ariffin Mohd Yassin,TIADA,BN - UMNO,Dilantik Yang di-Pertuan Agong,TIADA,,,,,bumiputera,TIADA,Ahli Dewan Negara,,,1971-02-20,1974-02-19
311,4,Kamarul Ariffin Mohd Yassin,TIADA,BN - UMNO,Dilantik Yang di-Pertuan Agong,TIADA,,,,,bumiputera,TIADA,Ahli Dewan Negara,,,1975-01-06,1978-01-05
311,5,Kamarul Ariffin Mohd Yassin,TIADA,BN - UMNO,Dilantik Yang di-Pertuan Agong,TIADA,,,,,bumiputera,TIADA,Ahli Dewan Negara,,,1971-02-20,1974-02-19
311,5,Kamarul Ariffin Mohd Yassin,TIADA,BN - UMNO,Dilantik Yang di-Pertuan Agong,TIADA,,,,,bumiputera,TIADA,Ahli Dewan Negara,,,1975-01-06,1978-01-05
312,6,Kamaruzaman Ahmad,TIADA,BN - UMNO,Dilantik Yang di-Pertuan Agong,TIADA,,,,,bumiputera,TIADA,Ahli Dewan Negara,,,1984-12-11,1987-12-10
312,7,Kamaruzaman Ahmad,TIADA,BN - UMNO,Dilantik Yang di-Pertuan Agong,TIADA,,,,,bumiputera,TIADA,Ahli Dewan Negara,,,1984-12-11,1987-12-10
313,9,Kamilia Ibrahim,TIADA,BN - UMNO,Dilantik Yang di-Pertuan Agong,TIADA,,,,,bumiputera,TIADA,Ahli Dewan Negara,,,1997-04-07,2000-04-06
314,10,Karim Ghani,TIADA,BN - UMNO,Dipilih oleh Dewan Undangan Negeri,Sabah,,,,,bumiputera,TIADA,Ahli Dewan Negara,,,1999-12-27,2002-12-26
314,11,Karim Ghani,TIADA,BN - UMNO,Dipilih oleh Dewan Undangan Negeri,Sabah,,,,,bumiputera,TIADA,Ahli Dewan Negara,,,1999-12-27,2002-12-26
315,10,Karim Salleh,TIADA,BN - UMNO,Dipilih oleh Dewan Undangan Negeri,Perlis,,,,,bumiputera,TIADA,Ahli Dewan Negara,,,,
316,9,Kasim Md. Yusop,TIADA,BN - UMNO,Dilantik Yang di-Pertuan Agong,TIADA,,,,,bumiputera,TIADA,Ahli Dewan Negara,,,,
316,10,Kasim Md. Yusop,TIADA,BN - UMNO,Dilantik Yang di-Pertuan Agong,TIADA,,,,,bumiputera,TIADA,Ahli Dewan Negara,,,,
317,9,Kasitah Gaddam,TIADA,BN - UMNO,Dilantik Yang di-Pertuan Agong,TIADA,,,,,bumiputera,Menteri Kabinet,Ahli Dewan Negara,,,,
317,10,Kasitah Gaddam,TIADA,BN - UMNO,Dilantik Yang di-Pertuan Agong,TIADA,,,,,bumiputera,TIADA,Ahli Dewan Negara,,,,
318,10,Kee Ah Kau,TIADA,BN - MCA,Dipilih oleh Dewan Undangan Negeri,Selangor,,,,,chinese,TIADA,Ahli Dewan Negara,,,2000-09-08,2003-09-07
319,6,Kee Yong Wee,TIADA,BN - MCA,Dilantik Yang di-Pertuan Agong,TIADA,,,,,chinese,TIADA,Ahli Dewan Negara,,,1982-07-19,1985-07-18
319,6,Kee Yong Wee,TIADA,BN - MCA,Dilantik Yang di-Pertuan Agong,TIADA,,,,,chinese,TIADA,Ahli Dewan Negara,,,1985-12-02,1988-12-01
319,7,Kee Yong Wee,TIADA,BN - MCA,Dilantik Yang di-Pertuan Agong,TIADA,,,,,chinese,TIADA,Ahli Dewan Negara,,,1982-07-19,1985-07-18
319,7,Kee Yong Wee,TIADA,BN - MCA,Dilantik Yang di-Pertuan Agong,TIADA,,,,,chinese,TIADA,Ahli Dewan Negara,,,1985-12-02,1988-12-01
320,8,Kelsom Yaacub,TIADA,BN - UMNO,Dipilih oleh Dewan Undangan Negeri,Pahang,,,,,chinese,TIADA,Ahli Dewan Negara,,,1993-12-13,1996-12-12
321,5,Kenneth Kanyan Temenggong Koh,TIADA,TIADA,Dipilih oleh Dewan Undangan Negeri,Sarawak,,,,,other,TIADA,Ahli Dewan Negara,,,1981-12-09,1984-12-08
321,6,Kenneth Kanyan Temenggong Koh,TIADA,TIADA,Dipilih oleh Dewan Undangan Negeri,Sarawak,,,,,other,TIADA,Ahli Dewan Negara,,,1981-12-09,1984-12-08
321,6,Kenneth Kanyan Temenggong Koh,TIADA,TIADA,Dipilih oleh Dewan Undangan Negeri,Sarawak,,,,,other,TIADA,Ahli Dewan Negara,,,1984-07-30,1987-07-29
321,7,Kenneth Kanyan Temenggong Koh,TIADA,TIADA,Dipilih oleh Dewan Undangan Negeri,Sarawak,,,,,other,TIADA,Ahli Dewan Negara,,,1981-12-09,1984-12-08
321,7,Kenneth Kanyan Temenggong Koh,TIADA,TIADA,Dipilih oleh Dewan Undangan Negeri,Sarawak,,,,,other,TIADA,Ahli Dewan Negara,,,1984-07-30,1987-07-29
322,14,Kesavadas a/l  A. Achyuthan Nair,YB Senator Dato',DAP,Dipilih oleh Dewan Undangan Negeri,Negeri Sembilan,,,,M,indian,TIADA,Ahli Dewan Negara,,20.03.2019 - 19.03.2022,2019-03-20,2022-03-19
322,15,Kesavadas a/l A. Achyuthan Nair,YB Senator Dato',DAP,Dipilih oleh Dewan Undangan Negeri,Negeri Sembilan,,,,M,indian,TIADA,Ahli Dewan Negara,,20.03.2019 - 19.03.2022,2019-03-20,2022-03-19
323,12,Khairiah binti Mohamed,YB Senator Puan Hajah,PAS,Dipilih oleh Dewan Undangan Negeri,Kelantan,,,,M,bumiputera,TIADA,TIADA,,30.06.2012 - 29.06.2015,2012-06-30,2015-06-29
323,13,Khairiah binti Mohamed,YB Senator Puan Hajah,PAS,Dipilih oleh Dewan Undangan Negeri,Kelantan,,,,M,bumiputera,TIADA,TIADA,,30.06.2012 - 29.06.2015,2012-06-30,2015-06-29
324,13,Khairudin bin E.S. Abd Samad,YB Senator Dato' Sri,BN - UMNO,Dilantik Yang di-Pertuan Agong,TIADA,,,,M,bumiputera,TIADA,TIADA,,07.10.2013 - 06.10.2016,2013-10-07,2016-10-06
325,13,Khairul Azwan Bin Harun,YB Senator Tuan,BN - UMNO,Dilantik Yang di-Pertuan Agong,TIADA,,,,M,bumiputera,TIADA,Ahli Dewan Negara,,07.12.2016 - 06.12.2019,2016-12-07,2019-12-06
326,4,Khalid Abdullah,TIADA,BN - UMNO,Dilantik Yang di-Pertuan Agong,TIADA,,,,,bumiputera,TIADA,Ahli Dewan Negara,,,1976-01-05,1979-01-04
326,5,Khalid Abdullah,TIADA,BN - UMNO,Dilantik Yang di-Pertuan Agong,TIADA,,,,,bumiputera,TIADA,Ahli Dewan Negara,,,1976-01-05,1979-01-04
327,1,Khaw Kai Boh,TIADA,Perikatan - MCA,Dilantik Yang di-Pertuan Agong,TIADA,,,,,chinese,TIADA,Ahli Dewan Negara,,,1963-03-15,1964-01-01
328,5,Khoo Kay Por,TIADA,BN - Gerakan,Dipilih oleh Dewan Undangan Negeri,Pulau Pinang,,,,,chinese,TIADA,Ahli Dewan Negara,,,1982-01-11,1985-01-10
328,6,Khoo Kay Por,TIADA,BN - Gerakan,Dipilih oleh Dewan Undangan Negeri,Pulau Pinang,,,,,chinese,TIADA,Ahli Dewan Negara,,,1982-01-11,1985-01-10
328,6,Khoo Kay Por,TIADA,BN - Gerakan,Dipilih oleh Dewan Undangan Negeri,Pulau Pinang,,,,,chinese,TIADA,Ahli Dewan Negara,,,1984-01-10,1987-01-09
328,7,Khoo Kay Por,TIADA,BN - Gerakan,Dipilih oleh Dewan Undangan Negeri,Pulau Pinang,,,,,chinese,TIADA,Ahli Dewan Negara,,,1982-01-11,1985-01-10
328,7,Khoo Kay Por,TIADA,BN - Gerakan,Dipilih oleh Dewan Undangan Negeri,Pulau Pinang,,,,,chinese,TIADA,Ahli Dewan Negara,,,1984-01-10,1987-01-09
329,9,Khoo Lay Hin,TIADA,BN - MCA,Dilantik Yang di-Pertuan Agong,TIADA,,,,,chinese,TIADA,Ahli Dewan Negara,,,1998-05-18,2001-05-17
329,10,Khoo Lay Hin,TIADA,BN - MCA,Dilantik Yang di-Pertuan Agong,TIADA,,,,,chinese,TIADA,Ahli Dewan Negara,,,1996-05-14,1999-05-13
329,10,Khoo Lay Hin,TIADA,BN - MCA,Dilantik Yang di-Pertuan Agong,TIADA,,,,,chinese,TIADA,Ahli Dewan Negara,,,1998-05-18,2001-05-17
330,3,Khoo Siak Chiew,TIADA,SCA,Dipilih oleh Dewan Undangan Negeri,Sabah,,,,,chinese,TIADA,Ahli Dewan Negara,,,,
331,11,Khoo Soo Seang,TIADA,BN - MCA,Dipilih oleh Dewan Undangan Negeri,Johor,,,,,chinese,TIADA,Ahli Dewan Negara,,,,
332,2,Khoo Teck Puat,TIADA,Perikatan - MCA,Dilantik Yang di-Pertuan Agong,TIADA,,,,,chinese,TIADA,Ahli Dewan Negara,,,1964-10-19,1965-12-22
333,8,Kian Sit Har,TIADA,BN - MCA,Dipilih oleh Dewan Undangan Negeri,Melaka,,,,,chinese,TIADA,Ahli Dewan Negara,,,1993-04-19,1996-04-18
334,1,Ko Teck Kin,TIADA,Bebas,Dipilih oleh Dewan Undangan Negeri,Singapura,,,,,chinese,TIADA,Ahli Dewan Negara,,,1963-11-02,1965-08-08
334,2,Ko Teck Kin,TIADA,Bebas,Dipilih oleh Dewan Undangan Negeri,Singapura,,,,,chinese,TIADA,Ahli Dewan Negara,,,1963-11-02,1965-08-08
335,7,Koh Im Pin,TIADA,BN - MCA,Dipilih oleh Dewan Undangan Negeri,Negeri Sembilan,,,,,chinese,TIADA,Ahli Dewan Negara,,,1986-12-01,1989-11-30
336,1,Koh Kim Leng,TIADA,Perikatan - MCA,Dipilih oleh Dewan Undangan Negeri,Melaka,,,,,chinese,TIADA,Ahli Dewan Negara,,,1959-09-11,1965-09-10
336,2,Koh Kim Leng,TIADA,Perikatan - MCA,Dipilih oleh Dewan Undangan Negeri,Melaka,,,,,chinese,TIADA,Ahli Dewan Negara,,,1959-09-11,1965-09-10
336,2,Koh Kim Leng,TIADA,Perikatan - MCA,Dipilih oleh Dewan Undangan Negeri,Melaka,,,,,chinese,TIADA,Ahli Dewan Negara,,,1968-10-22,1974-10-21
337,14,Koh Nai Kwong,YB Senator Datuk Wira,MCA,Dipilih oleh Dewan Undangan Negeri,Melaka,,,,M,chinese,TIADA,Ahli Dewan Negara,,10.12.2020 - 09.12.2023,2020-12-10,2023-12-09
337,15,Koh Nai Kwong,YB Senator Datuk Wira,MCA,Dipilih oleh Dewan Undangan Negeri,Melaka,,,,M,chinese,TIADA,Ahli Dewan Negara,,10.12.2020 - 09.12.2023,2020-12-10,2023-12-09
338,12,Koh Tsu Koon,YB Senator Tan Sri Dr,BN - GERAKAN,Dilantik Yang di-Pertuan Agong,TIADA,,,,M,chinese,Menteri di Jabatan Perdana Menteri,TIADA,,09.04.2012 - 08.04.2015,2012-04-09,2015-04-08
339,9,Krishnan Perumal,TIADA,BN - MIC,Dilantik Yang di-Pertuan Agong,TIADA,,,,,other,TIADA,Ahli Dewan Negara,,,1997-04-07,2000-04-06
340,6,Kuan Peng Soon @ Kuan Peng Ching,TIADA,BN - MCA,Dipilih oleh Dewan Undangan Negeri,Perak,,,,,chinese,TIADA,Ahli Dewan Negara,,,1984-12-03,1987-12-02
340,7,Kuan Peng Soon @ Kuan Peng Ching,TIADA,BN - MCA,Dipilih oleh Dewan Undangan Negeri,Perak,,,,,chinese,TIADA,Ahli Dewan Negara,,,1984-12-03,1987-12-02
340,7,Kuan Peng Soon @ Kuan Peng Ching,TIADA,BN - MCA,Dipilih oleh Dewan Undangan Negeri,Perak,,,,,chinese,TIADA,Ahli Dewan Negara,,,1988-07-11,1991-07-10
340,8,Kuan Peng Soon @ Kuan Peng Ching,TIADA,BN - MCA,Dipilih oleh Dewan Undangan Negeri,Perak,,,,,chinese,TIADA,Ahli Dewan Negara,,,1984-12-03,1987-12-02
340,8,Kuan Peng Soon @ Kuan Peng Ching,TIADA,BN - MCA,Dipilih oleh Dewan Undangan Negeri,Perak,,,,,chinese,TIADA,Ahli Dewan Negara,,,1988-07-11,1991-07-10
341,5,Kumaran Kanugaran,TIADA,BN - MIC,Dilantik Yang di-Pertuan Agong,TIADA,,,,,indian,TIADA,Ahli Dewan Negara,,,1979-12-10,1982-12-09
341,6,Kumaran Kanugaran,TIADA,BN - MIC,Dilantik Yang di-Pertuan Agong,TIADA,,,,,indian,TIADA,Ahli Dewan Negara,,,1979-12-10,1982-12-09
341,6,Kumaran Kanugaran,TIADA,BN - MIC,Dilantik Yang di-Pertuan Agong,TIADA,,,,,indian,TIADA,Ahli Dewan Negara,,,1982-12-17,1985-12-16
342,11,Latiff Tamby Chik,TIADA,BN - UMNO,Dipilih oleh Dewan Undangan Negeri,Malacca,,,,,other,TIADA,Ahli Dewan Negara,,,,
343,10,Lau Yin Pin @ Lau Yen Beng,TIADA,BN - MCA,Dilantik Yang di-Pertuan Agong,TIADA,,,,,chinese,TIADA,Ahli Dewan Negara,,,,
344,3,Law Hieng Ding,TIADA,Perikatan - MCA,Dilantik Yang di-Pertuan Agong,TIADA,,,,,chinese,TIADA,Ahli Dewan Negara,,,,
344,5,Law Hieng Ding,TIADA,BN - MCA,Dilantik Yang di-Pertuan Agong,TIADA,,,,,chinese,TIADA,Ahli Dewan Negara,,,1979-12-12,1982-12-11
345,7,Law Jack Yoon,TIADA,BN - MCA,Dilantik Yang di-Pertuan Agong,TIADA,,,,,chinese,TIADA,Ahli Dewan Negara,,,1987-02-14,1990-02-13
345,7,Law Jack Yoon,TIADA,BN - MCA,Dilantik Yang di-Pertuan Agong,TIADA,,,,,chinese,TIADA,Ahli Dewan Negara,,,1989-12-18,1992-12-17
345,8,Law Jack Yoon,TIADA,BN - MCA,Dilantik Yang di-Pertuan Agong,TIADA,,,,,chinese,TIADA,Ahli Dewan Negara,,,1987-02-14,1990-02-13
345,8,Law Jack Yoon,TIADA,BN - MCA,Dilantik Yang di-Pertuan Agong,TIADA,,,,,chinese,TIADA,Ahli Dewan Negara,,,1989-12-18,1992-12-17
346,4,Lee Boon Chim,TIADA,TIADA,Dilantik Yang di-Pertuan Agong,TIADA,,,,,chinese,TIADA,Ahli Dewan Negara,,,,
346,5,Lee Boon Chim,TIADA,TIADA,Dilantik Yang di-Pertuan Agong,TIADA,,,,,chinese,TIADA,Ahli Dewan Negara,,,,
347,11,Lee Chee Keong,TIADA,BN - MCA,Dipilih oleh Dewan Undangan Negeri,Negeri Sembilan,,,,,chinese,TIADA,Ahli Dewan Negara,,,2005-12-20,2008-12-19
348,11,Lee Chong Meng,TIADA,BN - MCA,Dilantik Yang di-Pertuan Agong,TIADA,,,,,chinese,TIADA,Ahli Dewan Negara,,,2006-02-22,2009-02-21
349,1,Lee Foong Yee,TIADA,Perikatan - MCA,Dipilih oleh Dewan Undangan Negeri,Negeri Sembilan,,,,,chinese,TIADA,Ahli Dewan Negara,,,1959-09-11,1965-09-10
349,2,Lee Foong Yee,TIADA,Perikatan - MCA,Dipilih oleh Dewan Undangan Negeri,Negeri Sembilan,,,,,chinese,TIADA,Ahli Dewan Negara,,,1959-09-11,1965-09-10
350,5,Lee Jong Ki,TIADA,BN - MCA,Dilantik Yang di-Pertuan Agong,TIADA,,,,,chinese,TIADA,Ahli Dewan Negara,,,1981-04-14,1984-04-13
351,3,Lee Loy Seng,TIADA,Perikatan - MCA,Dilantik Yang di-Pertuan Agong,TIADA,,,,,chinese,TIADA,Ahli Dewan Negara,,,1971-12-20,1977-12-19
351,4,Lee Loy Seng,TIADA,BN - MCA,Dipilih oleh Dewan Undangan Negeri,Appointed,,,,,chinese,TIADA,Ahli Dewan Negara,,,1971-12-20,1974-12-19
351,5,Lee Loy Seng,TIADA,BN - MCA,Dipilih oleh Dewan Undangan Negeri,Appointed,,,,,chinese,TIADA,Ahli Dewan Negara,,,1971-12-20,1974-12-19
352,9,Lee Pit Chern,TIADA,BN - MCA,Dipilih oleh Dewan Undangan Negeri,Negeri Sembilan,,,,,chinese,TIADA,Ahli Dewan Negara,,,1999-05-19,2002-05-18
352,10,Lee Pit Chern,TIADA,BN - MCA,Dipilih oleh Dewan Undangan Negeri,Negeri Sembilan,,,,,chinese,TIADA,Ahli Dewan Negara,,,1999-05-19,2002-05-18
353,10,Lee Sing Chooi,TIADA,BN - MCA,Dilantik Yang di-Pertuan Agong,TIADA,,,,,chinese,TIADA,Ahli Dewan Negara,,,2003-10-02,2006-10-01
353,11,Lee Sing Chooi,TIADA,BN - MCA,Dilantik Yang di-Pertuan Agong,TIADA,,,,,chinese,TIADA,Ahli Dewan Negara,,,2003-10-02,2006-10-01
353,11,Lee Sing Chooi,TIADA,BN - MCA,Dilantik Yang di-Pertuan Agong,TIADA,,,,,chinese,TIADA,Ahli Dewan Negara,,,2006-10-14,2009-10-13
354,13,Lee Tian Sing,YB Senator Datuk,BN - MCA,Dipilih oleh Dewan Undangan Negeri,Melaka,,,,M,chinese,TIADA,TIADA,,29.11.2017 - 28.11.2020,2017-11-29,2020-11-28
355,2,Lee Yoon Thim,TIADA,Perikatan - MCA,Dilantik Yang di-Pertuan Agong,TIADA,,,,,chinese,TIADA,Ahli Dewan Negara,,,1964-05-18,1965-08-16
355,2,Lee Yoon Thim,TIADA,Perikatan - MCA,Dilantik Yang di-Pertuan Agong,TIADA,,,,,chinese,TIADA,Ahli Dewan Negara,,,1965-10-18,
355,3,Lee Yoon Thim,TIADA,Perikatan - MCA,Dilantik Yang di-Pertuan Agong,TIADA,,,,,chinese,TIADA,Ahli Dewan Negara,,,1964-05-18,1970-05-17
355,3,Lee Yoon Thim,TIADA,Perikatan - MCA,Dilantik Yang di-Pertuan Agong,TIADA,,,,,chinese,TIADA,Ahli Dewan Negara,,,1965-10-18,1971-10-17
356,1,Leong Yew Koh,TIADA,Perikatan - MCA,Dilantik Yang di-Pertuan Agong,TIADA,,,,,chinese,TIADA,Ahli Dewan Negara,,,1959-09-11,1963-01-12
357,3,Lew Sip Hon,TIADA,Perikatan - MCA,Dilantik Yang di-Pertuan Agong,TIADA,,,,,chinese,TIADA,Ahli Dewan Negara,,,1973-08-06,1979-08-05
358,12,Lihan Jok,YB Senator Tuan,BN - PBB,Dipilih oleh Dewan Undangan Negeri,Sarawak,,,,M,chinese,TIADA,TIADA,,07.12.2011 - 06.12.2014,2011-12-07,2014-12-06
359,3,Lim Ah Sitt,TIADA,Perikatan - MCA,Dipilih oleh Dewan Undangan Negeri,Johor,,,,,chinese,TIADA,Ahli Dewan Negara,,,1971-08-02,1977-08-01
359,3,Lim Ah Sitt,TIADA,Perikatan - MCA,Dipilih oleh Dewan Undangan Negeri,Johor,,,,,chinese,TIADA,Ahli Dewan Negara,,,1971-12-20,1977-12-19
359,4,Lim Ah Sitt,TIADA,BN - MCA,Dipilih oleh Dewan Undangan Negeri,Johor,,,,,chinese,TIADA,Ahli Dewan Negara,,,1971-08-02,1974-08-01
359,4,Lim Ah Sitt,TIADA,BN - MCA,Dipilih oleh Dewan Undangan Negeri,Johor,,,,,chinese,TIADA,Ahli Dewan Negara,,,1971-12-20,1974-12-19
360,7,Lim Chien Aun,TIADA,BN - Gerakan,Dipilih oleh Dewan Undangan Negeri,Pulau Pinang,,,,,chinese,TIADA,Ahli Dewan Negara,,,1990-03-19,1993-03-18
360,8,Lim Chien Aun,TIADA,BN - Gerakan,Dipilih oleh Dewan Undangan Negeri,Pulau Pinang,,,,,chinese,TIADA,Ahli Dewan Negara,,,1990-03-19,1993-03-18
361,4,Lim Ching Wah,TIADA,TIADA,Dipilih oleh Dewan Undangan Negeri,Sabah,,,,,chinese,TIADA,Ahli Dewan Negara,,,1975-04-14,1978-04-13
362,9,Lim Eng Kok,TIADA,TIADA,Dilantik Yang di-Pertuan Agong,TIADA,,,,,chinese,TIADA,Ahli Dewan Negara,,,,
362,10,Lim Eng Kok,TIADA,BN - MCA,Dilantik Yang di-Pertuan Agong,TIADA,,,,,chinese,TIADA,Ahli Dewan Negara,,,,
363,1,Lim Hee Hong,TIADA,Perikatan - MCA,Dilantik Yang di-Pertuan Agong,TIADA,,,,,chinese,TIADA,Ahli Dewan Negara,,,1959-09-11,1965-09-10
363,2,Lim Hee Hong,TIADA,Perikatan - MCA,Dilantik Yang di-Pertuan Agong,TIADA,,,,,chinese,TIADA,Ahli Dewan Negara,,,1959-09-11,1965-09-10
363,2,Lim Hee Hong,TIADA,Perikatan - MCA,Dilantik Yang di-Pertuan Agong,TIADA,,,,,chinese,TIADA,Ahli Dewan Negara,,,1965-10-18,
363,3,Lim Hee Hong,TIADA,Perikatan - MCA,Dilantik Yang di-Pertuan Agong,TIADA,,,,,chinese,TIADA,Ahli Dewan Negara,,,,1965-01-01
363,3,Lim Hee Hong,TIADA,Perikatan - MCA,Dilantik Yang di-Pertuan Agong,TIADA,,,,,chinese,TIADA,Ahli Dewan Negara,,,1965-10-18,1971-10-17
364,7,Lim Heng Tee,TIADA,BN - Gerakan,Dipilih oleh Dewan Undangan Negeri,Pulau Pinang,,,,,chinese,TIADA,Ahli Dewan Negara,,,1987-02-23,1990-02-22
365,6,Lim Hiang Nai @ Lim Sean Lean,TIADA,BN - MCA,Dilantik Yang di-Pertuan Agong,TIADA,,,,,chinese,TIADA,Ahli Dewan Negara,,,1983-12-05,1986-12-04
365,7,Lim Hiang Nai @ Lim Sean Lean,TIADA,BN - MCA,Dilantik Yang di-Pertuan Agong,TIADA,,,,,chinese,TIADA,Ahli Dewan Negara,,,1983-12-05,1986-12-04
366,2,Lim Joo Kong,TIADA,Perikatan - MCA,Dipilih oleh Dewan Undangan Negeri,Kedah,,,,,chinese,TIADA,Ahli Dewan Negara,,,1965-10-18,1967-10-04
367,6,Lim Kean Siew,TIADA,BN - MCA,Dilantik Yang di-Pertuan Agong,TIADA,,,,,chinese,TIADA,Ahli Dewan Negara,,,1984-03-08,1987-03-07
367,7,Lim Kean Siew,TIADA,BN - MCA,Dilantik Yang di-Pertuan Agong,TIADA,,,,,chinese,TIADA,Ahli Dewan Negara,,,1984-03-08,1987-03-07
368,10,Lim Kee Moi,TIADA,BN - MCA,Dipilih oleh Dewan Undangan Negeri,Johor,,,,,chinese,TIADA,Ahli Dewan Negara,,,,
369,12,Lim Nget Yoon,YB Senator Dato',BN - MCA,Dipilih oleh Dewan Undangan Negeri,Pahang,,,,M,chinese,TIADA,TIADA,,22.05.2012 - 21.05.2015,2012-05-22,2015-05-21
370,13,Lim Pay Hen,YB Senator Datuk,BN - MCA,Dipilih oleh Dewan Undangan Negeri,Johor,,,,M,chinese,TIADA,TIADA,,04.12.2017 - 03.12.2020,2017-12-04,2020-12-03
370,14,Lim Pay Hen,YB Senator Datuk,MCA,Dipilih oleh Dewan Undangan Negeri,Johor,,,,M,chinese,TIADA,Ahli Dewan Negara,,04.12.2017 - 03.12.2020,2017-12-04,2020-12-03
370,15,Lim Pay Hen,YB Senator Datuk,MCA,Dipilih oleh Dewan Undangan Negeri,Johor,,,,M,chinese,TIADA,Ahli Dewan Negara,,04.12.2017 - 03.12.2020,2017-12-04,2020-12-03
371,10,Lim Sing @ Lam Kam Sang,TIADA,BN - MCA,Dipilih oleh Dewan Undangan Negeri,Pahang,,,,,chinese,TIADA,Ahli Dewan Negara,,,2003-04-28,2006-04-27
371,11,Lim Sing @ Lam Kam Sang,TIADA,BN - MCA,Dipilih oleh Dewan Undangan Negeri,Pahang,,,,,chinese,TIADA,Ahli Dewan Negara,,,2003-04-28,2006-04-27
372,8,Limun Laikim,TIADA,TIADA,Dipilih oleh Dewan Undangan Negeri,Sabah,,,,,chinese,TIADA,Ahli Dewan Negara,,,1993-04-19,1996-04-18
373,15,Lingeshwaran a/l Dato' Seri R. Arunasalam,YB Senator Dr.,DAP,Dipilih oleh Dewan Undangan Negeri,Pulau Pinang,,,,M,indian,TIADA,Ahli Dewan Negara,,07.03.2023 - 06.03.2026,2023-03-07,2026-03-06
374,11,Loga Chitra M. Govindasamy,TIADA,BN - MIC,Dilantik Yang di-Pertuan Agong,TIADA,,,,,indian,TIADA,Ahli Dewan Negara,,,2007-04-06,2010-04-05
375,6,Loh Fook Yen,TIADA,BN - MCA,Dilantik Yang di-Pertuan Agong,TIADA,,,,,chinese,TIADA,Ahli Dewan Negara,,,1983-12-12,1986-12-11
376,5,Loh Kee Peng,TIADA,BN - MCA,Dipilih oleh Dewan Undangan Negeri,Melaka,,,,,chinese,TIADA,Ahli Dewan Negara,,,1980-12-15,1983-12-14
377,9,Long Jidin,TIADA,Bebas,Dilantik Yang di-Pertuan Agong,TIADA,,,,,chinese,TIADA,Ahli Dewan Negara,,,1997-05-26,2000-05-25
377,10,Long Jidin,TIADA,IND,Dilantik Yang di-Pertuan Agong,TIADA,,,,,chinese,TIADA,Ahli Dewan Negara,,,1997-05-26,2000-05-25
377,10,Long Jidin,TIADA,IND,Dilantik Yang di-Pertuan Agong,TIADA,,,,,chinese,TIADA,Ahli Dewan Negara,,,2000-06-25,2000-06-24
378,5,Loo Swee Mok,TIADA,BN - MCA,Dipilih oleh Dewan Undangan Negeri,Pahang,,,,,chinese,TIADA,Ahli Dewan Negara,,,1981-04-13,1984-04-12
378,6,Loo Swee Mok,TIADA,BN - MCA,Dipilih oleh Dewan Undangan Negeri,Pahang,,,,,chinese,TIADA,Ahli Dewan Negara,,,1981-04-13,1984-04-12
378,6,Loo Swee Mok,TIADA,BN - MCA,Dipilih oleh Dewan Undangan Negeri,Pahang,,,,,chinese,TIADA,Ahli Dewan Negara,,,1983-12-20,1986-12-19
378,7,Loo Swee Mok,TIADA,BN - MCA,Dipilih oleh Dewan Undangan Negeri,Pahang,,,,,chinese,TIADA,Ahli Dewan Negara,,,1981-04-13,1984-04-12
378,7,Loo Swee Mok,TIADA,BN - MCA,Dipilih oleh Dewan Undangan Negeri,Pahang,,,,,chinese,TIADA,Ahli Dewan Negara,,,1983-12-20,1986-12-19
379,8,Low Kai Meng,TIADA,BN - MCA,Dipilih oleh Dewan Undangan Negeri,Perak,,,,,chinese,TIADA,Ahli Dewan Negara,,,1994-12-14,1997-12-13
380,15,Low Kian Chuan,YB Senator Tan Sri Dato',PROFESIONAL,Dilantik Yang di-Pertuan Agong,TIADA,,,,M,chinese,TIADA,Ahli Dewan Negara,,20.03.2023 - 19.03.2026,2023-03-20,2026-03-19
381,12,Lucas bin Umbul,YB Senator Dr.,BN - UPKO,Dipilih oleh Dewan Undangan Negeri,Sabah,,,,M,bumiputera,TIADA,TIADA,,10.12.2012 - 09.12.2015,2012-12-10,2015-12-09
381,13,Lucas bin Umbul,YB Senator Datuk Dr.,BN - UPKO,Dipilih oleh Dewan Undangan Negeri,Sabah,,,,M,bumiputera,TIADA,TIADA,,10.12.2012 - 09.12.2015,2012-12-10,2015-12-09
382,6,M. G. Pandithan,TIADA,BN - MIC,Dipilih oleh Dewan Undangan Negeri,Selangor,,,,,indian,TIADA,Ahli Dewan Negara,,,,
383,6,M. K. Muthusamy,TIADA,BN - MIC,Dilantik Yang di-Pertuan Agong,TIADA,,,,,indian,TIADA,Ahli Dewan Negara,,,1982-07-19,1985-07-18
384,10,M. Kayveas,TIADA,BN - PPP,Dilantik Yang di-Pertuan Agong,TIADA,,,,,indian,TIADA,Ahli Dewan Negara,,,2000-12-06,2003-12-05
385,10,M. Krishnan,TIADA,BN - MIC,Dilantik Yang di-Pertuan Agong,TIADA,,,,,indian,TIADA,Ahli Dewan Negara,,,,
385,11,M. Krishnan,TIADA,BN - MIC,Dilantik Yang di-Pertuan Agong,TIADA,,,,,indian,TIADA,Ahli Dewan Negara,,,,
386,4,M. Mahalingam,TIADA,BN - MIC,Dilantik Yang di-Pertuan Agong,TIADA,,,,,indian,TIADA,Ahli Dewan Negara,,,1976-08-09,1979-08-08
386,5,M. Mahalingam,TIADA,BN - MIC,Dilantik Yang di-Pertuan Agong,TIADA,,,,,indian,TIADA,Ahli Dewan Negara,,,1976-08-09,1979-08-08
386,5,M. Mahalingam,TIADA,BN - MIC,Dilantik Yang di-Pertuan Agong,TIADA,,,,,indian,TIADA,Ahli Dewan Negara,,,1980-12-15,1983-12-14
387,5,M. Muthu Palaniappan,TIADA,BN - MIC,Dilantik Yang di-Pertuan Agong,TIADA,,,,,indian,TIADA,Ahli Dewan Negara,,,1980-12-15,1983-12-14
388,6,M. Nyanapandithan,TIADA,BN - MIC,Dipilih oleh Dewan Undangan Negeri,Selangor,,,,,indian,TIADA,Ahli Dewan Negara,,,1984-12-11,1987-12-10
389,7,M. Sangaralingam,TIADA,BN - MIC,Dilantik Yang di-Pertuan Agong,TIADA,,,,,indian,TIADA,Ahli Dewan Negara,,,1986-12-15,1989-12-14
390,8,M. Zeevill @ Shanmugam a/I R.M.S. Mutaya,TIADA,BN - MIC,Dipilih oleh Dewan Undangan Negeri,Selangor,,,,,indian,TIADA,Ahli Dewan Negara,,,1994-08-11,1997-08-10
391,12,Maglin a/l Dennis D'cruz,YB Senator Datuk,BN - PPP,Dilantik Yang di-Pertuan Agong,TIADA,,,,M,indian,"Timbalan Menteri Penerangan, Komunikasi dan Kebudayaan",TIADA,,02.06.2010 - 01.06.2013,2010-06-02,2013-06-01
392,3,Mahathir Mohamad,TIADA,Perikatan - UMNO,Dipilih oleh Dewan Undangan Negeri,Kedah,,,,,bumiputera,TIADA,Ahli Dewan Negara,,,1973-08-12,1979-08-11
393,4,Mahimon Harun,TIADA,BN - UMNO,Dipilih oleh Dewan Undangan Negeri,Pahang,,,,,bumiputera,TIADA,Ahli Dewan Negara,,,1977-11-09,1980-11-08
393,5,Mahimon Harun,TIADA,BN - UMNO,Dipilih oleh Dewan Undangan Negeri,Pahang,,,,,bumiputera,TIADA,Ahli Dewan Negara,,,1977-11-09,1980-11-08
394,4,Mahmoud Salim Mohamad,TIADA,BN - UMNO,Dipilih oleh Dewan Undangan Negeri,Terengganu,,,,,bumiputera,TIADA,Ahli Dewan Negara,,,1977-11-09,1980-11-08
394,5,Mahmoud Salim Mohamad,TIADA,BN - UMNO,Dipilih oleh Dewan Undangan Negeri,Terengganu,,,,,bumiputera,TIADA,Ahli Dewan Negara,,,1977-11-09,1980-11-08
395,11,Maijol Mahap,TIADA,BN - UPKO,Dipilih oleh Dewan Undangan Negeri,Sabah,,,,,other,TIADA,Ahli Dewan Negara,,,2006-12-06,2009-12-05
396,7,Mak Hon Kam,TIADA,BN - MCA,Dilantik Yang di-Pertuan Agong,TIADA,,,,,other,TIADA,Ahli Dewan Negara,,,1986-12-01,1989-12-30
396,8,Mak Hon Kam,TIADA,BN - MCA,Dilantik Yang di-Pertuan Agong,TIADA,,,,,other,TIADA,Ahli Dewan Negara,,,1986-12-01,1989-12-30
396,8,Mak Hon Kam,TIADA,BN - MCA,Dilantik Yang di-Pertuan Agong,TIADA,,,,,other,TIADA,Ahli Dewan Negara,,,1991-02-18,1994-02-17
397,15,Manolan bin Mohamad,YB Senator Tuan,PKR,Dilantik Yang di-Pertuan Agong,TIADA,,,,M,bumiputera,TIADA,Ahli Dewan Negara,,27.08.2018 - 26.08.2021,2018-08-27,2021-08-26
398,10,Mansor Md. Jaafar,TIADA,BN - UMNO,Dilantik Yang di-Pertuan Agong,TIADA,,,,,bumiputera,TIADA,Ahli Dewan Negara,,,2001-11-26,2004-11-25
399,3,Mansor Mohamad,TIADA,Perikatan - UMNO,Dipilih oleh Dewan Undangan Negeri,Terengganu,,,,,bumiputera,TIADA,Ahli Dewan Negara,,,1971-12-20,1977-12-19
399,4,Mansor Mohamad,TIADA,BN - UMNO,Dipilih oleh Dewan Undangan Negeri,Terengganu,,,,,bumiputera,TIADA,Ahli Dewan Negara,,,1971-12-20,1974-12-19
400,10,Mariah Abdullah,TIADA,BN - UMNO,Dipilih oleh Dewan Undangan Negeri,Perlis,,,,,bumiputera,TIADA,Ahli Dewan Negara,,,,
400,11,Mariah Abdullah,TIADA,BN - UMNO,Dipilih oleh Dewan Undangan Negeri,Perlis,,,,,bumiputera,TIADA,Ahli Dewan Negara,,,,
401,12,Mariany binti Mohammad Yit,YB Senator Puan Hajah,BN - UMNO,Dilantik Yang di-Pertuan Agong,TIADA,,,,M,bumiputera,TIADA,TIADA,,15.12.2010 - 14.12.2013,2010-12-15,2013-12-14
402,9,Marimuthu Nadeson,TIADA,BN - MIC,Dilantik Yang di-Pertuan Agong,TIADA,,,,,indian,TIADA,Ahli Dewan Negara,,,1998-03-09,2001-03-08
402,10,Marimuthu Nadeson,TIADA,BN - MIC,Dilantik Yang di-Pertuan Agong,TIADA,,,,,indian,TIADA,Ahli Dewan Negara,,,1998-03-09,2001-03-08
403,9,Marimuthu Thangaveloo,TIADA,BN - MIC,Dilantik Yang di-Pertuan Agong,TIADA,,,,,indian,TIADA,Ahli Dewan Negara,,,1999-05-19,2002-05-18
404,12,Mashitah binti Ibrahim,YB Senator Dato' Dr.,BN - UMNO,Dilantik Yang di-Pertuan Agong,TIADA,,,,M,bumiputera,Timbalan Menteri di Jabatan Perdana Menteri,TIADA,,18.3.2011 - 17.3.2014,2011-03-18,2014-03-17
405,8,Mastika Junaidah Husin,TIADA,BN - UMNO,Dilantik Yang di-Pertuan Agong,TIADA,,,,,bumiputera,TIADA,Ahli Dewan Negara,,,1994-12-14,1997-12-13
405,9,Mastika Junaidah Husin,TIADA,BN - UMNO,Dilantik Yang di-Pertuan Agong,TIADA,,,,,bumiputera,TIADA,Ahli Dewan Negara,,,1998-03-09,2001-03-08
406,6,Mazidah Zakaria,TIADA,BN - UMNO,Dilantik Yang di-Pertuan Agong,TIADA,,,,,bumiputera,TIADA,Ahli Dewan Negara,,,1986-02-18,1989-02-17
406,7,Mazidah Zakaria,TIADA,BN - UMNO,Dilantik Yang di-Pertuan Agong,TIADA,,,,,bumiputera,TIADA,Ahli Dewan Negara,,,1986-02-18,1989-02-17
406,7,Mazidah Zakaria,TIADA,BN - UMNO,Dilantik Yang di-Pertuan Agong,TIADA,,,,,bumiputera,TIADA,Ahli Dewan Negara,,,1989-03-27,1992-03-26
407,9,Mazlan Abu,TIADA,BN - UMNO,Dipilih oleh Dewan Undangan Negeri,Johor,,,,,bumiputera,TIADA,Ahli Dewan Negara,,,1999-08-02,2002-08-01
407,10,Mazlan Abu,TIADA,BN - UMNO,Dipilih oleh Dewan Undangan Negeri,Johor,,,,,bumiputera,TIADA,Ahli Dewan Negara,,,1999-08-02,2002-08-01
408,12,Maznah binti Mazlan,YB Senator Dato',BN - UMNO,Dilantik Yang di-Pertuan Agong,TIADA,,,,M,bumiputera,Timbalan Menteri Sumber Manusia,TIADA,,18.04.2011 - 17.04.2014,2011-04-18,2014-04-17
409,3,Md Hanipah Sheikh Alauddin,TIADA,Perikatan - UMNO,Dipilih oleh Dewan Undangan Negeri,Kedah,,,,,bumiputera,TIADA,Ahli Dewan Negara,,,1968-01-04,1974-01-03
409,3,Md Hanipah Sheikh Alauddin,TIADA,Perikatan - UMNO,Dipilih oleh Dewan Undangan Negeri,Kedah,,,,,bumiputera,TIADA,Ahli Dewan Negara,,,1968-10-22,1974-10-21
410,14,Md Nasir Bin Hashim,YB Senator Ir.,BERSATU,Dilantik Yang di-Pertuan Agong,TIADA,,,,M,bumiputera,TIADA,Ahli Dewan Negara,,27.08.2018 - 26.08.2021,2018-08-27,2021-08-26
411,13,Megat Zulkarnain bin Tan Sri Datuk Wira Haji Omardin,YB Senator Datuk Haji,BN - UMNO,Dilantik Yang di-Pertuan Agong,TIADA,,,,M,bumiputera,TIADA,TIADA,,07.10.2013 - 06.10.2016,2013-10-07,2016-10-06
412,9,Melanie Chua Chui Ket,TIADA,BN - SAPP,Dilantik Yang di-Pertuan Agong,TIADA,,,,,chinese,TIADA,Ahli Dewan Negara,,,1999-08-02,2002-08-01
412,10,Melanie Chua Chui Ket,TIADA,BN - SAPP,Dilantik Yang di-Pertuan Agong,TIADA,,,,,chinese,TIADA,Ahli Dewan Negara,,,1999-08-02,2002-08-01
413,10,Melati Ali,TIADA,BN - UMNO,Dipilih oleh Dewan Undangan Negeri,Pahang,,,,,bumiputera,TIADA,Ahli Dewan Negara,,,,
414,8,Michael Bong Thiam Joon,TIADA,BN - SNAP,Dilantik Yang di-Pertuan Agong,TIADA,,,,,other,TIADA,Ahli Dewan Negara,,,1992-08-05,1995-08-04
415,9,Michael Chen Wing Sum,TIADA,BN - Gerakan,Dilantik Yang di-Pertuan Agong,TIADA,,,,,other,Timbalan Yang di-Pertua Dewan,Ahli Dewan Negara,,,1997-04-07,2000-04-06
415,10,Michael Chen Wing Sum,TIADA,BN - Gerakan,Dilantik Yang di-Pertuan Agong,TIADA,,,,,other,TIADA,Ahli Dewan Negara,,,1997-04-07,2000-04-06
415,10,Michael Chen Wing Sum,TIADA,BN - Gerakan,Dilantik Yang di-Pertuan Agong,TIADA,,,,,other,TIADA,Ahli Dewan Negara,,,2000-04-24,2003-04-23
416,15,Michael Mujah Lihan,YB Senator Tuan,PBB,Dipilih oleh Dewan Undangan Negeri,Sarawak,,,,M,bumiputera,TIADA,Ahli Dewan Negara,,11.12.2023 - 10.12.2026,2023-12-11,2026-12-10
417,4,Michael Wong Kuan Lee,TIADA,BN - MCA,Dilantik Yang di-Pertuan Agong,TIADA,,,,,chinese,TIADA,Ahli Dewan Negara,,,1977-11-09,1980-11-08
417,5,Michael Wong Kuan Lee,TIADA,BN - MCA,Dilantik Yang di-Pertuan Agong,TIADA,,,,,chinese,TIADA,Ahli Dewan Negara,,,1977-11-09,1980-11-08
418,14,Mohamad Ali bin Haji Mohamad,YB Senator Dato' Sri Dr. Haji,UMNO,Dipilih oleh Dewan Undangan Negeri,Melaka,,,,M,bumiputera,TIADA,Timbalan Yang di-Pertua Dewan Negara,,11.05.2020 - 10.05.2023,2020-05-11,2023-05-10
419,14,Mohamad Fatmi Bin Hj. Che Salleh,YB Senator Tan Sri Hj.,BN - UMNO,Dilantik Yang di-Pertuan Agong,TIADA,,,,M,bumiputera,TIADA,Ahli Dewan Negara,,25.04.2022 - 24.04.2025,2022-04-25,2025-04-24
419,15,Mohamad Fatmi bin Hj. Che Salleh,YB Senator Tan Sri Hj.,UMNO,Dilantik Yang di-Pertuan Agong,TIADA,,,,M,bumiputera,TIADA,Ahli Dewan Negara,,25.04.2022 - 24.04.2025,2022-04-25,2025-04-24
420,2,Mohamad Noah Omar,TIADA,Perikatan - UMNO,Dilantik Yang di-Pertuan Agong,TIADA,,,,,bumiputera,TIADA,Ahli Dewan Negara,,,1964-09-11,
421,10,Mohamad Taha Ariffin,TIADA,BN - PBB,Dipilih oleh Dewan Undangan Negeri,Sarawak,,,,,bumiputera,TIADA,Ahli Dewan Negara,,,2002-11-18,2005-11-17
422,1,Mohamed Adib Omar,TIADA,Perikatan - UMNO,Dipilih oleh Dewan Undangan Negeri,Terengganu,,,,,bumiputera,TIADA,Ahli Dewan Negara,,,1962-10-15,1968-10-14
422,2,Mohamed Adib Omar,TIADA,Perikatan - UMNO,Dipilih oleh Dewan Undangan Negeri,Terengganu,,,,,bumiputera,TIADA,Ahli Dewan Negara,,,1962-10-15,1968-10-14
423,1,Mohamed Ghazali Jawi,TIADA,Perikatan - UMNO,Dilantik Yang di-Pertuan Agong,TIADA,,,,,bumiputera,TIADA,Ahli Dewan Negara,,,1963-06-03,1964-01-01
423,4,Mohamed Ghazali Jawi,TIADA,BN - UMNO,Dilantik Yang di-Pertuan Agong,TIADA,,,,,bumiputera,TIADA,Ahli Dewan Negara,,,1977-11-09,1980-11-08
423,5,Mohamed Ghazali Jawi,TIADA,BN - UMNO,Dilantik Yang di-Pertuan Agong,TIADA,,,,,bumiputera,TIADA,Ahli Dewan Negara,,,1977-11-09,1980-11-08
423,6,Mohamed Ghazali Jawi,TIADA,BN - UMNO,Dilantik Yang di-Pertuan Agong,TIADA,,,,,bumiputera,TIADA,Ahli Dewan Negara,,,1977-11-09,1980-11-08
423,6,Mohamed Ghazali Jawi,TIADA,BN - UMNO,Dilantik Yang di-Pertuan Agong,TIADA,,,,,bumiputera,TIADA,Ahli Dewan Negara,,,,1982-12-09
424,14,Mohamed Haniffa bin Abdullah,YB Senator Prof. Tan Sri Datuk Dr. Haji,BN - MIC,Dilantik Yang di-Pertuan Agong,TIADA,,,,M,bumiputera,TIADA,Ahli Dewan Negara,,26.09.2022 - 25.09.2025,2022-09-26,2025-09-25
424,15,Mohamed Haniffa bin Abdullah,YB Senator Prof. Tan Sri Datuk Dr. Haji,MIC,Dilantik Yang di-Pertuan Agong,TIADA,,,,M,bumiputera,TIADA,Ahli Dewan Negara,,26.09.2022 - 25.09.2025,2022-09-26,2025-09-25
425,4,Mohamed Nasir,TIADA,BN - BERJASA,Dipilih oleh Dewan Undangan Negeri,Kelantan,,,,,bumiputera,TIADA,Ahli Dewan Negara,,,1978-04-17,1981-04-16
425,5,Mohamed Nasir,TIADA,BN - BERJASA,Dipilih oleh Dewan Undangan Negeri,Kelantan,,,,,bumiputera,TIADA,Ahli Dewan Negara,,,1978-04-17,1981-04-16
425,6,Mohamed Nasir,TIADA,BN - BERJASA,Dipilih oleh Dewan Undangan Negeri,Kelantan,,,,,bumiputera,TIADA,Ahli Dewan Negara,,,1978-04-17,1981-04-16
426,8,Mohamed Nazri Abdul Aziz,TIADA,BN - UMNO,Dilantik Yang di-Pertuan Agong,TIADA,,,,,bumiputera,TIADA,Ahli Dewan Negara,,,1991-12-30,1994-12-29
427,3,Mohamed Noor Tahir,TIADA,Perikatan - UMNO,Dilantik Yang di-Pertuan Agong,TIADA,,,,,bumiputera,TIADA,Ahli Dewan Negara,,,,
428,10,Mohamed Omar Beledram,TIADA,BN - UMNO,Dilantik Yang di-Pertuan Agong,TIADA,,,,,bumiputera,TIADA,Ahli Dewan Negara,,,2001-11-26,2004-11-25
429,2,Mohamed Said Abu Bakar,TIADA,USNO,Dilantik Yang di-Pertuan Agong,TIADA,,,,,bumiputera,TIADA,Ahli Dewan Negara,,,1964-09-11,
429,3,Mohamed Said Abu Bakar,TIADA,USNO,Dilantik Yang di-Pertuan Agong,TIADA,,,,,bumiputera,TIADA,Ahli Dewan Negara,,,1964-09-11,1970-09-10
429,3,Mohamed Said Abu Bakar,TIADA,USNO,Dilantik Yang di-Pertuan Agong,TIADA,,,,,bumiputera,TIADA,Ahli Dewan Negara,,,1971-02-20,1977-02-19
429,4,Mohamed Said Abu Bakar,TIADA,USNO,Dilantik Yang di-Pertuan Agong,TIADA,,,,,bumiputera,TIADA,Ahli Dewan Negara,,,1964-09-11,1967-09-10
429,4,Mohamed Said Abu Bakar,TIADA,USNO,Dilantik Yang di-Pertuan Agong,TIADA,,,,,bumiputera,TIADA,Ahli Dewan Negara,,,1971-02-20,1974-02-19
429,4,Mohamed Said Abu Bakar,TIADA,USNO,Dilantik Yang di-Pertuan Agong,TIADA,,,,,bumiputera,TIADA,Ahli Dewan Negara,,,,1978-04-16
430,1,Mohamed Salleh Mohamed Ariff,TIADA,Perikatan - UMNO,Dipilih oleh Dewan Undangan Negeri,Melaka,,,,,bumiputera,TIADA,Ahli Dewan Negara,,,1959-09-11,1965-09-10
430,2,Mohamed Salleh Mohamed Ariff,TIADA,Perikatan - UMNO,Dipilih oleh Dewan Undangan Negeri,Melaka,,,,,bumiputera,TIADA,Ahli Dewan Negara,,,1959-09-11,1965-09-10
431,9,Mohamed Yaacob,TIADA,BN - UMNO,Dilantik Yang di-Pertuan Agong,TIADA,,,,,bumiputera,Yang di-Pertua Dewan,Ahli Dewan Negara,,,1996-12-10,1999-12-09
431,10,Mohamed Yaacob,TIADA,BN - UMNO,Dilantik Yang di-Pertuan Agong,TIADA,,,,,bumiputera,TIADA,Ahli Dewan Negara,,,1996-12-10,1999-12-09
432,6,Mohamed Yahya,TIADA,BN - UMNO,Dipilih oleh Dewan Undangan Negeri,Johor,,,,,bumiputera,TIADA,Ahli Dewan Negara,,,1983-08-08,1986-08-07
432,6,Mohamed Yahya,TIADA,BN - UMNO,Dipilih oleh Dewan Undangan Negeri,Johor,,,,,bumiputera,TIADA,Ahli Dewan Negara,,,1983-12-05,1986-12-04
432,7,Mohamed Yahya,TIADA,BN - UMNO,Dipilih oleh Dewan Undangan Negeri,Johor,,,,,bumiputera,TIADA,Ahli Dewan Negara,,,1983-08-08,1986-08-07
432,7,Mohamed Yahya,TIADA,BN - UMNO,Dipilih oleh Dewan Undangan Negeri,Johor,,,,,bumiputera,TIADA,Ahli Dewan Negara,,,1983-12-05,1986-12-04
433,6,Mohamed Yusof Mohamed Noor,TIADA,BN - UMNO,Dilantik Yang di-Pertuan Agong,TIADA,,,,,bumiputera,TIADA,Ahli Dewan Negara,,,,
433,7,Mohamed Yusof Mohamed Noor,TIADA,BN - UMNO,Dilantik Yang di-Pertuan Agong,TIADA,,,,,bumiputera,TIADA,Ahli Dewan Negara,,,,
434,1,Mohamed Zahir Ismail,TIADA,Perikatan - UMNO,Dipilih oleh Dewan Undangan Negeri,Kedah,,,,,bumiputera,TIADA,Ahli Dewan Negara,,,1959-09-11,1964-03-01
435,4,Mohammad Tahir Tan Tong Hye,TIADA,BN - MCA,Dilantik Yang di-Pertuan Agong,TIADA,,,,,bumiputera,TIADA,Ahli Dewan Negara,,,1965-10-18,1968-10-17
435,4,Mohammad Tahir Tan Tong Hye,TIADA,BN - MCA,Dilantik Yang di-Pertuan Agong,TIADA,,,,,bumiputera,TIADA,Ahli Dewan Negara,,,1971-12-20,1974-12-19
436,8,Mohammad Wajdi Ishak,TIADA,BN - UMNO,Dilantik Yang di-Pertuan Agong,TIADA,,,,,bumiputera,TIADA,Ahli Dewan Negara,,,1987-02-23,1990-02-22
436,8,Mohammad Wajdi Ishak,TIADA,BN - UMNO,Dilantik Yang di-Pertuan Agong,TIADA,,,,,bumiputera,TIADA,Ahli Dewan Negara,,,1990-02-20,1993-02-19
437,8,Mohammed Radzi Manan,TIADA,BN - UMNO,Dipilih oleh Dewan Undangan Negeri,Perak,,,,,bumiputera,TIADA,Ahli Dewan Negara,,,1994-05-09,1997-05-08
438,13,Mohan a/l Thangarasu,YB Senator Datuk,BN - MIC,Dilantik Yang di-Pertuan Agong,TIADA,,,,M,bumiputera,TIADA,TIADA,,16.11.2017 - 15.11.2020,2017-11-16,2020-11-15
439,4,Mohd Amin Yaakob,TIADA,BN - PAS,Dipilih oleh Dewan Undangan Negeri,Kelantan,,,,,bumiputera,TIADA,Ahli Dewan Negara,,,1975-01-06,1978-01-05
439,5,Mohd Amin Yaakob,TIADA,BN - PAS,Dipilih oleh Dewan Undangan Negeri,Kelantan,,,,,bumiputera,TIADA,Ahli Dewan Negara,,,1975-01-06,1978-01-05
440,14,Mohd Apandi Bin Mohamad,YB Senator Sr,PAS,Dipilih oleh Dewan Undangan Negeri,Kelantan,,,,M,bumiputera,TIADA,TIADA,,08.07.2020 hingga 07.07.2023,2020-07-08,
441,5,Mohd Din Jaafar,TIADA,BN - UMNO,Dilantik Yang di-Pertuan Agong,TIADA,,,,,bumiputera,TIADA,Ahli Dewan Negara,,,1980-04-07,1983-04-06
441,6,Mohd Din Jaafar,TIADA,BN - UMNO,Dilantik Yang di-Pertuan Agong,TIADA,,,,,bumiputera,TIADA,Ahli Dewan Negara,,,1980-04-07,1983-04-06
441,6,Mohd Din Jaafar,TIADA,BN - UMNO,Dilantik Yang di-Pertuan Agong,TIADA,,,,,bumiputera,TIADA,Ahli Dewan Negara,,,1983-08-08,1986-08-07
442,11,Mohd Effendi Norwawi,TIADA,BN - PBB,Dilantik Yang di-Pertuan Agong,TIADA,,,,,bumiputera,TIADA,Ahli Dewan Negara,,,2006-02-16,2009-02-15
443,7,Mohd Ghazali Mohd Seth,TIADA,BN - UMNO,Dilantik Yang di-Pertuan Agong,TIADA,,,,,bumiputera,TIADA,Ahli Dewan Negara,,,1990-03-19,1993-03-18
443,8,Mohd Ghazali Mohd Seth,TIADA,BN - UMNO,Dilantik Yang di-Pertuan Agong,TIADA,,,,,bumiputera,TIADA,Ahli Dewan Negara,,,1990-03-19,1993-03-18
444,15,Mohd Hasbie bin Muda,YB Senator Tuan,PH - AMANAH,Dilantik Yang di-Pertuan Agong,TIADA,,,,M,bumiputera,TIADA,Ahli Dewan Negara,,20.03.2023 - 19.03.2026,2023-03-20,2026-03-19
445,15,Mohd Hatta bin Md Ramli,YB Senator Datuk Wira Dr.,PH - AMANAH,Dilantik Yang di-Pertuan Agong,TIADA,,,,M,bumiputera,TIADA,Ahli Dewan Negara,,20.03.2023 - 19.03.2026,2023-03-20,2026-03-19
446,14,Mohd Hisamudin bin Yahaya,YB Senator Datuk,BN - UMNO,Dilantik Yang di-Pertuan Agong,TIADA,,,,M,bumiputera,TIADA,Ahli Dewan Negara,,04.10.2021 - 03.10.2024,2021-10-04,2024-10-03
447,12,Mohd Khalid Bin Ahmad,YB Senator Tuan,BN - UMNO,Dipilih oleh Dewan Undangan Negeri,Perlis,,,,M,bumiputera,TIADA,TIADA,,25.04.2012 - 24.04.2015,2012-04-25,2015-04-24
448,9,Mohd Khalil Yaakob,TIADA,BN - UMNO,Dilantik Yang di-Pertuan Agong,TIADA,,,,,bumiputera,Menteri Kabinet,Ahli Dewan Negara,,,1999-05-24,2002-05-23
449,15,Mohd Na'im bin Mokhtar,YB Senator Dato' Setia Dr. Haji,PROFESIONAL,Dilantik Yang di-Pertuan Agong,TIADA,,,,M,bumiputera,Menteri Agama,Menteri Agama,,03.12.2022 - 02.12.2025,2022-12-03,2025-12-02
450,6,Mohd Noor Abdullah,TIADA,BN - UMNO,Dipilih oleh Dewan Undangan Negeri,Kelantan,,,,,bumiputera,TIADA,Ahli Dewan Negara,,,1984-12-03,1987-12-02
450,7,Mohd Noor Abdullah,TIADA,BN - UMNO,Dipilih oleh Dewan Undangan Negeri,Kelantan,,,,,bumiputera,TIADA,Ahli Dewan Negara,,,1984-12-03,1987-12-02
450,7,Mohd Noor Abdullah,TIADA,BN - UMNO,Dipilih oleh Dewan Undangan Negeri,Kelantan,,,,,bumiputera,TIADA,Ahli Dewan Negara,,,1988-03-28,1991-03-27
450,8,Mohd Noor Abdullah,TIADA,BN - UMNO,Dipilih oleh Dewan Undangan Negeri,Kelantan,,,,,bumiputera,TIADA,Ahli Dewan Negara,,,1984-12-03,1987-12-02
450,8,Mohd Noor Abdullah,TIADA,BN - UMNO,Dipilih oleh Dewan Undangan Negeri,Kelantan,,,,,bumiputera,TIADA,Ahli Dewan Negara,,,1988-03-28,1991-03-27
451,6,Mohd Noor Bedah,TIADA,BN - UMNO,Dipilih oleh Dewan Undangan Negeri,Perlis,,,,,bumiputera,TIADA,Ahli Dewan Negara,,,1983-12-05,1986-12-04
451,7,Mohd Noor Bedah,TIADA,BN - UMNO,Dipilih oleh Dewan Undangan Negeri,Perlis,,,,,bumiputera,TIADA,Ahli Dewan Negara,,,1983-12-05,1986-12-04
451,7,Mohd Noor Bedah,TIADA,BN - UMNO,Dipilih oleh Dewan Undangan Negeri,Perlis,,,,,bumiputera,TIADA,Ahli Dewan Negara,,,1986-12-19,1989-12-18
452,13,Mohd Nor Bin Haji Monutty,YB Senator Dr.,PKR,Dipilih oleh Dewan Undangan Negeri,Selangor,,,,M,bumiputera,TIADA,TIADA,,17.12.2015 - 16.12.2018,2015-12-17,2018-12-16
453,5,Mohd Nor Mohamad,TIADA,BN - UMNO,Dilantik Yang di-Pertuan Agong,TIADA,,,,,bumiputera,TIADA,Ahli Dewan Negara,,,1980-12-15,1983-12-14
454,11,Mohd Puad Zarkashi,TIADA,BN - UMNO,Dipilih oleh Dewan Undangan Negeri,Johor,,,,,bumiputera,TIADA,Ahli Dewan Negara,,,2004-10-13,2007-10-12
455,14,Mohd Radzi Bin Tan Sri Sheikh Ahmad,YB Senator Tan Sri Dato' Seri,BERSATU,Dilantik Yang di-Pertuan Agong,TIADA,,,,M,bumiputera,TIADA,TIADA,,16.06.2020 - 15.06.2023,2020-06-16,2023-06-15
456,13,Mohd Suhaimi bin Abdullah,YB Senator Dato' Haji,BN - UMNO,Dipilih oleh Dewan Undangan Negeri,Kedah,,,,M,bumiputera,TIADA,TIADA,,21.05.2014 -20.05.2017,,2017-05-20
457,4,Mohd Tahir Abdul Majid,TIADA,BN - UMNO,Dilantik Yang di-Pertuan Agong,TIADA,,,,,bumiputera,TIADA,Ahli Dewan Negara,,,1975-01-06,1978-01-05
457,5,Mohd Tahir Abdul Majid,TIADA,BN - UMNO,Dilantik Yang di-Pertuan Agong,TIADA,,,,,bumiputera,TIADA,Ahli Dewan Negara,,,1975-01-06,1978-01-05
458,6,Mohd Yusoff Kassim,TIADA,BN - UMNO,Dipilih oleh Dewan Undangan Negeri,Perak,,,,,bumiputera,TIADA,Ahli Dewan Negara,,,1983-12-05,1986-12-04
458,7,Mohd Yusoff Kassim,TIADA,BN - UMNO,Dipilih oleh Dewan Undangan Negeri,Perak,,,,,bumiputera,TIADA,Ahli Dewan Negara,,,1983-12-05,1986-12-04
459,6,Mohd Yusoff Md Nor,TIADA,BN - UMNO,Dipilih oleh Dewan Undangan Negeri,Kelantan,,,,,bumiputera,TIADA,Ahli Dewan Negara,,,1984-07-30,1987-07-29
459,6,Mohd Yusoff Md Nor,TIADA,BN - UMNO,Dipilih oleh Dewan Undangan Negeri,Kelantan,,,,,bumiputera,TIADA,Ahli Dewan Negara,,,1984-12-03,1987-12-02
459,7,Mohd Yusoff Md Nor,TIADA,BN - UMNO,Dipilih oleh Dewan Undangan Negeri,Kelantan,,,,,bumiputera,TIADA,Ahli Dewan Negara,,,1984-07-30,1987-07-29
459,7,Mohd Yusoff Md Nor,TIADA,BN - UMNO,Dipilih oleh Dewan Undangan Negeri,Kelantan,,,,,bumiputera,TIADA,Ahli Dewan Negara,,,1984-12-03,1987-12-02
460,8,Mohd Zain Mat Daud,TIADA,S46,Dipilih oleh Dewan Undangan Negeri,Kelantan,,,,,bumiputera,TIADA,Ahli Dewan Negara,,,1991-07-24,1994-07-23
460,8,Mohd Zain Mat Daud,TIADA,S46,Dipilih oleh Dewan Undangan Negeri,Kelantan,,,,,bumiputera,TIADA,Ahli Dewan Negara,,,1994-05-09,1997-05-08
461,9,Mohd Zuki Kamaluddin,TIADA,BN - UMNO,Dilantik Yang di-Pertuan Agong,TIADA,,,,,bumiputera,TIADA,Ahli Dewan Negara,,,1996-09-06,1999-09-05
462,11,Mohd. Fuad Ahmad,TIADA,IND,Dilantik Yang di-Pertuan Agong,TIADA,,,,,bumiputera,TIADA,Ahli Dewan Negara,,,2004-12-13,2006-04-24
463,2,Mohd. Hanipah bin S. Alaudin,TIADA,Perikatan - UMNO,Dipilih oleh Dewan Undangan Negeri,Kedah,,,,,bumiputera,TIADA,Ahli Dewan Negara,,,1968-01-04,1971-01-03
464,7,Mohd. Wajdi Ishak,TIADA,BN - UMNO,Dilantik Yang di-Pertuan Agong,TIADA,,,,,bumiputera,TIADA,Ahli Dewan Negara,,,1987-02-23,1990-02-22
464,7,Mohd. Wajdi Ishak,TIADA,BN - UMNO,Dilantik Yang di-Pertuan Agong,TIADA,,,,,bumiputera,TIADA,Ahli Dewan Negara,,,1990-02-20,1993-02-19
465,12,Muhamad Yusof bin Husin,YB Senator Tuan Haji,PAS,Dipilih oleh Dewan Undangan Negeri,Kedah,,,,M,bumiputera,TIADA,TIADA,,21.05.2011 - 20.05.2014,2011-05-21,2014-05-20
466,13,Muhamad bin Mustafa,YB. Senator Tuan Haji,PAS,Dipilih oleh Dewan Undangan Negeri,Kelantan,,,,M,bumiputera,TIADA,TIADA,,08.07.2017 - 07.07.2020,2017-07-08,2020-07-07
467,10,Muhammad Abdul Ghani,TIADA,BN - UMNO,Dilantik Yang di-Pertuan Agong,TIADA,,,,,bumiputera,TIADA,Ahli Dewan Negara,,,,
467,11,Muhammad Abdul Ghani,TIADA,BN - UMNO,Dilantik Yang di-Pertuan Agong,TIADA,,,,,bumiputera,TIADA,Ahli Dewan Negara,,,2004-01-08,2007-01-07
468,7,Muhammad Farid Saad,TIADA,BN - UMNO,Dilantik Yang di-Pertuan Agong,TIADA,,,,,bumiputera,TIADA,Ahli Dewan Negara,,,1987-05-20,1990-05-19
468,7,Muhammad Farid Saad,TIADA,BN - UMNO,Dilantik Yang di-Pertuan Agong,TIADA,,,,,bumiputera,TIADA,Ahli Dewan Negara,,,1990-05-29,1993-05-28
469,3,Muhammad Ghazali Shafie,TIADA,Perikatan - UMNO,Dilantik Yang di-Pertuan Agong,TIADA,,,,,bumiputera,TIADA,Ahli Dewan Negara,,,1971-02-20,1977-02-19
469,3,Muhammad Ghazali Shafie,TIADA,Perikatan - UMNO,Dilantik Yang di-Pertuan Agong,TIADA,,,,,bumiputera,TIADA,Ahli Dewan Negara,,,1971-12-20,1977-12-19
470,11,Muhammad Muhammad Taib,TIADA,BN - UMNO,Dilantik Yang di-Pertuan Agong,TIADA,,,,,bumiputera,TIADA,Ahli Dewan Negara,,,2006-11-17,2009-11-16
471,12,Muhammad Olian Bin Abdullah,YB Senator Dato',BN - UMNO,Dilantik Yang di-Pertuan Agong,TIADA,,,,M,bumiputera,TIADA,TIADA,,10.12.2012 - 09.12.2015,2012-12-10,2015-12-09
472,14,Muhammad Zahid Bin Md Arip,YB Senator Tuan,BERSATU,Dilantik Yang di-Pertuan Agong,TIADA,,,,M,bumiputera,TIADA,Ahli Dewan Negara,,16.06.2020 - 15.06.2023,2020-06-16,2023-06-15
473,15,Mujahid bin Yusof,YB Senator Datuk Seri Dr.,PH - AMANAH,Dipilih oleh Dewan Undangan Negeri,Perak,,,,M,bumiputera,TIADA,Ahli Dewan Negara,,25.05.2023 - 24.05.2026,2023-05-25,2026-05-24
474,11,Mumtaz Md Nawi,TIADA,PAS,Dipilih oleh Dewan Undangan Negeri,Kelantan,,,,,bumiputera,TIADA,Ahli Dewan Negara,,,2006-07-19,2009-07-18
475,8,Munisamy Kuppan,TIADA,BN - MIC,Dilantik Yang di-Pertuan Agong,TIADA,,,,,indian,TIADA,Ahli Dewan Negara,,,1991-02-18,1994-02-17
475,8,Munisamy Kuppan,TIADA,BN - MIC,Dilantik Yang di-Pertuan Agong,TIADA,,,,,indian,TIADA,Ahli Dewan Negara,,,1991-12-16,1994-12-15
476,11,Munusamy Mareemuthu,TIADA,BN - MIC,Dilantik Yang di-Pertuan Agong,TIADA,,,,,indian,TIADA,Ahli Dewan Negara,,,2005-10-14,2008-10-13
477,10,Musa Mohamad,TIADA,BN - UMNO,Dilantik Yang di-Pertuan Agong,TIADA,,,,,bumiputera,TIADA,Ahli Dewan Negara,,,1999-12-13,2002-12-12
478,11,Musa Sheikh Fadzir,TIADA,BN - UMNO,Dilantik Yang di-Pertuan Agong,TIADA,,,,,bumiputera,TIADA,Ahli Dewan Negara,,,2004-12-13,2007-12-12
478,11,Musa Sheikh Fadzir,TIADA,BN - UMNO,Dilantik Yang di-Pertuan Agong,TIADA,,,,,bumiputera,TIADA,Ahli Dewan Negara,,,2007-12-13,2010-12-12
479,15,Musoddak bin Ahmad,YB Senator Tuan,PAS,Dipilih oleh Dewan Undangan Negeri,Kedah,,,,M,bumiputera,TIADA,Ahli Dewan Negara,,20.03.2023 - 19.03.2026,2023-03-20,2026-03-19
480,7,Mustafa Awang,TIADA,BN - UMNO,Dipilih oleh Dewan Undangan Negeri,Terengganu,,,,,bumiputera,TIADA,Ahli Dewan Negara,,,1986-12-15,1989-12-14
480,7,Mustafa Awang,TIADA,BN - UMNO,Dipilih oleh Dewan Undangan Negeri,Terengganu,,,,,bumiputera,TIADA,Ahli Dewan Negara,,,1989-12-26,1992-12-25
480,8,Mustafa Awang,TIADA,BN - UMNO,Dipilih oleh Dewan Undangan Negeri,Terengganu,,,,,bumiputera,TIADA,Ahli Dewan Negara,,,1986-12-15,1989-12-14
480,8,Mustafa Awang,TIADA,BN - UMNO,Dipilih oleh Dewan Undangan Negeri,Terengganu,,,,,bumiputera,TIADA,Ahli Dewan Negara,,,1989-12-26,1992-12-25
481,15,Mustafa bin Musa,YB Senator Datuk Haji,UMNO,Dipilih oleh Dewan Undangan Negeri,Melaka,,,,M,bumiputera,TIADA,Ahli Dewan Negara,,31.07.2023  - 30.07.2026,,2026-07-30
482,9,Mustaffa Kamal Mohd. Nawi,TIADA,BN - UMNO,Dipilih oleh Dewan Undangan Negeri,Perak,,,,,bumiputera,TIADA,Ahli Dewan Negara,,,1997-08-04,2000-08-03
482,10,Mustaffa Kamal Mohd. Nawi,TIADA,BN - UMNO,Dipilih oleh Dewan Undangan Negeri,Perak,,,,,bumiputera,TIADA,Ahli Dewan Negara,,,1995-11-09,1998-11-08
482,10,Mustaffa Kamal Mohd. Nawi,TIADA,BN - UMNO,Dipilih oleh Dewan Undangan Negeri,Perak,,,,,bumiputera,TIADA,Ahli Dewan Negara,,,1997-08-04,2000-08-03
483,13,Mustapa Kamal Bin Mohd Yusoff,YB Senator Datuk,BN - UMNO,Dilantik Yang di-Pertuan Agong,TIADA,,,,M,bumiputera,TIADA,Ahli Dewan Negara,,07.12.2016 - 06.12.2019,2016-12-07,2019-12-06
484,8,Mustapa Mohamed,TIADA,BN - UMNO,Dilantik Yang di-Pertuan Agong,TIADA,,,,,bumiputera,TIADA,Ahli Dewan Negara,,,1991-03-29,1994-03-28
484,8,Mustapa Mohamed,TIADA,BN - UMNO,Dilantik Yang di-Pertuan Agong,TIADA,,,,,bumiputera,TIADA,Ahli Dewan Negara,,,1994-03-31,1997-03-30
485,5,Mustapha Abdul Jabar,TIADA,BN - UMNO,Dilantik Yang di-Pertuan Agong,TIADA,,,,,bumiputera,TIADA,Ahli Dewan Negara,,,1978-12-14,1981-12-13
486,12,Nallakaruppan a/l Solaimalai,YB Senator Dato',MIUP,Dilantik Yang di-Pertuan Agong,TIADA,,,,M,indian,TIADA,TIADA,,02.11.2011 - 01.11.2014,2011-11-02,2014-11-01
487,10,Naomi Chong Set Mui,TIADA,BN - LDP,Dilantik Yang di-Pertuan Agong,TIADA,,,,,other,TIADA,Ahli Dewan Negara,,,2003-10-02,2006-10-01
487,11,Naomi Chong Set Mui,TIADA,BN - LDP,Dilantik Yang di-Pertuan Agong,TIADA,,,,,other,TIADA,Ahli Dewan Negara,,,2003-10-02,2006-10-01
488,6,Nasir Manap,TIADA,BN - UMNO,Dipilih oleh Dewan Undangan Negeri,Melaka,,,,,bumiputera,TIADA,Ahli Dewan Negara,,,1983-12-12,1986-12-11
488,7,Nasir Manap,TIADA,BN - UMNO,Dipilih oleh Dewan Undangan Negeri,Melaka,,,,,bumiputera,TIADA,Ahli Dewan Negara,,,1983-12-12,1986-12-11
488,7,Nasir Manap,TIADA,BN - UMNO,Dipilih oleh Dewan Undangan Negeri,Melaka,,,,,bumiputera,TIADA,Ahli Dewan Negara,,,1986-12-01,1989-11-30
489,7,Nawawi Mat Awin,TIADA,BN - UMNO,Dilantik Yang di-Pertuan Agong,TIADA,,,,,bumiputera,TIADA,Ahli Dewan Negara,,,1988-08-03,1991-08-02
490,15,Nelson W Angang,YB Senator Datuk,UPKO,Dilantik Yang di-Pertuan Agong,TIADA,,,,M,bumiputera,TIADA,Ahli Dewan Negara,,16.05.2024 - 15.05.2027,2024-05-16,2027-05-15
491,14,Nelson a/l Renganathan,YB Senator Dato' Dr.,BN - MIC,Dilantik Yang di-Pertuan Agong,TIADA,,,,M,indian,TIADA,Ahli Dewan Negara,,23.11.2021 - 22.11.2024,2021-11-23,2024-11-22
492,6,Nen Abidah Abdullah,TIADA,BN - UMNO,Dilantik Yang di-Pertuan Agong,TIADA,,,,,bumiputera,TIADA,Ahli Dewan Negara,,,1982-12-20,1985-12-19
493,8,Neo Tuan Cheng,TIADA,BN - MCA,Dipilih oleh Dewan Undangan Negeri,Johor,,,,,chinese,TIADA,Ahli Dewan Negara,,,1991-07-24,1994-07-23
494,6,Ng Ah Poi @ Wong Sian Chuan,TIADA,BN - MCA,Dipilih oleh Dewan Undangan Negeri,Melaka,,,,,chinese,TIADA,Ahli Dewan Negara,,,1983-12-13,1986-12-12
494,7,Ng Ah Poi @ Wong Sian Chuan,TIADA,BN - MCA,Dipilih oleh Dewan Undangan Negeri,Melaka,,,,,chinese,TIADA,Ahli Dewan Negara,,,1983-12-13,1986-12-12
495,6,Ng Cheng Kiat,TIADA,BN - MCA,Dilantik Yang di-Pertuan Agong,TIADA,,,,,chinese,TIADA,Ahli Dewan Negara,,,1986-01-06,1989-01-05
495,7,Ng Cheng Kiat,TIADA,BN - MCA,Dilantik Yang di-Pertuan Agong,TIADA,,,,,chinese,TIADA,Ahli Dewan Negara,,,1986-01-06,1989-01-05
496,13,Ng Chiang Chin,YB Senator Datuk,BN - GERAKAN,Dilantik Yang di-Pertuan Agong,TIADA,,,,M,chinese,TIADA,TIADA,,10.09.2014 - 09.09.2017,2014-09-10,2017-09-09
497,7,Ng Khek Kiung,TIADA,BN - MCA,Dipilih oleh Dewan Undangan Negeri,Selangor,,,,,chinese,TIADA,Ahli Dewan Negara,,,1987-12-11,1990-12-10
498,7,Ng Peng Hong @ Ng Peng Hay,TIADA,BN - MCA,Dipilih oleh Dewan Undangan Negeri,Melaka,,,,,chinese,TIADA,Ahli Dewan Negara,,,1987-03-23,1990-03-22
498,7,Ng Peng Hong @ Ng Peng Hay,TIADA,BN - MCA,Dipilih oleh Dewan Undangan Negeri,Melaka,,,,,chinese,TIADA,Ahli Dewan Negara,,,1990-05-29,1993-05-28
498,8,Ng Peng Hong @ Ng Peng Hay,TIADA,BN - MCA,Dipilih oleh Dewan Undangan Negeri,Melaka,,,,,chinese,TIADA,Ahli Dewan Negara,,,1987-03-23,1990-03-22
498,8,Ng Peng Hong @ Ng Peng Hay,TIADA,BN - MCA,Dipilih oleh Dewan Undangan Negeri,Melaka,,,,,chinese,TIADA,Ahli Dewan Negara,,,1990-05-29,1993-05-28
499,8,Ng See Tiong,TIADA,BN - MCA,Dipilih oleh Dewan Undangan Negeri,Johor,,,,,chinese,TIADA,Ahli Dewan Negara,,,1994-05-09,1997-05-08
500,8,Ng Thian Hock,TIADA,BN - MCA,Dilantik Yang di-Pertuan Agong,TIADA,,,,,chinese,TIADA,Ahli Dewan Negara,,,1991-07-24,1994-07-23
501,8,Ng Yen Yen,TIADA,BN - MCA,Dipilih oleh Dewan Undangan Negeri,Pahang,,,,,chinese,TIADA,Ahli Dewan Negara,,,1993-12-13,1996-12-12
502,2,Ngau Ken Lock,TIADA,Perikatan - MCA,Dipilih oleh Dewan Undangan Negeri,Pahang,,,,,chinese,TIADA,Ahli Dewan Negara,,,1968-10-22,1974-10-21
502,3,Ngau Ken Lock,TIADA,Perikatan - MCA,Dipilih oleh Dewan Undangan Negeri,Pahang,,,,,chinese,TIADA,Ahli Dewan Negara,,,1968-10-22,1974-10-21
502,4,Ngau Ken Lock,TIADA,BN - MCA,Dipilih oleh Dewan Undangan Negeri,Pahang,,,,,chinese,TIADA,Ahli Dewan Negara,,,1968-10-22,1971-10-21
502,4,Ngau Ken Lock,TIADA,BN - MCA,Dipilih oleh Dewan Undangan Negeri,Pahang,,,,,chinese,TIADA,Ahli Dewan Negara,,,1975-01-06,1978-01-05
503,10,Nik Azizah Nik Yahya,TIADA,BN - UMNO,Dilantik Yang di-Pertuan Agong,TIADA,,,,,bumiputera,TIADA,Ahli Dewan Negara,,,,
503,11,Nik Azizah Nik Yahya,TIADA,BN - UMNO,Dilantik Yang di-Pertuan Agong,TIADA,,,,,bumiputera,TIADA,Ahli Dewan Negara,,,2005-02-17,2008-02-16
504,1,Nik Hassan Nik Yahya,TIADA,Perikatan - UMNO,Dilantik Yang di-Pertuan Agong,TIADA,,,,,bumiputera,TIADA,Ahli Dewan Negara,,,1959-09-11,1965-09-10
504,2,Nik Hassan Nik Yahya,TIADA,Perikatan - UMNO,Dilantik Yang di-Pertuan Agong,TIADA,,,,,bumiputera,TIADA,Ahli Dewan Negara,,,1959-09-11,1965-09-10
504,2,Nik Hassan Nik Yahya,TIADA,Perikatan - UMNO,Dilantik Yang di-Pertuan Agong,TIADA,,,,,bumiputera,TIADA,Ahli Dewan Negara,,,1965-10-18,
504,3,Nik Hassan Nik Yahya,TIADA,Perikatan - UMNO,Dilantik Yang di-Pertuan Agong,TIADA,,,,,bumiputera,TIADA,Ahli Dewan Negara,,,,1965-01-01
504,3,Nik Hassan Nik Yahya,TIADA,Perikatan - UMNO,Dilantik Yang di-Pertuan Agong,TIADA,,,,,bumiputera,TIADA,Ahli Dewan Negara,,,1965-10-18,1971-10-17
504,3,Nik Hassan Nik Yahya,TIADA,Perikatan - UMNO,Dilantik Yang di-Pertuan Agong,TIADA,,,,,bumiputera,TIADA,Ahli Dewan Negara,,,1971-12-20,1977-12-19
504,4,Nik Hassan Nik Yahya,TIADA,BN - UMNO,Dilantik Yang di-Pertuan Agong,TIADA,,,,,bumiputera,TIADA,Ahli Dewan Negara,,,,1965-01-01
504,4,Nik Hassan Nik Yahya,TIADA,BN - UMNO,Dilantik Yang di-Pertuan Agong,TIADA,,,,,bumiputera,TIADA,Ahli Dewan Negara,,,1965-10-18,1968-10-17
504,4,Nik Hassan Nik Yahya,TIADA,BN - UMNO,Dilantik Yang di-Pertuan Agong,TIADA,,,,,bumiputera,TIADA,Ahli Dewan Negara,,,1971-12-20,1974-12-19
505,15,Nik Mohamad Abduh bin Nik Abdul Aziz,YB Senator Tuan,PAS,Dipilih oleh Dewan Undangan Negeri,Kelantan,,,,M,bumiputera,TIADA,Ahli Dewan Negara,,08.07.2023 - 07.07.2026,2023-07-08,2026-07-07
506,1,Nik Mohamed Adeeb Nik Mohamed,TIADA,PAS,Dipilih oleh Dewan Undangan Negeri,Kelantan,,,,,bumiputera,TIADA,Ahli Dewan Negara,,,1959-09-11,1964-04-04
507,15,Noorita binti Sual,YB Senator Puan,DAP,Dilantik Yang di-Pertuan Agong,TIADA,,,,M,bumiputera,TIADA,Ahli Dewan Negara,,20.03.2023 - 19.03.2026,2023-03-20,2026-03-19
508,9,Nor Azah Awin,TIADA,BN - UMNO,Dilantik Yang di-Pertuan Agong,TIADA,,,,,bumiputera,TIADA,Ahli Dewan Negara,,,1999-07-27,2002-07-26
508,10,Nor Azah Awin,TIADA,BN - UMNO,Dilantik Yang di-Pertuan Agong,TIADA,,,,,bumiputera,TIADA,Ahli Dewan Negara,,,1999-07-27,2002-07-26
508,11,Nor Azah Awin,TIADA,BN - UMNO,Dilantik Yang di-Pertuan Agong,TIADA,,,,,bumiputera,TIADA,Ahli Dewan Negara,,,1999-07-27,2002-07-26
509,11,Nor Hayati Onn,TIADA,BN - UMNO,Dilantik Yang di-Pertuan Agong,TIADA,,,,,bumiputera,TIADA,Ahli Dewan Negara,,,2005-10-14,2008-10-13
510,11,Nor Mohamed Yakcop,TIADA,BN - UMNO,Dilantik Yang di-Pertuan Agong,TIADA,,,,,bumiputera,TIADA,Ahli Dewan Negara,,,2004-01-09,2007-01-08
510,11,Nor Mohamed Yakcop,TIADA,BN - UMNO,Dilantik Yang di-Pertuan Agong,TIADA,,,,,bumiputera,TIADA,Ahli Dewan Negara,,,2007-01-08,2010-01-07
511,7,Norani Beluah,TIADA,BN - UMNO,Dipilih oleh Dewan Undangan Negeri,Pahang,,,,,bumiputera,TIADA,Ahli Dewan Negara,,,1987-07-13,1990-07-12
512,11,Nordiana Shafie,TIADA,BN - UMNO,Dipilih oleh Dewan Undangan Negeri,Terengganu,,,,,bumiputera,TIADA,Ahli Dewan Negara,,,2005-12-23,2008-12-22
513,4,Nordin Pesah,TIADA,BN - UMNO,Dipilih oleh Dewan Undangan Negeri,Negri Sembilan,,,,,bumiputera,TIADA,Ahli Dewan Negara,,,,
514,7,Nordin Selat,TIADA,BN - UMNO,Dilantik Yang di-Pertuan Agong,TIADA,,,,,bumiputera,TIADA,Ahli Dewan Negara,,,1987-02-23,1990-02-22
514,7,Nordin Selat,TIADA,BN - UMNO,Dilantik Yang di-Pertuan Agong,TIADA,,,,,bumiputera,TIADA,Ahli Dewan Negara,,,1989-03-27,1992-03-26
514,8,Nordin Selat,TIADA,BN - UMNO,Dilantik Yang di-Pertuan Agong,TIADA,,,,,bumiputera,TIADA,Ahli Dewan Negara,,,1987-02-23,1990-02-22
514,8,Nordin Selat,TIADA,BN - UMNO,Dilantik Yang di-Pertuan Agong,TIADA,,,,,bumiputera,TIADA,Ahli Dewan Negara,,,1989-03-27,1992-03-26
515,9,Norjan Khan Bahadar,TIADA,BN - UMNO,Dilantik Yang di-Pertuan Agong,TIADA,,,,,bumiputera,TIADA,Ahli Dewan Negara,,,1997-12-04,2000-12-03
515,10,Norjan Khan Bahadar,TIADA,BN - UMNO,Dilantik Yang di-Pertuan Agong,TIADA,,,,,bumiputera,TIADA,Ahli Dewan Negara,,,1997-12-04,2000-12-03
516,12,Norliza binti Abdul Rahim,YB Senator Puan,BN - UMNO,Dilantik Yang di-Pertuan Agong,TIADA,,,,M,bumiputera,TIADA,TIADA,,30.05.2011 - 29.05.2014,2011-05-30,2014-05-29
517,11,Norraesah Mohamad,TIADA,BN - UMNO,Dilantik Yang di-Pertuan Agong,TIADA,,,,,bumiputera,TIADA,Ahli Dewan Negara,,,2005-10-14,2008-10-13
518,9,Norsimah Hashim,TIADA,BN - UMNO,Dilantik Yang di-Pertuan Agong,TIADA,,,,,bumiputera,TIADA,Ahli Dewan Negara,,,1999-07-27,2002-07-26
518,10,Norsimah Hashim,TIADA,BN - UMNO,Dilantik Yang di-Pertuan Agong,TIADA,,,,,bumiputera,TIADA,Ahli Dewan Negara,,,1999-07-27,2002-07-26
518,11,Norsimah Hashim,TIADA,BN - UMNO,Dilantik Yang di-Pertuan Agong,TIADA,,,,,bumiputera,TIADA,Ahli Dewan Negara,,,1999-07-27,2002-07-26
519,14,Nuing Anak Jeluing,YB Senator Dato Dr.,PBB,Dipilih oleh Dewan Undangan Negeri,Sarawak,,,,M,bumiputera,TIADA,Ahli Dewan Negara,,11.12.2017 - 10.12.2020,2017-12-11,2020-12-10
519,13,Nuing Jeluing,YB Senator Dr.,BN - PBB,Dipilih oleh Dewan Undangan Negeri,Sarawak,,,,M,bumiputera,TIADA,TIADA,,11.12.2017 - 10.12.2020,2017-12-11,2020-12-10
520,15,Nur Jazlan bin Tan Sri Mohamed,YB Senator Datuk,UMNO,Dilantik Yang di-Pertuan Agong,TIADA,,,,M,bumiputera,TIADA,Timbalan Yang di-Pertua Dewan Negara,,15.06.2023 - 14.06.2026,2023-06-15,2026-06-14
521,3,Oh Siew Aun,TIADA,Gerakan,Dipilih oleh Dewan Undangan Negeri,Pulau Pinang,,,,,chinese,TIADA,Ahli Dewan Negara,,,1971-12-20,1977-12-19
521,4,Oh Siew Aun,TIADA,BN - Gerakan,Dipilih oleh Dewan Undangan Negeri,Pulau Pinang,,,,,chinese,TIADA,Ahli Dewan Negara,,,1971-12-20,1974-12-19
521,4,Oh Siew Aun,TIADA,BN - Gerakan,Dipilih oleh Dewan Undangan Negeri,Pulau Pinang,,,,,chinese,TIADA,Ahli Dewan Negara,,,1977-11-09,1980-11-08
521,5,Oh Siew Aun,TIADA,BN - Gerakan,Dipilih oleh Dewan Undangan Negeri,Pulau Pinang,,,,,chinese,TIADA,Ahli Dewan Negara,,,1971-12-20,1974-12-19
521,5,Oh Siew Aun,TIADA,BN - Gerakan,Dipilih oleh Dewan Undangan Negeri,Pulau Pinang,,,,,chinese,TIADA,Ahli Dewan Negara,,,1977-11-09,1980-11-08
522,10,Omar Faudzar,TIADA,BN - UMNO,Dipilih oleh Dewan Undangan Negeri,Penang,,,,,bumiputera,TIADA,Ahli Dewan Negara,,,,
522,11,Omar Faudzar,TIADA,BN - UMNO,Dipilih oleh Dewan Undangan Negeri,Penang,,,,,bumiputera,TIADA,Ahli Dewan Negara,,,2006-06-16,2009-06-15
523,3,Omar Ong Yoke Lin,TIADA,Perikatan - MCA,Dilantik Yang di-Pertuan Agong,TIADA,,,,,chinese,TIADA,Ahli Dewan Negara,,,1964-05-18,1970-05-17
523,4,Omar Ong Yoke Lin,TIADA,BN - MCA,Dilantik Yang di-Pertuan Agong,TIADA,,,,,chinese,TIADA,Ahli Dewan Negara,,,1964-05-18,1967-05-17
523,4,Omar Ong Yoke Lin,TIADA,BN - MCA,Dilantik Yang di-Pertuan Agong,TIADA,,,,,chinese,TIADA,Ahli Dewan Negara,,,1975-01-06,1978-01-05
523,5,Omar Ong Yoke Lin,TIADA,BN - MCA,Dilantik Yang di-Pertuan Agong,TIADA,,,,,chinese,TIADA,Ahli Dewan Negara,,,1964-05-18,1967-05-17
523,5,Omar Ong Yoke Lin,TIADA,BN - MCA,Dilantik Yang di-Pertuan Agong,TIADA,,,,,chinese,TIADA,Ahli Dewan Negara,,,1975-01-06,1978-01-05
523,5,Omar Ong Yoke Lin,TIADA,BN - MCA,Dilantik Yang di-Pertuan Agong,TIADA,,,,,chinese,TIADA,Ahli Dewan Negara,,,,1980-12-31
524,13,Ong Chong Swen,YB Senator Dato',BN - MCA,Dilantik Yang di-Pertuan Agong,TIADA,,,,F,chinese,TIADA,TIADA,,19.02.2018 - 18.02.2021,2018-02-19,2021-02-18
523,2,Ong Yoke Lin,TIADA,Perikatan - MCA,Dilantik Yang di-Pertuan Agong,TIADA,,,,,chinese,TIADA,Ahli Dewan Negara,,,1964-05-18,
525,3,Ooi Eng Hong,TIADA,Perikatan - MCA,Dipilih oleh Dewan Undangan Negeri,Kedah,,,,,chinese,TIADA,Ahli Dewan Negara,,,,
526,10,Ooi Siew Kim,TIADA,BN - MCA,Dilantik Yang di-Pertuan Agong,TIADA,,,,,chinese,TIADA,Ahli Dewan Negara,,,,
526,11,Ooi Siew Kim,TIADA,BN - MCA,Dilantik Yang di-Pertuan Agong,TIADA,,,,,chinese,TIADA,Ahli Dewan Negara,,,,
527,10,Osman Bungsu,TIADA,IND,Dilantik Yang di-Pertuan Agong,TIADA,,,,,bumiputera,TIADA,Ahli Dewan Negara,,,2003-10-02,2006-10-01
527,11,Osman Bungsu,TIADA,IND,Dilantik Yang di-Pertuan Agong,TIADA,,,,,bumiputera,TIADA,Ahli Dewan Negara,,,2003-10-02,2006-10-01
527,11,Osman Bungsu,TIADA,IND,Dilantik Yang di-Pertuan Agong,TIADA,,,,,bumiputera,TIADA,Ahli Dewan Negara,,,2006-10-14,2009-10-13
528,3,Othman Abdullah,TIADA,Perikatan - UMNO,Dipilih oleh Dewan Undangan Negeri,Perak,,,,,bumiputera,TIADA,Ahli Dewan Negara,,,1973-08-12,1979-08-11
528,4,Othman Abdullah,TIADA,BN - UMNO,Dipilih oleh Dewan Undangan Negeri,Perak,,,,,bumiputera,TIADA,Ahli Dewan Negara,,,1973-08-12,1976-08-11
528,4,Othman Abdullah,TIADA,BN - UMNO,Dipilih oleh Dewan Undangan Negeri,Perak,,,,,bumiputera,TIADA,Ahli Dewan Negara,,,1977-11-09,1980-11-08
528,5,Othman Abdullah,TIADA,BN - UMNO,Dilantik Yang di-Pertuan Agong,TIADA,,,,,bumiputera,TIADA,Ahli Dewan Negara,,,1973-08-12,1976-08-11
528,5,Othman Abdullah,TIADA,BN - UMNO,Dilantik Yang di-Pertuan Agong,TIADA,,,,,bumiputera,TIADA,Ahli Dewan Negara,,,1977-11-09,1980-11-08
529,8,Othman Yunos,TIADA,BN - UMNO,Dilantik Yang di-Pertuan Agong,TIADA,,,,,bumiputera,TIADA,Ahli Dewan Negara,,,1994-07-20,1997-07-19
530,3,Oyong Lawai Jau,TIADA,SNAP,Dipilih oleh Dewan Undangan Negeri,Sarawak,,,,,bumiputera,TIADA,Ahli Dewan Negara,,,1963-11-02,1969-11-01
530,3,Oyong Lawai Jau,TIADA,SNAP,Dipilih oleh Dewan Undangan Negeri,Sarawak,,,,,bumiputera,TIADA,Ahli Dewan Negara,,,1968-10-22,1974-10-21
530,3,Oyong Lawai Jau,TIADA,SNAP,Dipilih oleh Dewan Undangan Negeri,Sarawak,,,,,bumiputera,TIADA,Ahli Dewan Negara,,,,1974-08-06
531,1,Pandak Hamid Puteh Jali,TIADA,Perikatan - UMNO,Dilantik Yang di-Pertuan Agong,TIADA,,,,,bumiputera,TIADA,Ahli Dewan Negara,,,1959-09-11,1965-09-10
531,2,Pandak Hamid Puteh Jali,TIADA,Perikatan - UMNO,Dilantik Yang di-Pertuan Agong,TIADA,,,,,bumiputera,TIADA,Ahli Dewan Negara,,,1959-09-11,1965-09-10
531,2,Pandak Hamid Puteh Jali,TIADA,Perikatan - UMNO,Dilantik Yang di-Pertuan Agong,TIADA,,,,,bumiputera,TIADA,Ahli Dewan Negara,,,1965-10-18,
531,3,Pandak Hamid Puteh Jali,TIADA,Perikatan - UMNO,Dilantik Yang di-Pertuan Agong,TIADA,,,,,bumiputera,TIADA,Ahli Dewan Negara,,,,1965-01-01
531,3,Pandak Hamid Puteh Jali,TIADA,Perikatan - UMNO,Dilantik Yang di-Pertuan Agong,TIADA,,,,,bumiputera,TIADA,Ahli Dewan Negara,,,1965-10-18,1971-10-17
531,3,Pandak Hamid Puteh Jali,TIADA,Perikatan - UMNO,Dilantik Yang di-Pertuan Agong,TIADA,,,,,bumiputera,TIADA,Ahli Dewan Negara,,,1971-12-20,1977-12-19
531,4,Pandak Hamid Puteh Jali,TIADA,BN - UMNO,Dilantik Yang di-Pertuan Agong,TIADA,,,,,bumiputera,TIADA,Ahli Dewan Negara,,,,1965-01-01
531,4,Pandak Hamid Puteh Jali,TIADA,BN - UMNO,Dilantik Yang di-Pertuan Agong,TIADA,,,,,bumiputera,TIADA,Ahli Dewan Negara,,,1965-10-18,1968-10-17
531,4,Pandak Hamid Puteh Jali,TIADA,BN - UMNO,Dilantik Yang di-Pertuan Agong,TIADA,,,,,bumiputera,TIADA,Ahli Dewan Negara,,,1971-12-20,1974-12-19
531,4,Pandak Hamid Puteh Jali,TIADA,BN - UMNO,Dilantik Yang di-Pertuan Agong,TIADA,,,,,bumiputera,TIADA,Ahli Dewan Negara,,,1977-11-09,1980-11-08
531,5,Pandak Hamid Puteh Jali,TIADA,BN - UMNO,Dilantik Yang di-Pertuan Agong,TIADA,,,,,bumiputera,TIADA,Ahli Dewan Negara,,,,1965-01-01
531,5,Pandak Hamid Puteh Jali,TIADA,BN - UMNO,Dilantik Yang di-Pertuan Agong,TIADA,,,,,bumiputera,TIADA,Ahli Dewan Negara,,,1965-10-18,1968-10-17
531,5,Pandak Hamid Puteh Jali,TIADA,BN - UMNO,Dilantik Yang di-Pertuan Agong,TIADA,,,,,bumiputera,TIADA,Ahli Dewan Negara,,,1971-12-20,1974-12-19
531,5,Pandak Hamid Puteh Jali,TIADA,BN - UMNO,Dilantik Yang di-Pertuan Agong,TIADA,,,,,bumiputera,TIADA,Ahli Dewan Negara,,,1977-11-09,1980-11-08
531,6,Pandak Hamid Puteh Jali,TIADA,BN - UMNO,Dilantik Yang di-Pertuan Agong,TIADA,,,,,bumiputera,TIADA,Ahli Dewan Negara,,,,1965-01-01
531,6,Pandak Hamid Puteh Jali,TIADA,BN - UMNO,Dilantik Yang di-Pertuan Agong,TIADA,,,,,bumiputera,TIADA,Ahli Dewan Negara,,,1965-10-18,1968-10-17
531,6,Pandak Hamid Puteh Jali,TIADA,BN - UMNO,Dilantik Yang di-Pertuan Agong,TIADA,,,,,bumiputera,TIADA,Ahli Dewan Negara,,,1971-12-20,1974-12-19
531,6,Pandak Hamid Puteh Jali,TIADA,BN - UMNO,Dilantik Yang di-Pertuan Agong,TIADA,,,,,bumiputera,TIADA,Ahli Dewan Negara,,,1977-11-09,1980-11-08
531,6,Pandak Hamid Puteh Jali,TIADA,BN - UMNO,Dilantik Yang di-Pertuan Agong,TIADA,,,,,bumiputera,TIADA,Ahli Dewan Negara,,,,1983-05-22
532,7,Pandikar Amin Mulia,TIADA,TIADA,Dipilih oleh Dewan Undangan Negeri,Sabah,,,,,bumiputera,TIADA,Ahli Dewan Negara,,,1988-03-07,1991-03-06
532,9,Pandikar Amin Mulia,TIADA,AKAR,Dilantik Yang di-Pertuan Agong,TIADA,,,,,bumiputera,TIADA,Ahli Dewan Negara,,,1999-05-24,2002-05-23
532,10,Pandikar Amin Mulia,TIADA,AKAR,Dilantik Yang di-Pertuan Agong,TIADA,,,,,bumiputera,TIADA,Ahli Dewan Negara,,,1988-03-07,1991-03-06
532,10,Pandikar Amin Mulia,TIADA,AKAR,Dilantik Yang di-Pertuan Agong,TIADA,,,,,bumiputera,TIADA,Ahli Dewan Negara,,,1999-05-24,2002-05-23
533,6,Paramjit Singh,TIADA,BN - PPP,Dilantik Yang di-Pertuan Agong,TIADA,,,,,other,TIADA,Ahli Dewan Negara,,,1982-07-19,1985-07-18
533,6,Paramjit Singh,TIADA,BN - PPP,Dilantik Yang di-Pertuan Agong,TIADA,,,,,other,TIADA,Ahli Dewan Negara,,,1985-07-29,1988-07-28
533,7,Paramjit Singh,TIADA,BN - PPP,Dilantik Yang di-Pertuan Agong,TIADA,,,,,other,TIADA,Ahli Dewan Negara,,,1982-07-19,1985-07-18
533,7,Paramjit Singh,TIADA,BN - PPP,Dilantik Yang di-Pertuan Agong,TIADA,,,,,other,TIADA,Ahli Dewan Negara,,,1985-07-29,1988-07-28
534,10,Parasuraman Sanasamy,TIADA,BN - MIC,Dipilih oleh Dewan Undangan Negeri,Kedah,,,,,indian,TIADA,Ahli Dewan Negara,,,1997-10-06,2000-10-05
534,9,Parasuraman Sanasamy @ Sinnasamy,TIADA,BN - MIC,Dipilih oleh Dewan Undangan Negeri,Kedah,,,,,indian,TIADA,Ahli Dewan Negara,,,1997-10-06,2000-10-05
535,11,Pau Chiong Ung,TIADA,BN - SPDP,Dilantik Yang di-Pertuan Agong,TIADA,,,,,chinese,TIADA,Ahli Dewan Negara,,,,
535,12,Pau Chiong Ung,YB Senator Datuk,BN - SPDP,Dilantik Yang di-Pertuan Agong,TIADA,,,,F,chinese,TIADA,TIADA,,13.12.2010 - 12.12.2013,2010-12-13,2013-12-12
536,13,Paul Igai,YB Senator Datuk,TIADA,Dilantik Yang di-Pertuan Agong,TIADA,,,,M,bumiputera,TIADA,TIADA,,04.12.2017 - 03.12.2020,2017-12-04,2020-12-03
536,14,Paul Igai,YB Senator Datuk,PDP,Dilantik Yang di-Pertuan Agong,TIADA,,,,M,bumiputera,TIADA,Ahli Dewan Negara,,04.12.2017 - 03.12.2020,2017-12-04,2020-12-03
537,13,Paul Low Seng Kuan,YB Senator Datuk,BN - MCA,Dilantik Yang di-Pertuan Agong,TIADA,,,,M,chinese,TIADA,TIADA,,15.05.2013 - 14.05.2016,2013-05-15,2016-05-14
538,15,Pele Peter Tinggom,YB Senator Tuan,PDP,Dilantik Yang di-Pertuan Agong,TIADA,,,,M,bumiputera,TIADA,Ahli Dwan Negara,,05.03.2024 - 04.03.2027,2024-03-05,2027-03-04
539,1,Pengiran Digadong Mohamed Galpam Pengiran Indar,TIADA,USNO,Dipilih oleh Dewan Undangan Negeri,Sabah,,,,,bumiputera,TIADA,Ahli Dewan Negara,,,1963-11-02,1969-11-01
539,2,Pengiran Digadong Mohamed Galpam Pengiran Indar,TIADA,USNO,Dipilih oleh Dewan Undangan Negeri,Sabah,,,,,bumiputera,TIADA,Ahli Dewan Negara,,,1963-11-02,
539,2,Pengiran Digadong Mohamed Galpam Pengiran Indar,TIADA,USNO,Dipilih oleh Dewan Undangan Negeri,Sabah,,,,,bumiputera,TIADA,Ahli Dewan Negara,,,1969-01-27,
539,3,Pengiran Mohamed Digadong Galpam,TIADA,TIADA,Dipilih oleh Dewan Undangan Negeri,Sabah,,,,,bumiputera,TIADA,Ahli Dewan Negara,,,1963-11-02,1969-11-01
539,3,Pengiran Mohamed Digadong Galpam,TIADA,TIADA,Dipilih oleh Dewan Undangan Negeri,Sabah,,,,,bumiputera,TIADA,Ahli Dewan Negara,,,1969-01-27,1975-01-26
540,5,Pengiran Othman Pengiran Rauf,TIADA,TIADA,Dipilih oleh Dewan Undangan Negeri,Sabah,,,,,bumiputera,TIADA,Ahli Dewan Negara,,,1978-10-09,1981-10-08
541,5,Phua Cheng Leong,TIADA,BN - MCA,Dipilih oleh Dewan Undangan Negeri,Pahang,,,,,chinese,TIADA,Ahli Dewan Negara,,,1979-05-11,1982-05-10
542,10,Poh Mok Hua @ Poh Bak Hoe,TIADA,BN - MCA,Dipilih oleh Dewan Undangan Negeri,Malacca,,,,,chinese,TIADA,Ahli Dewan Negara,,,,
542,11,Poh Mok Hua @ Poh Bak Hoe,TIADA,BN - MCA,Dipilih oleh Dewan Undangan Negeri,Malacca,,,,,chinese,TIADA,Ahli Dewan Negara,,,,
543,10,Poo Yew Choy,TIADA,BN - MCA,Dipilih oleh Dewan Undangan Negeri,Johor,,,,,chinese,TIADA,Ahli Dewan Negara,,,2000-05-02,2003-03-18
544,9,Puizah Abu Kassim,TIADA,BN - UMNO,Dilantik Yang di-Pertuan Agong,TIADA,,,,,bumiputera,TIADA,Ahli Dewan Negara,,,1999-08-02,2002-08-01
544,10,Puizah Abu Kassim,TIADA,BN - UMNO,Dilantik Yang di-Pertuan Agong,TIADA,,,,,bumiputera,TIADA,Ahli Dewan Negara,,,1999-08-02,2002-08-01
544,11,Puizah Abu Kassim,TIADA,BN - UMNO,Dilantik Yang di-Pertuan Agong,TIADA,,,,,bumiputera,TIADA,Ahli Dewan Negara,,,1999-08-02,2002-08-01
545,6,R. M. Jasni,TIADA,BN - UMNO,Dilantik Yang di-Pertuan Agong,TIADA,,,,,bumiputera,TIADA,Ahli Dewan Negara,,,1982-07-19,1985-07-18
545,6,R. M. Jasni,TIADA,BN - UMNO,Dilantik Yang di-Pertuan Agong,TIADA,,,,,bumiputera,TIADA,Ahli Dewan Negara,,,1986-02-18,1989-02-17
545,7,R. M. Jasni,TIADA,BN - UMNO,Dilantik Yang di-Pertuan Agong,TIADA,,,,,bumiputera,TIADA,Ahli Dewan Negara,,,1982-07-19,1985-07-18
545,7,R. M. Jasni,TIADA,BN - UMNO,Dilantik Yang di-Pertuan Agong,TIADA,,,,,bumiputera,TIADA,Ahli Dewan Negara,,,1986-02-18,1989-02-17
546,13,Rabiyah Binti Ali,YB Senator Datuk,BN - UMNO,Dilantik Yang di-Pertuan Agong,TIADA,,,,M,bumiputera,TIADA,Ahli Dewan Negara,,07.12.2016 - 06.12.2019,2016-12-07,2019-12-06
547,4,Rafidah Aziz,TIADA,BN - UMNO,Dilantik Yang di-Pertuan Agong,TIADA,,,,,bumiputera,TIADA,Ahli Dewan Negara,,,1975-01-06,1978-01-05
547,4,Rafidah Aziz,TIADA,BN - UMNO,Dilantik Yang di-Pertuan Agong,TIADA,,,,,bumiputera,TIADA,Ahli Dewan Negara,,,1977-11-09,1980-11-08
548,8,Rahaiah Baheran,TIADA,BN - UMNO,Dilantik Yang di-Pertuan Agong,TIADA,,,,,bumiputera,TIADA,Ahli Dewan Negara,,,1992-10-27,1995-10-26
549,13,Rahemah Binti Idris,YB Senator Puan Hajah,BN - UMNO,Dilantik Yang di-Pertuan Agong,TIADA,,,,M,bumiputera,TIADA,Ahli Dewan Negara,,07.12.2016 - 06.12.2019,2016-12-07,2019-12-06
550,8,Rahim Baba,TIADA,BN - UMNO,Dilantik Yang di-Pertuan Agong,TIADA,,,,,bumiputera,TIADA,Ahli Dewan Negara,,,1991-12-16,1994-12-15
550,8,Rahim Baba,TIADA,BN - UMNO,Dilantik Yang di-Pertuan Agong,TIADA,,,,,bumiputera,TIADA,Ahli Dewan Negara,,,1994-12-14,1997-12-13
551,13,Rahimah binti Haji Mahamad,YB Senator Datin,BN - UMNO,Dilantik Yang di-Pertuan Agong,TIADA,,,,M,bumiputera,TIADA,TIADA,,31.03.2014 - 30.03.2017,2014-03-31,2017-03-30
552,5,Rahmah Othman,TIADA,BN - UMNO,Dilantik Yang di-Pertuan Agong,TIADA,,,,,bumiputera,TIADA,Ahli Dewan Negara,,,1979-04-06,1982-04-05
553,8,Rahmah Salleh,TIADA,BN - UMNO,Dipilih oleh Dewan Undangan Negeri,Terengganu,,,,,bumiputera,TIADA,Ahli Dewan Negara,,,,
554,14,Rais Yatim,YB Senator Tan Sri Dato' Seri Utama Dr.,BERSATU,Dilantik Yang di-Pertuan Agong,TIADA,,,,M,bumiputera,TIADA,Yang di-Pertua Dewan Negara,,16.06.2020 - 15.06.2023,2020-06-16,2023-06-15
555,11,Raja Kam Nadayson,TIADA,BN - MIC,Dilantik Yang di-Pertuan Agong,TIADA,,,,,bumiputera,TIADA,Ahli Dewan Negara,,,2005-02-17,2008-02-16
556,4,Raja Nong Chik Raja Ishak,TIADA,BN - UMNO,Dipilih oleh Dewan Undangan Negeri,Selangor,,,,,bumiputera,TIADA,Ahli Dewan Negara,,,1975-01-06,1978-01-05
556,5,Raja Nong Chik Raja Ishak,TIADA,BN - UMNO,Dipilih oleh Dewan Undangan Negeri,Selangor,,,,,bumiputera,TIADA,Ahli Dewan Negara,,,1975-01-06,1978-01-05
557,1,Raja Rastam Shahrome Raja Said Tauphy,TIADA,Perikatan - UMNO,Dipilih oleh Dewan Undangan Negeri,Selangor,,,,,bumiputera,TIADA,Ahli Dewan Negara,,,1959-09-11,1965-09-10
557,2,Raja Rastam Shahrome Raja Said Tauphy,TIADA,Perikatan - UMNO,Dipilih oleh Dewan Undangan Negeri,Selangor,,,,,bumiputera,TIADA,Ahli Dewan Negara,,,1959-09-11,1965-09-10
558,12,Raja Ropiaah binti Raja Abdullah,YB Senator Datuk,BN - UMNO,Dilantik Yang di-Pertuan Agong,TIADA,,,,M,bumiputera,TIADA,TIADA,,09.04.2012 - 08.04.2015,2012-04-09,2015-04-08
559,6,Rajoo Desari @ Govindasamy,TIADA,BN - MIC,Dilantik Yang di-Pertuan Agong,TIADA,,,,,indian,TIADA,Ahli Dewan Negara,,,1986-04-07,1989-04-06
559,7,Rajoo Desari @ Govindasamy,TIADA,BN - MIC,Dilantik Yang di-Pertuan Agong,TIADA,,,,,indian,TIADA,Ahli Dewan Negara,,,1986-04-07,1989-04-06
559,7,Rajoo Desari @ Govindasamy,TIADA,BN - MIC,Dilantik Yang di-Pertuan Agong,TIADA,,,,,indian,TIADA,Ahli Dewan Negara,,,1989-04-04,1992-04-03
560,9,Ramlah Abas,TIADA,BN - UMNO,Dipilih oleh Dewan Undangan Negeri,Melaka,,,,,bumiputera,TIADA,Ahli Dewan Negara,,,1999-05-03,2002-05-02
561,9,Ramlah Kassim,TIADA,BN - UMNO,Dipilih oleh Dewan Undangan Negeri,Pahang,,,,,bumiputera,TIADA,Ahli Dewan Negara,,,1996-09-06,1999-09-05
562,14,Ras Adiba binti Mohd Radzi,YB Senator Datuk,Wakil OKU,Dilantik Yang di-Pertuan Agong,TIADA,,,,M,bumiputera,TIADA,TIADA,,20.05.2020 - 19.05.2023,2020-05-20,2023-05-19
563,10,Ratnam Muthiah,TIADA,BN - MIC,Dilantik Yang di-Pertuan Agong,TIADA,,,,,bumiputera,TIADA,Ahli Dewan Negara,,,2000-07-04,2003-07-03
563,10,Ratnam Muthiah,TIADA,BN - MIC,Dilantik Yang di-Pertuan Agong,TIADA,,,,,bumiputera,TIADA,Ahli Dewan Negara,,,2003-08-12,2006-08-11
563,11,Ratnam Muthiah,TIADA,BN - MIC,Dilantik Yang di-Pertuan Agong,TIADA,,,,,bumiputera,TIADA,Ahli Dewan Negara,,,,
564,11,Rawisandran Narayanan,TIADA,BN - MIC,Dilantik Yang di-Pertuan Agong,TIADA,,,,,bumiputera,TIADA,Ahli Dewan Negara,,,2007-01-19,2010-01-18
565,14,Razali Bin Idris,YB Senator Datuk,BERSATU,Dilantik Yang di-Pertuan Agong,TIADA,,,,M,bumiputera,TIADA,Ahli Dewan Negara,,27.08.2018 - 26.08.2021,2018-08-27,2021-08-26
566,11,Rhina Bhar,TIADA,BN - Gerakan,Dilantik Yang di-Pertuan Agong,TIADA,,,,,bumiputera,TIADA,Ahli Dewan Negara,,,2004-10-13,2007-10-12
567,13,Riduan bin Rahmat,TIADA,TIADA,,TIADA,,,,M,bumiputera,TIADA,TIADA,,,,
568,14,Rita Sarimah anak Patrick Insol,YB Senator Puan,PRS,Dilantik Yang di-Pertuan Agong,TIADA,,,,F,bumiputera,TIADA,Ahli Dewan Negara,,22.06.2020 - 21.06.2023,2020-06-22,2023-06-21
568,15,Rita Sarimah anak Patrick Insol,YB Senator Puan,PRS,Dilantik Yang di-Pertuan Agong,TIADA,,,,F,bumiputera,TIADA,Ahli Dewan Negara,,22.06.2020 - 21.06.2023,2020-06-22,2023-06-21
569,11,Rizuan Abdul Hamid,TIADA,BN - UMNO,Dilantik Yang di-Pertuan Agong,TIADA,,,,,bumiputera,TIADA,Ahli Dewan Negara,,,2005-10-14,2008-10-13
570,14,Robert Lau Hui Yew,YB Senator Tuan,SUPP,Dilantik Yang di-Pertuan Agong,TIADA,,,,M,chinese,TIADA,TIADA,,22.06.2020 - 21.06.2023,2020-06-22,2023-06-21
570,15,Robert Lau Hui Yew,YB Senator Tuan,SUPP,Dilantik Yang di-Pertuan Agong,TIADA,,,,M,chinese,TIADA,Ahli Dewan Negara,,22.06.2020 - 21.06.2023,2020-06-22,2023-06-21
571,15,Roderick Wong Siew Lead,YB Senator Tuan,DAP,Dilantik Yang di-Pertuan Agong,TIADA,,,,M,chinese,TIADA,Ahli Dewan Negara,,20.03.2023 - 19.03.2026,2023-03-20,2026-03-19
572,5,Rogayah Ariff,TIADA,BN - UMNO,Dilantik Yang di-Pertuan Agong,TIADA,,,,,bumiputera,TIADA,Ahli Dewan Negara,,,1980-12-15,1983-12-14
572,5,Rogayah Ariff,TIADA,BN - UMNO,Dilantik Yang di-Pertuan Agong,TIADA,,,,,bumiputera,TIADA,Ahli Dewan Negara,,,1981-04-13,1984-04-12
573,6,Rogayah Che Mat,TIADA,BN - UMNO,Dilantik Yang di-Pertuan Agong,TIADA,,,,,bumiputera,TIADA,Ahli Dewan Negara,,,1986-02-18,1989-02-17
573,7,Rogayah Che Mat,TIADA,BN - UMNO,Dilantik Yang di-Pertuan Agong,TIADA,,,,,bumiputera,TIADA,Ahli Dewan Negara,,,1986-02-18,1989-02-17
573,7,Rogayah Che Mat,TIADA,BN - UMNO,Dilantik Yang di-Pertuan Agong,TIADA,,,,,bumiputera,TIADA,Ahli Dewan Negara,,,1989-03-27,1992-03-26
573,8,Rogayah Che Mat,TIADA,BN - UMNO,Dilantik Yang di-Pertuan Agong,TIADA,,,,,bumiputera,TIADA,Ahli Dewan Negara,,,1986-02-18,1989-02-17
573,8,Rogayah Che Mat,TIADA,BN - UMNO,Dilantik Yang di-Pertuan Agong,TIADA,,,,,bumiputera,TIADA,Ahli Dewan Negara,,,1989-03-27,1992-03-26
574,12,Rohani binti Abdullah,YB Senator Hajah,BN - UMNO,Dipilih oleh Dewan Undangan Negeri,Terengganu,,,,M,bumiputera,TIADA,TIADA,,26.01.2012 - 25.01.2015,2012-01-26,2015-01-25
575,6,Rokiah @ Maimun Zainuddin,TIADA,BN - UMNO,Dilantik Yang di-Pertuan Agong,TIADA,,,,,bumiputera,TIADA,Ahli Dewan Negara,,,1983-08-08,1986-08-07
575,7,Rokiah @ Maimun Zainuddin,TIADA,BN - UMNO,Dilantik Yang di-Pertuan Agong,TIADA,,,,,bumiputera,TIADA,Ahli Dewan Negara,,,1983-08-08,1986-08-07
575,7,Rokiah @ Maimun Zainuddin,TIADA,BN - UMNO,Dilantik Yang di-Pertuan Agong,TIADA,,,,,bumiputera,TIADA,Ahli Dewan Negara,,,1986-12-01,1989-11-30
576,14,Ros Suryati binti Alang,YB Senator Datin Hajah,BN - UMNO,Dilantik Yang di-Pertuan Agong,TIADA,,,,M,bumiputera,TIADA,Ahli Dewan Negara,,26.09.2022 - 25.09.2025,2022-09-26,2025-09-25
576,15,Ros Suryati binti Alang,YB Senator Datin Hajah,UMNO,Dilantik Yang di-Pertuan Agong,TIADA,,,,M,bumiputera,TIADA,Ahli Dewan Negara,,26.09.2022 - 25.09.2025,2022-09-26,2025-09-25
577,8,Rosalind Yau Shuk Meng,TIADA,BN - MCA,Dipilih oleh Dewan Undangan Negeri,Selangor,,,,,bumiputera,TIADA,Ahli Dewan Negara,,,1991-08-05,1994-08-04
578,11,Roslan Awang Chik,TIADA,BN - UMNO,Dilantik Yang di-Pertuan Agong,TIADA,,,,,bumiputera,TIADA,Ahli Dewan Negara,,,2004-12-06,2007-12-05
578,11,Roslan Awang Chik,TIADA,BN - UMNO,Dilantik Yang di-Pertuan Agong,TIADA,,,,,bumiputera,TIADA,Ahli Dewan Negara,,,2007-12-13,2010-12-12
579,9,Rosli Mat Hassan,TIADA,BN - UMNO,Dilantik Yang di-Pertuan Agong,TIADA,,,,,bumiputera,TIADA,Ahli Dewan Negara,,,1997-05-26,2000-05-25
579,10,Rosli Mat Hassan,TIADA,BN - UMNO,Dilantik Yang di-Pertuan Agong,TIADA,,,,,bumiputera,TIADA,Ahli Dewan Negara,,,1997-05-26,2000-05-25
579,10,Rosli Mat Hassan,TIADA,BN - UMNO,Dilantik Yang di-Pertuan Agong,TIADA,,,,,bumiputera,TIADA,Ahli Dewan Negara,,,2000-06-25,2000-06-24
580,12,Roslin binti Abdul Rahman,YB Senator Puan,BN - UMNO,Dipilih oleh Dewan Undangan Negeri,Pahang,,,,M,bumiputera,TIADA,TIADA,,22.05.2012 - 21.05.2015,2012-05-22,2015-05-21
581,7,Rosnah Mohd. Salleh,TIADA,BN - UMNO,Dilantik Yang di-Pertuan Agong,TIADA,,,,,bumiputera,TIADA,Ahli Dewan Negara,,,1987-02-23,1990-02-22
581,7,Rosnah Mohd. Salleh,TIADA,BN - UMNO,Dilantik Yang di-Pertuan Agong,TIADA,,,,,bumiputera,TIADA,Ahli Dewan Negara,,,1990-02-20,1993-02-19
581,8,Rosnah Mohd. Salleh,TIADA,BN - UMNO,Dilantik Yang di-Pertuan Agong,TIADA,,,,,bumiputera,TIADA,Ahli Dewan Negara,,,1987-02-23,1990-02-22
581,8,Rosnah Mohd. Salleh,TIADA,BN - UMNO,Dilantik Yang di-Pertuan Agong,TIADA,,,,,bumiputera,TIADA,Ahli Dewan Negara,,,1990-02-20,1993-02-19
582,15,Rosni Binti Sohar,YB Senator Datuk,UMNO,Dilantik Yang di-Pertuan Agong,TIADA,,,,M,bumiputera,TIADA,Ahli Dewan Negara,,09.01.2025 - 08.01.2028,2025-01-09,2028-01-08
583,12,S. Bagiam a/p Ayem Perumal,YB Senator Puan,BN - MIC,Dilantik Yang di-Pertuan Agong,TIADA,,,,F,indian,TIADA,TIADA,,22.08.2011 - 21.08.2014,2011-08-22,2014-08-21
584,6,S. Govindaraj,TIADA,BN - MIC,Dilantik Yang di-Pertuan Agong,TIADA,,,,,indian,TIADA,Ahli Dewan Negara,,,1982-07-19,1985-07-18
585,5,S. I. Rajah,TIADA,BN - MIC,Dilantik Yang di-Pertuan Agong,TIADA,,,,,other,TIADA,Ahli Dewan Negara,,,1979-04-06,1982-04-05
586,1,S. O. K. Ubaidulla,TIADA,Perikatan - MIC,Dilantik Yang di-Pertuan Agong,TIADA,,,,,bumiputera,TIADA,Ahli Dewan Negara,,,1959-09-11,1965-09-10
586,3,S. O. K. Ubaidulla,TIADA,Perikatan - MIC,Dilantik Yang di-Pertuan Agong,TIADA,,,,,bumiputera,TIADA,Ahli Dewan Negara,,,,1968-01-01
586,3,S. O. K. Ubaidulla,TIADA,Perikatan - MIC,Dilantik Yang di-Pertuan Agong,TIADA,,,,,bumiputera,TIADA,Ahli Dewan Negara,,,1968-10-22,1974-10-21
586,4,S. O. K. Ubaidulla,TIADA,BN - MIC,Dilantik Yang di-Pertuan Agong,TIADA,,,,,bumiputera,TIADA,Ahli Dewan Negara,,,,1968-01-01
586,4,S. O. K. Ubaidulla,TIADA,BN - MIC,Dilantik Yang di-Pertuan Agong,TIADA,,,,,bumiputera,TIADA,Ahli Dewan Negara,,,1968-10-22,1971-10-21
586,4,S. O. K. Ubaidulla,TIADA,BN - MIC,Dilantik Yang di-Pertuan Agong,TIADA,,,,,bumiputera,TIADA,Ahli Dewan Negara,,,1975-01-06,1978-01-05
586,5,S. O. K. Ubaidulla,TIADA,BN - MIC,Dilantik Yang di-Pertuan Agong,TIADA,,,,,bumiputera,TIADA,Ahli Dewan Negara,,,,1968-01-01
586,5,S. O. K. Ubaidulla,TIADA,BN - MIC,Dilantik Yang di-Pertuan Agong,TIADA,,,,,bumiputera,TIADA,Ahli Dewan Negara,,,1968-10-22,1971-10-21
586,5,S. O. K. Ubaidulla,TIADA,BN - MIC,Dilantik Yang di-Pertuan Agong,TIADA,,,,,bumiputera,TIADA,Ahli Dewan Negara,,,1975-01-06,1978-01-05
586,5,S. O. K. Ubaidulla,TIADA,BN - MIC,Dilantik Yang di-Pertuan Agong,TIADA,,,,,bumiputera,TIADA,Ahli Dewan Negara,,,,1980-12-31
586,2,S. O. K. Ubaidullah,TIADA,Perikatan - MIC,Dilantik Yang di-Pertuan Agong,TIADA,,,,,bumiputera,TIADA,Ahli Dewan Negara,,,1959-09-11,
586,2,S. O. K. Ubaidullah,TIADA,Perikatan - MIC,Dilantik Yang di-Pertuan Agong,TIADA,,,,,bumiputera,TIADA,Ahli Dewan Negara,,,1968-10-22,
587,1,S. P. S. Nathan,TIADA,Perikatan - MIC,Dilantik Yang di-Pertuan Agong,TIADA,,,,,other,TIADA,Ahli Dewan Negara,,,1959-09-11,1965-09-10
587,2,S. P. S. Nathan,TIADA,Perikatan - MIC,Dilantik Yang di-Pertuan Agong,TIADA,,,,,other,TIADA,Ahli Dewan Negara,,,1959-09-11,1968-08-26
588,4,S. P. Seenivasagam,TIADA,BN - PPP,Dilantik Yang di-Pertuan Agong,TIADA,,,,,indian,TIADA,Ahli Dewan Negara,,,1975-04-14,1975-07-04
589,2,S. T. Mani,TIADA,Perikatan - MIC,Dilantik Yang di-Pertuan Agong,TIADA,,,,,other,TIADA,Ahli Dewan Negara,,,1967-08-28,
589,3,S. T. Mani,TIADA,Perikatan - MIC,Dilantik Yang di-Pertuan Agong,TIADA,,,,,other,TIADA,Ahli Dewan Negara,,,1967-08-28,1973-08-27
590,13,SA. Vigneswaran,YB Senator Tan Sri Dato' Sri,BN - MIC,Dilantik Yang di-Pertuan Agong,TIADA,,,,M,indian,TIADA,Yang di-Pertua Dewan Negara,,23.06.2014 - 22.06.2017,2014-06-23,2017-06-22
591,8,Saad Man,TIADA,BN - UMNO,Dilantik Yang di-Pertuan Agong,TIADA,,,,,bumiputera,TIADA,Ahli Dewan Negara,,,1991-07-24,1994-07-23
592,12,Saat bin Hj Abu,YB Senator Datuk Hj,BN - UMNO,Dipilih oleh Dewan Undangan Negeri,Melaka,,,,M,bumiputera,TIADA,TIADA,,15.11.2011 - 14.11.2014,2011-11-15,2014-11-14
593,10,Safinah Jusoh,TIADA,PAS,Dipilih oleh Dewan Undangan Negeri,Terengganu,,,,,bumiputera,TIADA,Ahli Dewan Negara,,,1999-12-27,2002-12-26
593,11,Safinah Jusoh,TIADA,PAS,Dipilih oleh Dewan Undangan Negeri,Terengganu,,,,,bumiputera,TIADA,Ahli Dewan Negara,,,1999-12-27,2002-12-26
594,3,Said Besar Sigoh Singkunan,TIADA,TIADA,Dipilih oleh Dewan Undangan Negeri,Sabah,,,,,bumiputera,TIADA,Ahli Dewan Negara,,,,
595,7,Saidin Mohamad,TIADA,BN - UMNO,Dipilih oleh Dewan Undangan Negeri,Perlis,,,,,bumiputera,TIADA,Ahli Dewan Negara,,,1989-12-19,1992-12-18
595,8,Saidin Mohamad,TIADA,BN - UMNO,Dipilih oleh Dewan Undangan Negeri,Perlis,,,,,bumiputera,TIADA,Ahli Dewan Negara,,,1989-12-19,1992-12-18
596,2,Saidon Kechut,TIADA,Perikatan - UMNO,Dilantik Yang di-Pertuan Agong,TIADA,,,,,bumiputera,TIADA,Ahli Dewan Negara,,,1964-05-18,1965-08-16
596,2,Saidon Kechut,TIADA,Perikatan - UMNO,Dilantik Yang di-Pertuan Agong,TIADA,,,,,bumiputera,TIADA,Ahli Dewan Negara,,,1965-10-18,
597,15,Saifuddin Nasution bin Ismail,YB Senator Datuk Seri,PKR,Dilantik Yang di-Pertuan Agong,TIADA,,,,M,bumiputera,Menteri Dalam Negeri,Menteri Dalam Negeri,,03.12.2022 - 02.12.2025,2022-12-03,2025-12-02
598,12,Saiful Izham bin Ramli,YB Senator Tuan,PKR,Dipilih oleh Dewan Undangan Negeri,Kedah,,,,M,bumiputera,TIADA,TIADA,,21.05.2011 - 20.05.2014,2011-05-21,2014-05-20
599,9,Sairin Karno,TIADA,BN - UMNO,Dipilih oleh Dewan Undangan Negeri,Sabah,,,,,other,TIADA,Ahli Dewan Negara,,,1996-11-26,1999-11-25
600,8,Sak Cheng Lum,TIADA,BN - MCA,Dilantik Yang di-Pertuan Agong,TIADA,,,,,chinese,TIADA,Ahli Dewan Negara,,,1991-02-18,1994-02-17
600,8,Sak Cheng Lum,TIADA,BN - MCA,Dilantik Yang di-Pertuan Agong,TIADA,,,,,chinese,TIADA,Ahli Dewan Negara,,,1994-03-31,1997-03-30
601,7,Salbiah Mohd. Akim,TIADA,BN - UMNO,Dilantik Yang di-Pertuan Agong,TIADA,,,,,bumiputera,TIADA,Ahli Dewan Negara,,,1986-12-01,1989-11-30
601,7,Salbiah Mohd. Akim,TIADA,BN - UMNO,Dilantik Yang di-Pertuan Agong,TIADA,,,,,bumiputera,TIADA,Ahli Dewan Negara,,,1989-07-05,1992-07-04
601,8,Salbiah Mohd. Akim,TIADA,BN - UMNO,Dilantik Yang di-Pertuan Agong,TIADA,,,,,bumiputera,TIADA,Ahli Dewan Negara,,,1986-12-01,1989-11-30
601,8,Salbiah Mohd. Akim,TIADA,BN - UMNO,Dilantik Yang di-Pertuan Agong,TIADA,,,,,bumiputera,TIADA,Ahli Dewan Negara,,,1989-07-05,1992-07-04
602,15,Salehuddin bin Saidin,YB Senator Dato' Setia,PROFESIONAL,Dilantik Yang di-Pertuan Agong,TIADA,,,,M,bumiputera,TIADA,Ahli Dewan Negara,,22.7.2024 - 21.7.2027,2024-07-22,2027-07-21
603,8,Salleh @ Hassan Ali,TIADA,BN - UMNO,Dipilih oleh Dewan Undangan Negeri,Terengganu,,,,,bumiputera,TIADA,Ahli Dewan Negara,,,1993-05-24,1996-05-23
603,9,Salleh @ Hassan Ali,TIADA,BN - UMNO,Dipilih oleh Dewan Undangan Negeri,Terengganu,,,,,bumiputera,TIADA,Ahli Dewan Negara,Kedua,,1996-10-29,1999-10-28
604,4,Salleh Jafaruddin,TIADA,TIADA,Dilantik Yang di-Pertuan Agong,TIADA,,,,,bumiputera,TIADA,Ahli Dewan Negara,,,1977-04-18,1980-04-17
604,5,Salleh Jafaruddin,TIADA,BN - PBB,Dilantik Yang di-Pertuan Agong,TIADA,,,,,bumiputera,TIADA,Ahli Dewan Negara,,,,
605,6,Salleh Kassim,TIADA,BN - UMNO,Dipilih oleh Dewan Undangan Negeri,Terengganu,,,,,bumiputera,TIADA,Ahli Dewan Negara,,,1983-12-05,1985-03-03
606,4,Salmah Sheikh Hussein,TIADA,BN - PAS,Dilantik Yang di-Pertuan Agong,TIADA,,,,,bumiputera,TIADA,Ahli Dewan Negara,,,1975-01-06,1978-01-05
606,4,Salmah Sheikh Hussein,TIADA,BN - PAS,Dilantik Yang di-Pertuan Agong,TIADA,,,,,bumiputera,TIADA,Ahli Dewan Negara,,,1976-08-09,1979-08-08
606,5,Salmah Sheikh Hussein,TIADA,BN - PAS,Dilantik Yang di-Pertuan Agong,TIADA,,,,,bumiputera,TIADA,Ahli Dewan Negara,,,1975-01-06,1978-01-05
606,5,Salmah Sheikh Hussein,TIADA,BN - PAS,Dilantik Yang di-Pertuan Agong,TIADA,,,,,bumiputera,TIADA,Ahli Dewan Negara,,,1976-08-09,1979-08-08
607,5,Samad Idris,TIADA,BN - UMNO,Dilantik Yang di-Pertuan Agong,TIADA,,,,,bumiputera,TIADA,Ahli Dewan Negara,,,1979-04-09,1982-04-08
608,13,Sambanthan A/L Manickam,YB. Senator Datuk,IPF,Dilantik Yang di-Pertuan Agong,TIADA,,,,M,indian,TIADA,TIADA,,25.09.2017 - 24.09.2020,2017-09-25,2020-09-24
609,10,Samsiah Samsudin,TIADA,BN - UMNO,Dilantik Yang di-Pertuan Agong,TIADA,,,,,bumiputera,TIADA,Ahli Dewan Negara,,,,
609,11,Samsiah Samsudin,TIADA,BN - UMNO,Dipilih oleh Dewan Undangan Negeri,Negeri Sembilan,,,,,bumiputera,TIADA,Ahli Dewan Negara,,,2006-12-14,2009-12-13
610,8,Sarasa Velu,TIADA,BN - MIC,Dilantik Yang di-Pertuan Agong,TIADA,,,,,indian,TIADA,Ahli Dewan Negara,,,1992-12-16,1995-12-15
611,15,Saraswathy a/p Kandasami,YB Senator Puan,PKR,Dilantik Yang di-Pertuan Agong,TIADA,,,,F,indian,Timbalan Menteri Perpaduan,Ahli Dewan Negara,,10.12.2022 - 09.12.2025,2022-12-10,2025-12-09
612,10,Saravanan Murugan,TIADA,BN - MIC,Dilantik Yang di-Pertuan Agong,TIADA,,,,,indian,TIADA,Ahli Dewan Negara,,,2000-12-06,2003-12-05
612,11,Saravanan Murugan,TIADA,BN - MIC,Dilantik Yang di-Pertuan Agong,TIADA,,,,,indian,TIADA,Ahli Dewan Negara,,,2000-12-06,2003-12-05
613,8,Saravanan Veliaudayar,TIADA,BN - MIC,Dilantik Yang di-Pertuan Agong,TIADA,,,,,indian,TIADA,Ahli Dewan Negara,,,1994-03-31,1997-03-30
614,4,Seah Teng Ngiab,TIADA,BN - MCA,Dilantik Yang di-Pertuan Agong,TIADA,,,,,other,TIADA,Ahli Dewan Negara,,,1975-01-06,1978-01-05
615,10,See Too Mee,TIADA,BN - MCA,Dipilih oleh Dewan Undangan Negeri,Johor,,,,,chinese,TIADA,Ahli Dewan Negara,,,2000-04-24,2003-04-23
616,8,Selemiah Hashim,TIADA,BN - UMNO,Dilantik Yang di-Pertuan Agong,TIADA,,,,,bumiputera,TIADA,Ahli Dewan Negara,,,1993-04-19,1996-04-18
617,14,Seruandi bin Saad,YB Senator Tuan,UMNO,Dipilih oleh Dewan Undangan Negeri,Perlis,,,,M,bumiputera,TIADA,Ahli Dewan Negara,,26.08.2021 - 25.08.2024,2021-08-26,2024-08-25
618,3,Shaari Jusoh,TIADA,Perikatan - UMNO,Dipilih oleh Dewan Undangan Negeri,Perlis,,,,,bumiputera,TIADA,Ahli Dewan Negara,,,1971-08-02,1977-08-01
619,6,Shaharom Maasom,TIADA,BN - UMNO,Dilantik Yang di-Pertuan Agong,TIADA,,,,,bumiputera,TIADA,Ahli Dewan Negara,,,1982-12-17,1985-12-16
619,6,Shaharom Maasom,TIADA,BN - UMNO,Dilantik Yang di-Pertuan Agong,TIADA,,,,,bumiputera,TIADA,Ahli Dewan Negara,,,1986-02-18,1989-02-17
619,7,Shaharom Maasom,TIADA,BN - UMNO,Dilantik Yang di-Pertuan Agong,TIADA,,,,,bumiputera,TIADA,Ahli Dewan Negara,,,1982-12-17,1985-12-16
619,7,Shaharom Maasom,TIADA,BN - UMNO,Dilantik Yang di-Pertuan Agong,TIADA,,,,,bumiputera,TIADA,Ahli Dewan Negara,,,1986-02-18,1989-02-17
620,8,Shahiruddin Ab. Moin,TIADA,BN - UMNO,Dilantik Yang di-Pertuan Agong,TIADA,,,,,bumiputera,TIADA,Ahli Dewan Negara,,,,
621,14,Shamsuddin bin Hj. Abd Ghaffar,YB Senator Dato',UMNO,Dipilih oleh Dewan Undangan Negeri,Perak,,,,M,bumiputera,TIADA,Ahli Dewan Negara,,20.12.2021 - 19.12.2024,2021-12-20,2024-12-19
621,15,Shamsuddin bin Hj. Abd Ghaffar,YB Senator Dato',UMNO,Dipilih oleh Dewan Undangan Negeri,Perak,,,,M,bumiputera,TIADA,Ahli Dewan Negara,,20.12.2021 - 19.12.2024,2021-12-20,2024-12-19
622,11,Shamsudin Mehat,TIADA,BN - UMNO,Dilantik Yang di-Pertuan Agong,TIADA,,,,,bumiputera,TIADA,Ahli Dewan Negara,,,2007-12-18,2010-12-17
623,11,Sharifah Azizah Syed Zain,TIADA,BN - UMNO,Dilantik Yang di-Pertuan Agong,TIADA,,,,,bumiputera,TIADA,Ahli Dewan Negara,,,2004-03-09,2007-03-08
623,11,Sharifah Azizah Syed Zain,TIADA,BN - UMNO,Dilantik Yang di-Pertuan Agong,TIADA,,,,,bumiputera,TIADA,Ahli Dewan Negara,,,2007-03-09,2010-03-08
624,11,Sharipah Aminah Syed Mohamed,TIADA,BN - UMNO,Dilantik Yang di-Pertuan Agong,TIADA,,,,,bumiputera,TIADA,Ahli Dewan Negara,,,2004-12-13,2007-12-12
624,11,Sharipah Aminah Syed Mohamed,TIADA,BN - UMNO,Dilantik Yang di-Pertuan Agong,TIADA,,,,,bumiputera,TIADA,Ahli Dewan Negara,,,2007-12-13,2010-12-12
625,1,Sheikh Abu Bakar Yahya,TIADA,Perikatan - UMNO,Dipilih oleh Dewan Undangan Negeri,Johor,,,,,bumiputera,TIADA,Ahli Dewan Negara,,,1959-09-11,1965-09-10
625,2,Sheikh Abu Bakar Yahya,TIADA,Perikatan - UMNO,Dipilih oleh Dewan Undangan Negeri,Johor,,,,,bumiputera,TIADA,Ahli Dewan Negara,,,1959-09-11,1965-09-10
625,2,Sheikh Abu Bakar Yahya,TIADA,Perikatan - UMNO,Dipilih oleh Dewan Undangan Negeri,Johor,,,,,bumiputera,TIADA,Ahli Dewan Negara,,,1965-09-01,1968-09-01
626,6,Shuaib Lazim,TIADA,BN - UMNO,Dilantik Yang di-Pertuan Agong,TIADA,,,,,bumiputera,TIADA,Ahli Dewan Negara,,,1985-04-05,1988-04-04
626,7,Shuaib Lazim,TIADA,BN - UMNO,Dilantik Yang di-Pertuan Agong,TIADA,,,,,bumiputera,TIADA,Ahli Dewan Negara,,,1985-04-05,1988-04-04
626,7,Shuaib Lazim,TIADA,BN - UMNO,Dilantik Yang di-Pertuan Agong,TIADA,,,,,bumiputera,TIADA,Ahli Dewan Negara,,,1988-07-11,1991-07-10
626,8,Shuaib Lazim,TIADA,BN - UMNO,Dilantik Yang di-Pertuan Agong,TIADA,,,,,bumiputera,TIADA,Ahli Dewan Negara,,,1985-04-05,1988-04-04
626,8,Shuaib Lazim,TIADA,BN - UMNO,Dilantik Yang di-Pertuan Agong,TIADA,,,,,bumiputera,TIADA,Ahli Dewan Negara,,,1988-07-11,1991-07-10
627,7,Shuib Endut,TIADA,BN - UMNO,Dipilih oleh Dewan Undangan Negeri,Kedah,,,,,bumiputera,TIADA,Ahli Dewan Negara,,,1989-12-19,1992-12-18
627,8,Shuib Endut,TIADA,BN - UMNO,Dipilih oleh Dewan Undangan Negeri,Kedah,,,,,bumiputera,TIADA,Ahli Dewan Negara,,,1989-12-19,1992-12-18
627,8,Shuib Endut,TIADA,BN - UMNO,Dipilih oleh Dewan Undangan Negeri,Kedah,,,,,bumiputera,TIADA,Ahli Dewan Negara,,,1992-12-16,1995-12-15
628,8,Shuib Shawal,TIADA,BN - UMNO,Dipilih oleh Dewan Undangan Negeri,Kedah,,,,,bumiputera,TIADA,Ahli Dewan Negara,,,1991-12-16,1994-12-15
629,11,Sim Kheng Hui,TIADA,BN - SUPP,Dilantik Yang di-Pertuan Agong,TIADA,,,,,chinese,TIADA,Ahli Dewan Negara,,,2007-12-18,2010-12-17
630,10,Sinniah Raju,TIADA,BN - MIC,Dilantik Yang di-Pertuan Agong,TIADA,,,,,indian,TIADA,Ahli Dewan Negara,,,2001-04-10,2004-04-09
630,11,Sinniah Raju,TIADA,BN - MIC,Dilantik Yang di-Pertuan Agong,TIADA,,,,,indian,TIADA,Ahli Dewan Negara,,,2001-04-10,2004-04-09
630,11,Sinniah Raju,TIADA,BN - MIC,Dilantik Yang di-Pertuan Agong,TIADA,,,,,indian,TIADA,Ahli Dewan Negara,,,2004-07-21,2004-12-08
631,13,Siti Aishah Binti Shaik Ismail,YB Senator Puan,PKR,Dipilih oleh Dewan Undangan Negeri,Pulau Pinang,,,,M,bumiputera,TIADA,TIADA,,02.06.2015 - 01.06.2018,2015-06-02,2018-06-01
632,4,Siti Fatimah Sheikh Hussein,TIADA,BN - UMNO,Dilantik Yang di-Pertuan Agong,TIADA,,,,,bumiputera,TIADA,Ahli Dewan Negara,,,,
633,9,Siti Hawa @ Karimah Mohd Nor,TIADA,BN - UMNO,Dilantik Yang di-Pertuan Agong,TIADA,,,,,bumiputera,TIADA,Ahli Dewan Negara,,,1998-08-12,2001-08-11
633,10,Siti Hawa @ Karimah Mohd. Nor,TIADA,BN - UMNO,Dilantik Yang di-Pertuan Agong,TIADA,,,,,bumiputera,TIADA,Ahli Dewan Negara,,,1998-08-12,2001-08-11
634,11,Siti Rokiah Mohd. Zabidin,TIADA,BN - UMNO,Dipilih oleh Dewan Undangan Negeri,Pahang,,,,,bumiputera,TIADA,Ahli Dewan Negara,,,2006-05-08,2009-05-07
635,10,Siti Zailah Mohd Yusoff,TIADA,PAS,Dipilih oleh Dewan Undangan Negeri,Kelantan,,,,,bumiputera,TIADA,Ahli Dewan Negara,,,2000-07-18,2003-07-17
635,10,Siti Zailah Mohd Yusoff,TIADA,PAS,Dipilih oleh Dewan Undangan Negeri,Kelantan,,,,,bumiputera,TIADA,Ahli Dewan Negara,,,2003-07-01,2006-06-30
635,11,Siti Zailah Mohd Yusoff,TIADA,PAS,Dipilih oleh Dewan Undangan Negeri,Kelantan,,,,,bumiputera,TIADA,Ahli Dewan Negara,,,2003-07-01,2006-06-30
636,7,Sivalingam Arumugam Kuruppiah,TIADA,BN - MIC,Dipilih oleh Dewan Undangan Negeri,Selangor,,,,,indian,TIADA,Ahli Dewan Negara,,,1986-12-15,1989-12-14
636,7,Sivalingam Arumugam Kuruppiah,TIADA,BN - MIC,Dipilih oleh Dewan Undangan Negeri,Appointed,,,,,indian,TIADA,Ahli Dewan Negara,,,1988-11-28,1991-11-27
637,15,Sivaraj a/l Chandran,YB Senator Dato',MIC,Dilantik Yang di-Pertuan Agong,TIADA,,,,M,indian,TIADA,Ahli Dewan Negara,,20.03.2023 - 19.03.2026,2023-03-20,2026-03-19
638,10,Siw Chun Eam,TIADA,BN - UMNO,Dilantik Yang di-Pertuan Agong,TIADA,,,,,chinese,TIADA,Ahli Dewan Negara,,,,
638,11,Siw Chun Eam,TIADA,BN - UMNO,Dilantik Yang di-Pertuan Agong,TIADA,,,,,chinese,TIADA,Ahli Dewan Negara,,,2005-12-20,2008-12-19
639,11,Soon Tian Szu,TIADA,BN - MCA,Dipilih oleh Dewan Undangan Negeri,Malacca,,,,,chinese,TIADA,Ahli Dewan Negara,,,2006-04-26,2009-04-25
640,8,Soong Siew Hoong,TIADA,BN - Gerakan,Dilantik Yang di-Pertuan Agong,TIADA,,,,,chinese,TIADA,Ahli Dewan Negara,,,,
641,13,Sopiah Binti Sharif,YB Senator Puan,BN - UMNO,Dilantik Yang di-Pertuan Agong,TIADA,,,,M,bumiputera,TIADA,TIADA,,17.07.2017 - 16.07.2020,2017-07-17,2020-07-16
642,4,Stephen Robert Evans,TIADA,TIADA,Dipilih oleh Dewan Undangan Negeri,Sabah,,,,,bumiputera,TIADA,Ahli Dewan Negara,,,1977-12-15,1978-06-20
643,6,Stephen Timothy Wan Ullok,TIADA,TIADA,Dilantik Yang di-Pertuan Agong,TIADA,,,,,bumiputera,TIADA,Ahli Dewan Negara,,,1983-03-28,1986-03-27
643,7,Stephen Timothy Wan Ullok,TIADA,TIADA,Dilantik Yang di-Pertuan Agong,TIADA,,,,,bumiputera,TIADA,Ahli Dewan Negara,,,1983-03-28,1986-03-27
643,7,Stephen Timothy Wan Ullok,TIADA,TIADA,Dilantik Yang di-Pertuan Agong,TIADA,,,,,bumiputera,TIADA,Ahli Dewan Negara,,,1986-12-01,1989-11-30
644,5,Subramaniam Sinniah,TIADA,BN - MIC,Dilantik Yang di-Pertuan Agong,TIADA,,,,,bumiputera,TIADA,Ahli Dewan Negara,,,1979-04-06,1982-04-05
645,12,Subramaniam a/l Veruthasalam,YB Senator Tuan,BN - MIC,Dilantik Yang di-Pertuan Agong,TIADA,,,,M,indian,TIADA,TIADA,,22.08.2011 - 21.08.2014,2011-08-22,2014-08-21
646,5,Sulaiman Ninam Shah,TIADA,BN - UMNO,Dilantik Yang di-Pertuan Agong,TIADA,,,,,bumiputera,TIADA,Ahli Dewan Negara,,,1979-04-06,1982-04-05
646,6,Sulaiman Ninam Shah,TIADA,BN - UMNO,Dilantik Yang di-Pertuan Agong,TIADA,,,,,bumiputera,TIADA,Ahli Dewan Negara,,,1979-04-06,1982-04-05
646,6,Sulaiman Ninam Shah,TIADA,BN - UMNO,Dilantik Yang di-Pertuan Agong,TIADA,,,,,bumiputera,TIADA,Ahli Dewan Negara,,,1982-07-19,1985-07-18
647,14,Susan Chemerai Anding,YB Senator Puan,PBB,Dilantik Yang di-Pertuan Agong,TIADA,,,,F,bumiputera,TIADA,TIADA,,22.06.2020 - 21.06.2023,2020-06-22,2023-06-21
647,15,Susan Chemerai Anding,YB Senator Puan,PBB,Dilantik Yang di-Pertuan Agong,TIADA,,,,F,bumiputera,TIADA,Ahli Dewan Negara,,22.06.2020 - 21.06.2023,2020-06-22,2023-06-21
648,7,Syed Abdul Hamid Sagaff,TIADA,BN - UMNO,Dilantik Yang di-Pertuan Agong,TIADA,,,,,bumiputera,TIADA,Ahli Dewan Negara,,,1987-12-16,1990-12-15
648,8,Syed Abdul Hamid Sagaff,TIADA,BN - UMNO,Dilantik Yang di-Pertuan Agong,TIADA,,,,,bumiputera,TIADA,Ahli Dewan Negara,,,1987-12-16,1990-12-15
648,8,Syed Abdul Hamid Sagaff,TIADA,BN - UMNO,Dilantik Yang di-Pertuan Agong,TIADA,,,,,bumiputera,TIADA,Ahli Dewan Negara,,,1991-03-29,1994-03-28
649,1,Syed Ahmad Syed Mahmud Shahabuddin,TIADA,Perikatan - UMNO,Dipilih oleh Dewan Undangan Negeri,Kedah,,,,,bumiputera,TIADA,Ahli Dewan Negara,,,1959-09-11,1965-09-10
649,2,Syed Ahmad Syed Mahmud Shahabuddin,TIADA,Perikatan - UMNO,Dipilih oleh Dewan Undangan Negeri,Kedah,,,,,bumiputera,TIADA,Ahli Dewan Negara,,,1959-09-11,1965-09-10
649,2,Syed Ahmad Syed Mahmud Shahabuddin,TIADA,Perikatan - UMNO,Dipilih oleh Dewan Undangan Negeri,Kedah,,,,,bumiputera,TIADA,Ahli Dewan Negara,,,1965-09-01,1968-01-01
650,10,Syed Ali Syed Abbas Alhabshee,TIADA,BN - UMNO,Dilantik Yang di-Pertuan Agong,TIADA,,,,,bumiputera,TIADA,Ahli Dewan Negara,,,,
650,11,Syed Ali Syed Abbas Alhabshee,TIADA,BN - UMNO,Dilantik Yang di-Pertuan Agong,TIADA,,,,,bumiputera,TIADA,Ahli Dewan Negara,,,2006-04-26,2009-04-25
651,1,Syed Bahaldin Syed Noh,TIADA,Perikatan - UMNO,Dipilih oleh Dewan Undangan Negeri,Perlis,,,,,bumiputera,TIADA,Ahli Dewan Negara,,,1959-09-11,1960-09-30
652,2,Syed Darus Syed Hashim,TIADA,Perikatan - UMNO,Dipilih oleh Dewan Undangan Negeri,Perlis,,,,,bumiputera,TIADA,Ahli Dewan Negara,,,1965-12-18,1971-12-17
652,3,Syed Darus Syed Hashim,TIADA,Perikatan - UMNO,Dipilih oleh Dewan Undangan Negeri,Perlis,,,,,bumiputera,TIADA,Ahli Dewan Negara,,,1965-12-18,1971-12-17
653,2,Syed Hassan Aidid,TIADA,Perikatan - UMNO,Dipilih oleh Dewan Undangan Negeri,Pulau Pinang,,,,,bumiputera,TIADA,Ahli Dewan Negara,,,1968-10-22,1974-10-21
653,3,Syed Hassan Aidid,TIADA,Perikatan - UMNO,Dipilih oleh Dewan Undangan Negeri,Pulau Pinang,,,,,bumiputera,TIADA,Ahli Dewan Negara,,,1968-10-22,1974-10-21
653,4,Syed Hassan Aidid,TIADA,BN - UMNO,Dipilih oleh Dewan Undangan Negeri,Pulau Pinang,,,,,bumiputera,TIADA,Ahli Dewan Negara,,,1968-10-22,1971-10-21
653,4,Syed Hassan Aidid,TIADA,BN - UMNO,Dipilih oleh Dewan Undangan Negeri,Pulau Pinang,,,,,bumiputera,TIADA,Ahli Dewan Negara,,,1975-01-06,1978-01-05
653,5,Syed Hassan Aidid,TIADA,BN - UMNO,Dipilih oleh Dewan Undangan Negeri,Pulau Pinang,,,,,bumiputera,TIADA,Ahli Dewan Negara,,,1968-10-22,1971-10-21
653,5,Syed Hassan Aidid,TIADA,BN - UMNO,Dipilih oleh Dewan Undangan Negeri,Pulau Pinang,,,,,bumiputera,TIADA,Ahli Dewan Negara,,,1975-01-06,1978-01-05
654,12,Syed Husin Ali,YB Senator Dr.,PKR,,TIADA,,,,M,bumiputera,TIADA,TIADA,,17.12.2012 - 16.12.2015,2012-12-17,2015-12-16
655,3,Syed Hussein Alatas,TIADA,Gerakan,Dipilih oleh Dewan Undangan Negeri,Pulau Pinang,,,,,bumiputera,TIADA,Ahli Dewan Negara,,,1971-08-02,1977-08-01
656,12,Syed Ibrahim bin Kader,YB Senator Dato',KIMMA,Dilantik Yang di-Pertuan Agong,TIADA,,,,M,bumiputera,TIADA,TIADA,,30.05.2011 - 29.05.2014,2011-05-30,2014-05-29
657,5,Syed Kamarulzaman Syed Bahaldin Aljamlud,TIADA,BN - UMNO,Dipilih oleh Dewan Undangan Negeri,Selangor,,,,,bumiputera,TIADA,Ahli Dewan Negara,,,1981-01-05,1984-01-04
658,3,Syed Kechik Syed Mohamed,TIADA,USNO,Dipilih oleh Dewan Undangan Negeri,Sabah,,,,,bumiputera,TIADA,Ahli Dewan Negara,,,,
659,4,Syed Omar Syed Hussain,TIADA,BN - UMNO,Dipilih oleh Dewan Undangan Negeri,Perlis,,,,,bumiputera,TIADA,Ahli Dewan Negara,,,1975-01-06,1978-01-05
660,12,Syed Shahir bin Syed Mohamud,YB Senator Tuan,PKR,Dipilih oleh Dewan Undangan Negeri,Pulau Pinang,,,,M,bumiputera,TIADA,TIADA,,01.06.2012 - 31.05.2015,2012-06-01,2015-05-31
661,2,Syed Sheh Hassan Barakbah,TIADA,Perikatan - UMNO,Dilantik Yang di-Pertuan Agong,TIADA,,,,,bumiputera,TIADA,Ahli Dewan Negara,,,1969-01-27,
662,10,T. Marimuthu,TIADA,BN - MIC,Dilantik Yang di-Pertuan Agong,TIADA,,,,,indian,TIADA,Ahli Dewan Negara,,,1996-05-14,1999-05-13
662,10,T. Marimuthu,TIADA,BN - MIC,Dilantik Yang di-Pertuan Agong,TIADA,,,,,indian,TIADA,Ahli Dewan Negara,,,1999-05-19,2002-05-18
663,4,T. S. Gabriel,TIADA,BN - MIC,Dilantik Yang di-Pertuan Agong,TIADA,,,,,other,TIADA,Ahli Dewan Negara,,,1975-01-06,1978-01-05
663,5,T. S. Gabriel,TIADA,BN - MIC,Dilantik Yang di-Pertuan Agong,TIADA,,,,,other,TIADA,Ahli Dewan Negara,,,1975-01-06,1978-01-05
664,11,Tajul Urus Mat Zain,TIADA,BN - UMNO,Dilantik Yang di-Pertuan Agong,TIADA,,,,,bumiputera,TIADA,Ahli Dewan Negara,,,2005-10-14,2008-10-13
665,9,Tan Ah Eng,TIADA,BN - MCA,Dipilih oleh Dewan Undangan Negeri,Johor,,,,,chinese,TIADA,Ahli Dewan Negara,,,1997-05-12,2000-05-11
665,10,Tan Ah Eng,TIADA,BN - MCA,Dipilih oleh Dewan Undangan Negeri,Johor,,,,,chinese,TIADA,Ahli Dewan Negara,,,1997-05-12,2000-05-11
666,11,Tan Bon You,TIADA,BN - MCA,Dilantik Yang di-Pertuan Agong,TIADA,,,,,chinese,TIADA,Ahli Dewan Negara,,,2004-08-06,2007-08-05
667,7,Tan Chai Ho,TIADA,BN - MCA,Dilantik Yang di-Pertuan Agong,TIADA,,,,,chinese,TIADA,Ahli Dewan Negara,,,1987-02-14,1990-02-13
667,7,Tan Chai Ho,TIADA,BN - MCA,Dilantik Yang di-Pertuan Agong,TIADA,,,,,chinese,TIADA,Ahli Dewan Negara,,,1988-11-28,1991-11-27
668,5,Tan Chang Soong,TIADA,BN - MCA,Dilantik Yang di-Pertuan Agong,TIADA,,,,,chinese,TIADA,Ahli Dewan Negara,,,1980-12-15,1983-12-14
668,6,Tan Chang Soong,TIADA,BN - MCA,Dilantik Yang di-Pertuan Agong,TIADA,,,,,chinese,TIADA,Ahli Dewan Negara,,,1980-12-15,1983-12-14
668,6,Tan Chang Soong,TIADA,BN - MCA,Dilantik Yang di-Pertuan Agong,TIADA,,,,,chinese,TIADA,Ahli Dewan Negara,,,1984-01-10,1987-01-09
668,7,Tan Chang Soong,TIADA,BN - MCA,Dilantik Yang di-Pertuan Agong,TIADA,,,,,chinese,TIADA,Ahli Dewan Negara,,,1980-12-15,1983-12-14
668,7,Tan Chang Soong,TIADA,BN - MCA,Dilantik Yang di-Pertuan Agong,TIADA,,,,,chinese,TIADA,Ahli Dewan Negara,,,1984-01-10,1987-01-09
669,10,Tan Cheng Tee,TIADA,BN - MCA,Dipilih oleh Dewan Undangan Negeri,Negeri Sembilan,,,,,chinese,TIADA,Ahli Dewan Negara,,,2002-11-11,2005-11-10
669,11,Tan Cheng Tee,TIADA,BN - MCA,Dipilih oleh Dewan Undangan Negeri,Negeri Sembilan,,,,,chinese,TIADA,Ahli Dewan Negara,,,2002-11-11,2005-11-10
670,7,Tan Chong Keng,TIADA,BN - MCA,Dilantik Yang di-Pertuan Agong,TIADA,,,,,chinese,TIADA,Ahli Dewan Negara,,,1987-12-16,1990-12-15
671,9,Tan Ek Huat,TIADA,BN - MCA,Dipilih oleh Dewan Undangan Negeri,Perak,,,,,chinese,TIADA,Ahli Dewan Negara,,,1997-10-06,2000-10-05
671,10,Tan Ek Huat,TIADA,BN - MCA,Dipilih oleh Dewan Undangan Negeri,Perak,,,,,chinese,TIADA,Ahli Dewan Negara,,,1997-10-06,2000-10-05
672,8,Tan Gim Hwa,TIADA,BN - Gerakan,Dipilih oleh Dewan Undangan Negeri,Pulau Pinang,,,,,chinese,TIADA,Ahli Dewan Negara,,,1991-07-24,1994-07-23
673,7,Tan Peng Khoon,TIADA,BN - MCA,Dilantik Yang di-Pertuan Agong,TIADA,,,,,chinese,TIADA,Ahli Dewan Negara,,,1987-02-14,1990-02-13
673,7,Tan Peng Khoon,TIADA,BN - MCA,Dilantik Yang di-Pertuan Agong,TIADA,,,,,chinese,TIADA,Ahli Dewan Negara,,,1989-12-18,1991-02-01
674,8,Tan Son Lee,TIADA,BN - MCA,Dipilih oleh Dewan Undangan Negeri,Kedah,,,,,chinese,TIADA,Ahli Dewan Negara,,,1994-12-14,1997-12-13
675,8,Tan Tiew Bock,TIADA,BN - MCA,Dilantik Yang di-Pertuan Agong,TIADA,,,,,chinese,TIADA,Ahli Dewan Negara,,,1991-02-18,1994-02-17
435,1,Tan Tong Hye,TIADA,Perikatan - MCA,Dilantik Yang di-Pertuan Agong,TIADA,,,,,chinese,TIADA,Ahli Dewan Negara,,,1959-09-11,1965-09-10
435,2,Tan Tong Hye,TIADA,Perikatan - MCA,Dilantik Yang di-Pertuan Agong,TIADA,,,,,chinese,TIADA,Ahli Dewan Negara,,,1959-09-11,1965-09-10
435,2,Tan Tong Hye,TIADA,Perikatan - MCA,Dilantik Yang di-Pertuan Agong,TIADA,,,,,chinese,TIADA,Ahli Dewan Negara,,,1965-10-18,
435,3,Tan Tong Hye,TIADA,Perikatan - MCA,Dilantik Yang di-Pertuan Agong,TIADA,,,,,chinese,TIADA,Ahli Dewan Negara,,,1965-10-18,1971-10-17
435,3,Tan Tong Hye,TIADA,Perikatan - MCA,Dilantik Yang di-Pertuan Agong,TIADA,,,,,chinese,TIADA,Ahli Dewan Negara,,,1971-12-20,1977-12-19
676,7,Tay Chee King,TIADA,BN - MCA,Dipilih oleh Dewan Undangan Negeri,Johor,,,,,chinese,TIADA,Ahli Dewan Negara,,,1984-04-09,1987-04-08
676,6,Tay Chee King,TIADA,BN - MCA,Dipilih oleh Dewan Undangan Negeri,Johor,,,,,chinese,TIADA,Ahli Dewan Negara,,,1984-04-09,1987-04-08
677,11,Tay Puay Chuan,TIADA,BN - MCA,Dipilih oleh Dewan Undangan Negeri,Johor,,,,,chinese,TIADA,Ahli Dewan Negara,,,2004-10-13,2007-10-12
678,9,Tee Thiong Hock,TIADA,BN - MCA,Dipilih oleh Dewan Undangan Negeri,Selangor,,,,,chinese,TIADA,Ahli Dewan Negara,,,1997-08-11,2000-08-10
678,10,Tee Thiong Hock,TIADA,BN - MCA,Dipilih oleh Dewan Undangan Negeri,Selangor,,,,,chinese,TIADA,Ahli Dewan Negara,,,1997-08-11,2000-08-10
679,2,Teh Siew Eng,TIADA,Perikatan - MCA,Dilantik Yang di-Pertuan Agong,TIADA,,,,,chinese,TIADA,Ahli Dewan Negara,,,1964-09-11,1965-10-18
530,1,Temenggung Oyong Lawai Jau,TIADA,SNAP,Dipilih oleh Dewan Undangan Negeri,Sarawak,,,,,bumiputera,TIADA,Ahli Dewan Negara,,,1963-11-02,1969-11-01
530,2,Temenggung Oyong Lawai Jau,TIADA,SNAP,Dipilih oleh Dewan Undangan Negeri,Sarawak,,,,,bumiputera,TIADA,Ahli Dewan Negara,,,1963-11-02,
530,2,Temenggung Oyong Lawai Jau,TIADA,SNAP,Dipilih oleh Dewan Undangan Negeri,Sarawak,,,,,bumiputera,TIADA,Ahli Dewan Negara,,,1968-10-22,
680,10,Tengku Adnan Tengku Mansor,TIADA,BN - UMNO,Dilantik Yang di-Pertuan Agong,TIADA,,,,,bumiputera,TIADA,Ahli Dewan Negara,,,2000-12-13,2003-12-12
681,5,Tengku Perang Tengku Razlan,TIADA,BN - UMNO,Dilantik Yang di-Pertuan Agong,TIADA,,,,,bumiputera,TIADA,Ahli Dewan Negara,,,1979-04-09,1982-04-08
682,15,Tengku Zafrul bin Tengku Abdul Aziz,YB Senator Datuk Seri Utama,UMNO,Dilantik Yang di-Pertuan Agong,TIADA,,,,M,bumiputera,"Menteri Pelaburan, Perdagangan dan Industri","Menteri Pelaburan, Perdagangan dan Industri",,09.03.2020 - 03.11.2022,2020-03-09,2022-11-03
683,13,Teo Eng Tee @ Teo Kok Chee,YB Senator Datuk,BN - GERAKAN,Dilantik Yang di-Pertuan Agong,TIADA,,,,M,chinese,TIADA,TIADA,,16.01.2018 - 15.01.2021,2018-01-16,2021-01-15
683,14,Teo Eng Tee @ Teo Kok Chee,YB Senator Datuk,GERAKAN,Dilantik Yang di-Pertuan Agong,TIADA,,,,M,chinese,TIADA,Ahli Dewan Negara,,16.01.2018 - 15.01.2021,2018-01-16,2021-01-15
684,3,Thomas Kana,TIADA,TIADA,Dilantik Yang di-Pertuan Agong,TIADA,,,,,chinese,TIADA,Ahli Dewan Negara,,,1971-12-20,1977-12-19
685,14,Ti Lian Ker,YB Senator Dato' Sri,MCA,Dilantik Yang di-Pertuan Agong,TIADA,,,,M,chinese,Timbalan Menteri Belia dan Sukan,TIADA,,10.08.2018 - 09.08.2021,2018-08-10,2021-08-09
686,9,Ting Chek Sii,TIADA,BN - MCA,Dilantik Yang di-Pertuan Agong,TIADA,,,,,chinese,TIADA,Ahli Dewan Negara,,,1998-05-12,2001-05-11
686,10,Ting Chek Sii,TIADA,BN - MCA,Dilantik Yang di-Pertuan Agong,TIADA,,,,,chinese,TIADA,Ahli Dewan Negara,,,1998-05-12,2001-05-11
687,3,Ting Ming Hia @ Ting Ming Hoi,TIADA,TIADA,Dipilih oleh Dewan Undangan Negeri,Sarawak,,,,,chinese,TIADA,Ahli Dewan Negara,,,1971-08-02,1977-08-01
687,3,Ting Ming Hia @ Ting Ming Hoi,TIADA,TIADA,Dipilih oleh Dewan Undangan Negeri,Sarawak,,,,,chinese,TIADA,Ahli Dewan Negara,,,1971-12-20,1977-12-19
687,4,Ting Ming Hia @ Ting Ming Hoi,TIADA,TIADA,Dipilih oleh Dewan Undangan Negeri,Sarawak,,,,,chinese,TIADA,Ahli Dewan Negara,,,1971-08-02,1974-08-01
687,4,Ting Ming Hia @ Ting Ming Hoi,TIADA,TIADA,Dipilih oleh Dewan Undangan Negeri,Sarawak,,,,,chinese,TIADA,Ahli Dewan Negara,,,1971-12-20,1974-12-19
687,5,Ting Ming Hia @ Ting Ming Hoi,TIADA,TIADA,Dipilih oleh Dewan Undangan Negeri,Sarawak,,,,,chinese,TIADA,Ahli Dewan Negara,,,1971-08-02,1974-08-01
687,5,Ting Ming Hia @ Ting Ming Hoi,TIADA,TIADA,Dipilih oleh Dewan Undangan Negeri,Sarawak,,,,,chinese,TIADA,Ahli Dewan Negara,,,1971-12-20,1974-12-19
688,6,Tiong Hiew King,TIADA,BN - SUPP,Dilantik Yang di-Pertuan Agong,TIADA,,,,,chinese,TIADA,Ahli Dewan Negara,,,1985-07-29,1988-07-28
688,7,Tiong Hiew King,TIADA,BN - SUPP,Dilantik Yang di-Pertuan Agong,TIADA,,,,,chinese,TIADA,Ahli Dewan Negara,,,1985-07-29,1988-07-28
688,7,Tiong Hiew King,TIADA,BN - SUPP,Dilantik Yang di-Pertuan Agong,TIADA,,,,,chinese,TIADA,Ahli Dewan Negara,,,1988-11-28,1991-11-27
688,8,Tiong Hiew King,TIADA,BN - SUPP,Dilantik Yang di-Pertuan Agong,TIADA,,,,,chinese,TIADA,Ahli Dewan Negara,,,1985-07-29,1988-07-28
688,8,Tiong Hiew King,TIADA,BN - SUPP,Dilantik Yang di-Pertuan Agong,TIADA,,,,,chinese,TIADA,Ahli Dewan Negara,,,1988-11-28,1991-11-27
689,8,Tiong Thai King,TIADA,BN - SUPP,Dilantik Yang di-Pertuan Agong,TIADA,,,,,chinese,TIADA,Ahli Dewan Negara,,,1991-12-16,1994-12-15
690,8,Toh Kin Woon,TIADA,BN - Gerakan,Dipilih oleh Dewan Undangan Negeri,Pulau Pinang,,,,,chinese,TIADA,Ahli Dewan Negara,,,,
691,4,Tom Saudah Othman,TIADA,BN - UMNO,Dipilih oleh Dewan Undangan Negeri,Kedah,,,,,bumiputera,TIADA,Ahli Dewan Negara,,,1975-01-06,1978-01-05
691,5,Tom Saudah Othman,TIADA,BN - UMNO,Dipilih oleh Dewan Undangan Negeri,Kedah,,,,,bumiputera,TIADA,Ahli Dewan Negara,,,1975-01-06,1978-01-05
692,1,Tuanku Bujang Tuanku Othman,TIADA,BARJASA,Dipilih oleh Dewan Undangan Negeri,Sarawak,,,,,bumiputera,TIADA,Ahli Dewan Negara,,,1963-11-02,1969-11-01
692,2,Tuanku Bujang Tuanku Othman,TIADA,BARJASA,Dipilih oleh Dewan Undangan Negeri,Sarawak,,,,,bumiputera,TIADA,Ahli Dewan Negara,,,1963-11-02,
692,2,Tuanku Bujang Tuanku Othman,TIADA,BARJASA,Dipilih oleh Dewan Undangan Negeri,Sarawak,,,,,bumiputera,TIADA,Ahli Dewan Negara,,,1965-12-18,
693,10,Udam @ George Adam Talek,TIADA,BN - PBB,Dilantik Yang di-Pertuan Agong,TIADA,,,,,bumiputera,TIADA,Ahli Dewan Negara,,,,
693,11,Udam @ George Adam Talek,TIADA,BN - PBB,Dilantik Yang di-Pertuan Agong,TIADA,,,,,bumiputera,TIADA,Ahli Dewan Negara,,,,
694,8,V. K. K. Teagarajan,TIADA,BN - MIC,Dilantik Yang di-Pertuan Agong,TIADA,,,,,indian,TIADA,Ahli Dewan Negara,,,1994-12-14,1997-12-13
694,10,V. K. K. Teagarajan,TIADA,BN - MIC,Dilantik Yang di-Pertuan Agong,TIADA,,,,,indian,TIADA,Ahli Dewan Negara,,,1994-12-14,1997-12-13
694,10,V. K. K. Teagarajan,TIADA,BN - MIC,Dilantik Yang di-Pertuan Agong,TIADA,,,,,indian,TIADA,Ahli Dewan Negara,,,1997-10-06,2000-10-05
695,7,V. K. Sellappan,TIADA,BN - MIC,Dilantik Yang di-Pertuan Agong,TIADA,,,,,indian,TIADA,Ahli Dewan Negara,,,1988-07-11,1991-07-10
695,8,V. K. Sellappan,TIADA,BN - MIC,Dilantik Yang di-Pertuan Agong,TIADA,,,,,indian,TIADA,Ahli Dewan Negara,,,1988-07-11,1991-07-10
695,8,V. K. Sellappan,TIADA,BN - MIC,Dilantik Yang di-Pertuan Agong,TIADA,,,,,indian,TIADA,Ahli Dewan Negara,,,1991-07-24,1994-07-23
696,3,V. Ponnusamy Pillai,TIADA,Perikatan - MIC,Dilantik Yang di-Pertuan Agong,TIADA,,,,,indian,TIADA,Ahli Dewan Negara,,,,
697,4,V. S. M. Vellayappa,TIADA,BN - MIC,Dipilih oleh Dewan Undangan Negeri,Kedah,,,,,indian,TIADA,Ahli Dewan Negara,,,1976-08-09,1979-08-08
697,4,V. S. M. Vellayappa,TIADA,BN - MIC,Dipilih oleh Dewan Undangan Negeri,Kedah,,,,,indian,TIADA,Ahli Dewan Negara,,,1977-11-09,1980-11-08
698,4,V. V. Aboo,TIADA,BN - MIC,Dilantik Yang di-Pertuan Agong,TIADA,,,,,indian,TIADA,Ahli Dewan Negara,,,1976-08-09,1979-08-08
698,5,V. V. Aboo,TIADA,BN - MIC,Dilantik Yang di-Pertuan Agong,TIADA,,,,,indian,TIADA,Ahli Dewan Negara,,,1976-08-09,1979-08-08
694,9,V.K.K. Teagarajan,TIADA,BN - MIC,Dilantik Yang di-Pertuan Agong,TIADA,,,,,indian,TIADA,Ahli Dewan Negara,,,1997-10-06,2000-10-05
699,8,Vadiveloo Govindasamy,TIADA,BN - MIC,Dilantik Yang di-Pertuan Agong,TIADA,,,,,indian,TIADA,Ahli Dewan Negara,,,1991-12-16,1994-12-15
699,8,Vadiveloo Govindasamy,TIADA,BN - MIC,Dilantik Yang di-Pertuan Agong,TIADA,,,,,indian,TIADA,Ahli Dewan Negara,,,1994-12-14,1997-12-13
700,7,Valli Muthusamy,TIADA,BN - MIC,Dilantik Yang di-Pertuan Agong,TIADA,,,,,indian,TIADA,Ahli Dewan Negara,,,1986-12-15,1989-12-14
700,7,Valli Muthusamy,TIADA,BN - MIC,Dilantik Yang di-Pertuan Agong,TIADA,,,,,indian,TIADA,Ahli Dewan Negara,,,1989-12-11,1992-12-10
701,14,Vell Paari a/l Samy Vellu,YB Senator Dato' Sri,MIC,Dilantik Yang di-Pertuan Agong,TIADA,,,,M,indian,TIADA,TIADA,,02.09.2020 hingga 01.09.2023,2020-09-02,
701,15,Vell Paari a/l Tun Samy Vellu,YB Senator Dato' Sri,MIC,Dilantik Yang di-Pertuan Agong,TIADA,,,,M,indian,TIADA,Ahli Dewan Negara,,02.09.2020 - 01.09.2023,2020-09-02,2023-09-01
702,10,Vijayaratnam Seevaratnam,TIADA,BN - Gerakan,Dilantik Yang di-Pertuan Agong,TIADA,,,,,indian,TIADA,Ahli Dewan Negara,,,,
702,11,Vijayaratnam Seevaratnam,TIADA,BN - Gerakan,Dilantik Yang di-Pertuan Agong,TIADA,,,,,indian,TIADA,Ahli Dewan Negara,,,2006-02-22,2009-02-21
703,11,Wan Ahmad Farid Wan Salleh,TIADA,BN - UMNO,Dipilih oleh Dewan Undangan Negeri,Terengganu,,,,,bumiputera,TIADA,Ahli Dewan Negara,,,2005-12-23,2008-12-22
704,1,Wan Ahmad Wan Daud,TIADA,Perikatan - UMNO,Dipilih oleh Dewan Undangan Negeri,Perlis,,,,,bumiputera,TIADA,Ahli Dewan Negara,,,1959-09-11,1965-09-10
704,2,Wan Ahmad Wan Daud,TIADA,Perikatan - UMNO,Dipilih oleh Dewan Undangan Negeri,Perlis,,,,,bumiputera,TIADA,Ahli Dewan Negara,,,1959-09-11,1965-09-10
705,10,Wan Asiah Ahmad,TIADA,BN - UMNO,Dilantik Yang di-Pertuan Agong,TIADA,,,,,bumiputera,TIADA,Ahli Dewan Negara,,,1997-11-11,2000-11-10
705,10,Wan Asiah Ahmad,TIADA,BN - UMNO,Dilantik Yang di-Pertuan Agong,TIADA,,,,,bumiputera,TIADA,Ahli Dewan Negara,,,2000-11-02,2003-11-01
706,7,Wan Hamid Edruce Tuanku Mohamad,TIADA,BN - PBB,Dipilih oleh Dewan Undangan Negeri,Sarawak,,,,,bumiputera,TIADA,Ahli Dewan Negara,,,1990-12-17,1993-12-16
706,8,Wan Hamid Edruce Tuanku Mohamad,TIADA,BN - PBB,Dipilih oleh Dewan Undangan Negeri,Sarawak,,,,,bumiputera,TIADA,Ahli Dewan Negara,,,1990-12-17,1993-12-16
706,8,Wan Hamid Edruce Tuanku Mohamad,TIADA,BN - PBB,Dipilih oleh Dewan Undangan Negeri,Sarawak,,,,,bumiputera,TIADA,Ahli Dewan Negara,,,1993-12-13,1996-12-12
707,11,Wan Hazani Wan Mohd Nor,TIADA,BN - UMNO,Dilantik Yang di-Pertuan Agong,TIADA,,,,,bumiputera,TIADA,Ahli Dewan Negara,,,2005-10-14,2008-10-13
708,1,Wan Ibrahim Wan Tanjong,TIADA,Perikatan - UMNO,Dipilih oleh Dewan Undangan Negeri,Pahang,,,,,bumiputera,TIADA,Ahli Dewan Negara,,,1959-09-11,1965-09-10
708,2,Wan Ibrahim Wan Tanjong,TIADA,Perikatan - UMNO,Dipilih oleh Dewan Undangan Negeri,Pahang,,,,,bumiputera,TIADA,Ahli Dewan Negara,,,1959-09-11,1965-09-10
708,2,Wan Ibrahim Wan Tanjong,TIADA,Perikatan - UMNO,Dipilih oleh Dewan Undangan Negeri,Pahang,,,,,bumiputera,TIADA,Ahli Dewan Negara,,,1968-10-22,1974-10-21
708,3,Wan Ibrahim Wan Tanjong,TIADA,Perikatan - UMNO,Dipilih oleh Dewan Undangan Negeri,Pahang,,,,,bumiputera,TIADA,Ahli Dewan Negara,,,1965-10-18,1971-10-17
708,4,Wan Ibrahim Wan Tanjong,TIADA,BN - UMNO,Dipilih oleh Dewan Undangan Negeri,Pahang,,,,,bumiputera,TIADA,Ahli Dewan Negara,,,1965-10-18,1968-10-17
709,8,Wan Intan Wan Ahmad Tajuddin,TIADA,BN - UMNO,Dilantik Yang di-Pertuan Agong,TIADA,,,,,bumiputera,TIADA,Ahli Dewan Negara,,,1992-10-27,1995-10-26
710,14,Wan Martina binti Wan Yusoff,YB Senator Dr. Hajjah,PAS,Dipilih oleh Dewan Undangan Negeri,Kelantan,,,,M,bumiputera,TIADA,Ahli Dewan Negara,,24.08.2021 - 23.08.2024,2021-08-24,2024-08-23
710,15,Wan Martina binti Wan Yusoff,YB Senator Dr. Hajah,PAS,Dipilih oleh Dewan Undangan Negeri,Kelantan,,,,M,bumiputera,TIADA,Ahli Dewan Negara,,24.08.2021 - 23.08.2024,2021-08-24,2024-08-23
711,2,Wan Mustapha Ali,TIADA,PMIP,Dipilih oleh Dewan Undangan Negeri,Kelantan,,,,,bumiputera,TIADA,Ahli Dewan Negara,,,1965-10-18,1971-10-17
711,3,Wan Mustapha Wan Ali,TIADA,PAS,Dipilih oleh Dewan Undangan Negeri,Kelantan,,,,,bumiputera,TIADA,Ahli Dewan Negara,,,1965-08-16,1971-08-15
711,3,Wan Mustapha Wan Ali,TIADA,PAS,Dipilih oleh Dewan Undangan Negeri,Kelantan,,,,,bumiputera,TIADA,Ahli Dewan Negara,,,1965-10-18,1971-10-17
712,10,Wan Nordin Che Murat,TIADA,BN - UMNO,Dipilih oleh Dewan Undangan Negeri,Perlis,,,,,bumiputera,TIADA,Ahli Dewan Negara,,,,
712,11,Wan Nordin Che Murat,TIADA,BN - UMNO,Dipilih oleh Dewan Undangan Negeri,Perlis,,,,,bumiputera,TIADA,Ahli Dewan Negara,,,2006-05-08,2009-05-07
713,11,Wan Ramlah Ahmad,TIADA,BN - UMNO,Dilantik Yang di-Pertuan Agong,TIADA,,,,,bumiputera,TIADA,Ahli Dewan Negara,,,2007-01-08,2004-01-07
713,11,Wan Ramlah Ahmad,TIADA,BN - UMNO,Dilantik Yang di-Pertuan Agong,TIADA,,,,,bumiputera,TIADA,Ahli Dewan Negara,,,2007-01-08,2010-01-07
705,9,Wan Seri @ Wan Asiah Ahmad,TIADA,BN - UMNO,Dilantik Yang di-Pertuan Agong,TIADA,,,,,bumiputera,TIADA,Ahli Dewan Negara,,,1997-11-11,2000-11-10
714,2,Wan Sulaiman Wan Tam,TIADA,Perikatan - UMNO,Dilantik Yang di-Pertuan Agong,TIADA,,,,,bumiputera,TIADA,Ahli Dewan Negara,,,1966-03-28,
714,2,Wan Sulaiman Wan Tam,TIADA,Perikatan - UMNO,Dipilih oleh Dewan Undangan Negeri,Kedah,,,,,bumiputera,TIADA,Ahli Dewan Negara,,,1964-05-18,1965-08-16
714,3,Wan Sulaiman Wan Tam,TIADA,Perikatan - UMNO,Dilantik Yang di-Pertuan Agong,TIADA,,,,,bumiputera,TIADA,Ahli Dewan Negara,,,1966-03-28,1972-03-27
714,3,Wan Sulaiman Wan Tam,TIADA,Perikatan - UMNO,Dilantik Yang di-Pertuan Agong,TIADA,,,,,bumiputera,TIADA,Ahli Dewan Negara,,,1971-02-20,1977-02-19
714,4,Wan Sulaiman Wan Tam,TIADA,BN - UMNO,Dilantik Yang di-Pertuan Agong,TIADA,,,,,bumiputera,TIADA,Ahli Dewan Negara,,,1966-03-28,1969-03-27
714,4,Wan Sulaiman Wan Tam,TIADA,BN - UMNO,Dilantik Yang di-Pertuan Agong,TIADA,,,,,bumiputera,TIADA,Ahli Dewan Negara,,,1971-02-20,1974-02-19
715,10,Wan Ubaidah Omar,TIADA,PAS,Dipilih oleh Dewan Undangan Negeri,Kelantan,,,,,bumiputera,TIADA,Ahli Dewan Negara,,,2003-07-01,2006-06-30
715,11,Wan Ubaidah Omar,TIADA,PAS,Dipilih oleh Dewan Undangan Negeri,Kelantan,,,,,bumiputera,TIADA,Ahli Dewan Negara,,,2003-07-01,2006-06-30
715,11,Wan Ubaidah Omar,TIADA,PAS,Dipilih oleh Dewan Undangan Negeri,Kelantan,,,,,bumiputera,TIADA,Ahli Dewan Negara,,,2006-07-19,2009-07-18
716,4,Wee Khoon Hock,TIADA,BN - MCA,Dilantik Yang di-Pertuan Agong,TIADA,,,,,chinese,TIADA,Ahli Dewan Negara,,,1975-01-06,1978-01-05
716,5,Wee Khoon Hock,TIADA,BN - MCA,Dilantik Yang di-Pertuan Agong,TIADA,,,,,chinese,TIADA,Ahli Dewan Negara,,,1975-01-06,1978-01-05
717,10,Wee Kok Tiong,TIADA,BN - MCA,Dilantik Yang di-Pertuan Agong,TIADA,,,,,chinese,TIADA,Ahli Dewan Negara,,,2001-08-06,2004-08-05
718,8,William Chek Lin Kwai,TIADA,BN - MCA,Dilantik Yang di-Pertuan Agong,TIADA,,,,,chinese,TIADA,Ahli Dewan Negara,,,1991-02-18,1994-02-17
718,8,William Chek Lin Kwai,TIADA,BN - MCA,Dilantik Yang di-Pertuan Agong,TIADA,,,,,chinese,TIADA,Ahli Dewan Negara,,,1991-12-16,1994-12-15
719,9,William Lau Kung Hui,TIADA,BN - SNAP,Dilantik Yang di-Pertuan Agong,TIADA,,,,,chinese,TIADA,Ahli Dewan Negara,,,,
719,10,William Lau Kung Hui,TIADA,BN - SNAP,Dilantik Yang di-Pertuan Agong,TIADA,,,,,chinese,TIADA,Ahli Dewan Negara,,,,
719,11,William Lau Kung Hui,TIADA,BN - SNAP,Dilantik Yang di-Pertuan Agong,TIADA,,,,,chinese,TIADA,Ahli Dewan Negara,,,,
720,1,William Tan Ho Choon,TIADA,SCA,Dilantik Yang di-Pertuan Agong,TIADA,,,,,chinese,TIADA,Ahli Dewan Negara,,,1963-12-27,1969-12-26
720,2,William Tan Ho Choon,TIADA,SCA,Dilantik Yang di-Pertuan Agong,TIADA,,,,,chinese,TIADA,Ahli Dewan Negara,,,1963-12-27,
720,2,William Tan Ho Choon,TIADA,SCA,Dilantik Yang di-Pertuan Agong,TIADA,,,,,chinese,TIADA,Ahli Dewan Negara,,,1965-10-18,
720,3,William Tan Ho Choon,TIADA,SCA,Dilantik Yang di-Pertuan Agong,TIADA,,,,,chinese,TIADA,Ahli Dewan Negara,,,1963-12-27,1969-12-26
720,3,William Tan Ho Choon,TIADA,SCA,Dilantik Yang di-Pertuan Agong,TIADA,,,,,chinese,TIADA,Ahli Dewan Negara,,,1965-10-18,1971-10-17
721,11,Wilson Sagamany Paul Devasagayam,TIADA,BN - MIC,Dipilih oleh Dewan Undangan Negeri,Selangor,,,,,chinese,TIADA,Ahli Dewan Negara,,,2004-01-08,2007-01-07
722,11,Wong Foon Meng,TIADA,BN - MCA,Dilantik Yang di-Pertuan Agong,TIADA,,,,,chinese,TIADA,Ahli Dewan Negara,,,2004-04-13,2007-04-12
722,11,Wong Foon Meng,TIADA,BN - MCA,Dilantik Yang di-Pertuan Agong,TIADA,,,,,chinese,TIADA,Ahli Dewan Negara,,,2007-05-07,2010-05-06
723,4,Wong Kee Nai,TIADA,BN - MCA,Dilantik Yang di-Pertuan Agong,TIADA,,,,,chinese,TIADA,Ahli Dewan Negara,,,1977-04-18,1980-04-17
723,4,Wong Kee Nai,TIADA,BN - MCA,Dilantik Yang di-Pertuan Agong,TIADA,,,,,chinese,TIADA,Ahli Dewan Negara,,,1977-11-09,1980-11-08
723,5,Wong Kee Nai,TIADA,BN - MCA,Dilantik Yang di-Pertuan Agong,TIADA,,,,,chinese,TIADA,Ahli Dewan Negara,,,1977-04-18,1980-04-17
723,5,Wong Kee Nai,TIADA,BN - MCA,Dilantik Yang di-Pertuan Agong,TIADA,,,,,chinese,TIADA,Ahli Dewan Negara,,,1977-11-09,1980-11-08
724,6,Wong Kie Yik,TIADA,BN - MCA,Dilantik Yang di-Pertuan Agong,TIADA,,,,,chinese,TIADA,Ahli Dewan Negara,,,1986-02-26,1989-02-25
724,7,Wong Kie Yik,TIADA,BN - MCA,Dilantik Yang di-Pertuan Agong,TIADA,,,,,chinese,TIADA,Ahli Dewan Negara,,,1986-02-26,1989-02-25
724,7,Wong Kie Yik,TIADA,BN - MCA,Dilantik Yang di-Pertuan Agong,TIADA,,,,,chinese,TIADA,Ahli Dewan Negara,,,1989-08-25,1992-08-24
724,8,Wong Kie Yik,TIADA,BN - MCA,Dilantik Yang di-Pertuan Agong,TIADA,,,,,chinese,TIADA,Ahli Dewan Negara,,,1986-02-26,1989-02-25
724,8,Wong Kie Yik,TIADA,BN - MCA,Dilantik Yang di-Pertuan Agong,TIADA,,,,,chinese,TIADA,Ahli Dewan Negara,,,1989-08-25,1992-08-24
725,3,Wong Seng Chow,TIADA,Perikatan - MCA,Dilantik Yang di-Pertuan Agong,TIADA,,,,,chinese,TIADA,Ahli Dewan Negara,,,1971-12-20,1977-12-19
725,6,Wong Seng Chow,TIADA,BN - MCA,Dilantik Yang di-Pertuan Agong,TIADA,,,,,chinese,TIADA,Ahli Dewan Negara,,,1982-12-14,1985-12-13
726,11,Wong Siong Hwee,TIADA,BN - MCA,Dilantik Yang di-Pertuan Agong,TIADA,,,,,chinese,TIADA,Ahli Dewan Negara,,,,
727,3,Wong Swee Soon,TIADA,Perikatan - MCA,Dilantik Yang di-Pertuan Agong,TIADA,,,,,chinese,TIADA,Ahli Dewan Negara,,,1971-02-20,1977-02-19
728,6,Wong Yau Ket,TIADA,TIADA,Dipilih oleh Dewan Undangan Negeri,Sabah,,,,,chinese,TIADA,Ahli Dewan Negara,,,1984-07-30,1987-07-29
728,7,Wong Yau Ket,TIADA,TIADA,Dipilih oleh Dewan Undangan Negeri,Sabah,,,,,chinese,TIADA,Ahli Dewan Negara,,,1984-07-30,1987-07-29
729,5,Yaacob Engku Yunus,TIADA,BN - UMNO,Dipilih oleh Dewan Undangan Negeri,Kelantan,,,,,bumiputera,TIADA,Ahli Dewan Negara,,,1980-12-15,1983-12-14
729,6,Yaacob Engku Yunus,TIADA,BN - UMNO,Dipilih oleh Dewan Undangan Negeri,Kelantan,,,,,bumiputera,TIADA,Ahli Dewan Negara,,,1980-12-15,1983-08-26
730,10,Yaakob Mohammad,TIADA,BN - UMNO,Dipilih oleh Dewan Undangan Negeri,Kedah,,,,,bumiputera,TIADA,Ahli Dewan Negara,,,,
730,11,Yaakob Mohammad,TIADA,BN - UMNO,Dipilih oleh Dewan Undangan Negeri,Kedah,,,,,bumiputera,TIADA,Ahli Dewan Negara,,,2005-05-03,2008-05-02
731,13,Yahaya bin Mat Ghani @ Abbas,YB Senator Datuk Haji,BN - UMNO,Dilantik Yang di-Pertuan Agong,TIADA,,,,M,bumiputera,TIADA,TIADA,,07.10.2013 - 06.10.2016,2013-10-07,2016-10-06
732,3,Yahya Ahmad,TIADA,Perikatan - UMNO,Dipilih oleh Dewan Undangan Negeri,Perak,,,,,bumiputera,TIADA,Ahli Dewan Negara,,,1964-10-19,1970-10-18
732,3,Yahya Ahmad,TIADA,Perikatan - UMNO,Dipilih oleh Dewan Undangan Negeri,Perak,,,,,bumiputera,TIADA,Ahli Dewan Negara,,,1965-10-18,1971-10-17
732,3,Yahya Ahmad,TIADA,Perikatan - UMNO,Dipilih oleh Dewan Undangan Negeri,Perak,,,,,bumiputera,TIADA,Ahli Dewan Negara,,,1971-12-20,1977-12-19
732,2,Yahya Haji Ahmad,TIADA,Perikatan - UMNO,Dipilih oleh Dewan Undangan Negeri,Negeri Sembilan,,,,,bumiputera,TIADA,Ahli Dewan Negara,,,1965-10-18,1966-06-01
733,1,Yap Khen Van,TIADA,Perikatan - MCA,Dipilih oleh Dewan Undangan Negeri,Pahang,,,,,chinese,TIADA,Ahli Dewan Negara,,,1959-09-11,1962-09-10
734,4,Yap Pian Tau,TIADA,BN - MCA,Dipilih oleh Dewan Undangan Negeri,Selangor,,,,,chinese,TIADA,Ahli Dewan Negara,,,1978-01-18,1981-01-17
734,5,Yap Pian Tau,TIADA,BN - MCA,Dipilih oleh Dewan Undangan Negeri,Selangor,,,,,chinese,TIADA,Ahli Dewan Negara,,,1978-01-18,1981-01-17
735,3,Yeap Kheng Yam,TIADA,Perikatan - MCA,Dipilih oleh Dewan Undangan Negeri,Perak,,,,,chinese,TIADA,Ahli Dewan Negara,,,1971-08-02,1977-08-01
736,4,Yeh Pao Tzu,TIADA,SCA,Dipilih oleh Dewan Undangan Negeri,Sabah,,,,,chinese,TIADA,Ahli Dewan Negara,,,1977-11-09,1980-11-08
736,5,Yeh Pao Tzu,TIADA,SCA,Dipilih oleh Dewan Undangan Negeri,Sabah,,,,,chinese,TIADA,Ahli Dewan Negara,,,1977-11-09,1980-11-08
736,5,Yeh Pao Tzu,TIADA,SCA,Dipilih oleh Dewan Undangan Negeri,Sabah,,,,,chinese,TIADA,Ahli Dewan Negara,,,1981-04-23,1984-04-22
737,1,Yeoh Kian Teik,TIADA,Perikatan - MCA,Dipilih oleh Dewan Undangan Negeri,Perak,,,,,chinese,TIADA,Ahli Dewan Negara,,,1959-09-11,1965-09-10
737,2,Yeoh Kian Teik,TIADA,Perikatan - MCA,Dipilih oleh Dewan Undangan Negeri,Perak,,,,,chinese,TIADA,Ahli Dewan Negara,,,1959-09-11,1965-09-10
737,2,Yeoh Kian Teik,TIADA,Perikatan - MCA,Dipilih oleh Dewan Undangan Negeri,Perak,,,,,chinese,TIADA,Ahli Dewan Negara,,,1968-10-22,1974-10-21
738,9,Yeow Seng Huat,TIADA,BN - MCA,Dipilih oleh Dewan Undangan Negeri,Pahang,,,,,chinese,TIADA,Ahli Dewan Negara,,,1996-12-16,1999-12-15
739,10,Yew Teong Look,TIADA,BN - MCA,Dilantik Yang di-Pertuan Agong,TIADA,,,,,chinese,TIADA,Ahli Dewan Negara,,,,
740,10,Yew Thuan Chiew,TIADA,BN - MCA,Dipilih oleh Dewan Undangan Negeri,Perak,,,,,chinese,TIADA,Ahli Dewan Negara,,,2000-12-13,2003-12-12
741,11,Yip Kum Fook,TIADA,BN - MCA,Dipilih oleh Dewan Undangan Negeri,Selangor,,,,,chinese,TIADA,Ahli Dewan Negara,,,2006-12-06,2009-12-05
742,13,Yong Wui Chung,YB Senator Datuk Ir.,BN - LDP,Dilantik Yang di-Pertuan Agong,TIADA,,,,M,chinese,TIADA,TIADA,,22.08.2017 - 21.08.2020,2017-08-22,2020-08-21
743,12,Yunus bin Haji Kurus,YB Senator Datuk Haji,BN - UMNO,Dilantik Yang di-Pertuan Agong,TIADA,,,,M,bumiputera,TIADA,TIADA,,30.05.2011 - 29.05.2014,2011-05-30,2014-05-29
744,13,Zahari Bin Sarip,YB Senator Dato',BN - UMNO,Dipilih oleh Dewan Undangan Negeri,Johor,,,,M,bumiputera,TIADA,TIADA,,15.05.2017 - 14.05.2020,2017-05-15,2020-05-14
745,13,Zaiedi Bin Haji Suhaili,YB Senator Dr.,BN - PBB,Dipilih oleh Dewan Undangan Negeri,Sarawak,,,,M,bumiputera,TIADA,TIADA,,19.07.2016 - 18.07.2019,2016-07-19,2019-07-18
746,8,Zainal Md. Derus,TIADA,BN - UMNO,Dipilih oleh Dewan Undangan Negeri,Selangor,,,,,bumiputera,TIADA,Ahli Dewan Negara,,,1991-08-05,1994-08-04
746,8,Zainal Md. Derus,TIADA,BN - UMNO,Dipilih oleh Dewan Undangan Negeri,Selangor,,,,,bumiputera,TIADA,Ahli Dewan Negara,,,1994-08-11,1997-08-10
747,9,Zainal Rampak,TIADA,BN - UMNO,Dilantik Yang di-Pertuan Agong,TIADA,,,,,bumiputera,TIADA,Ahli Dewan Negara,,,1998-12-07,2001-12-06
747,10,Zainal Rampak,TIADA,BN - UMNO,Dilantik Yang di-Pertuan Agong,TIADA,,,,,bumiputera,TIADA,Ahli Dewan Negara,,,1998-12-07,2001-12-06
747,10,Zainal Rampak,TIADA,BN - UMNO,Dilantik Yang di-Pertuan Agong,TIADA,,,,,bumiputera,TIADA,Ahli Dewan Negara,,,2001-12-12,2004-12-11
748,8,Zainol Abidin Johari,TIADA,BN - UMNO,Dilantik Yang di-Pertuan Agong,TIADA,,,,,bumiputera,TIADA,Ahli Dewan Negara,,,,
749,9,Zainuddin Maidin,TIADA,BN - UMNO,Dilantik Yang di-Pertuan Agong,TIADA,,,,,bumiputera,TIADA,Ahli Dewan Negara,,,1998-03-09,2001-03-08
749,10,Zainuddin Maidin,TIADA,BN - UMNO,Dilantik Yang di-Pertuan Agong,TIADA,,,,,bumiputera,TIADA,Ahli Dewan Negara,,,1998-03-09,2001-03-08
750,3,Zainuddin Mohd Sidin,TIADA,Perikatan - UMNO,Dilantik Yang di-Pertuan Agong,TIADA,,,,,bumiputera,TIADA,Ahli Dewan Negara,,,1971-02-20,1977-02-19
751,5,Zaiton Ibrahim Ahmad,TIADA,BN - UMNO,Dilantik Yang di-Pertuan Agong,TIADA,,,,,bumiputera,TIADA,Ahli Dewan Negara,,,1981-01-05,1984-01-04
751,6,Zaiton Ibrahim Ahmad,TIADA,BN - UMNO,Dilantik Yang di-Pertuan Agong,TIADA,,,,,bumiputera,TIADA,Ahli Dewan Negara,,,1981-01-05,1984-01-04
752,12,Zaitun binti Mat Amin,YB Senator To' Puan,BN - UMNO,Dipilih oleh Dewan Undangan Negeri,Terengganu,,,,M,bumiputera,TIADA,TIADA,,08.06.2012 - 07.06.2015,2012-06-08,2015-06-07
753,9,Zakaria Arshad,TIADA,BN - UMNO,Dipilih oleh Dewan Undangan Negeri,Negeri Sembilan,,,,,bumiputera,TIADA,Ahli Dewan Negara,,,1997-08-11,2000-08-10
753,10,Zakaria Arshad,TIADA,BN - UMNO,Dipilih oleh Dewan Undangan Negeri,Negeri Sembilan,,,,,bumiputera,TIADA,Ahli Dewan Negara,,,1997-08-11,2000-08-10
753,10,Zakaria Arshad,TIADA,BN - UMNO,Dipilih oleh Dewan Undangan Negeri,Negeri Sembilan,,,,,bumiputera,TIADA,Ahli Dewan Negara,,,2000-12-06,2003-12-05
754,6,Zakaria Yahya,TIADA,BN - UMNO,Dipilih oleh Dewan Undangan Negeri,Selangor,,,,,bumiputera,TIADA,Ahli Dewan Negara,,,1984-07-30,1987-07-29
754,7,Zakaria Yahya,TIADA,BN - UMNO,Dipilih oleh Dewan Undangan Negeri,Selangor,,,,,bumiputera,TIADA,Ahli Dewan Negara,,,1984-07-30,1987-07-29
754,7,Zakaria Yahya,TIADA,BN - UMNO,Dipilih oleh Dewan Undangan Negeri,Selangor,,,,,bumiputera,TIADA,Ahli Dewan Negara,,,1987-12-08,1990-12-07
755,8,Zaleha Husin,TIADA,BN - UMNO,Dilantik Yang di-Pertuan Agong,TIADA,,,,,bumiputera,TIADA,Ahli Dewan Negara,,,1992-04-13,1995-04-12
756,15,Zambry bin Abdul Kadir,YB Senator Dato' Seri Diraja Dr.,UMNO,Dilantik Yang di-Pertuan Agong,TIADA,,,,M,bumiputera,Menteri Pendidikan Tinggi,Ahli Dewan Negara,,03.12.2022 - 02.12.2025,2022-12-03,2025-12-02
757,4,Zawiah Abdullah,TIADA,BN - UMNO,Dipilih oleh Dewan Undangan Negeri,Terengganu,,,,,bumiputera,TIADA,Ahli Dewan Negara,,,1975-01-06,1978-01-05
757,5,Zawiah Abdullah,TIADA,BN - UMNO,Dipilih oleh Dewan Undangan Negeri,Terengganu,,,,,bumiputera,TIADA,Ahli Dewan Negara,,,1975-01-06,1978-01-05
758,14,Zulkifli Mohamad Al-Bakri,YB Senator Datuk Dr. Haji,TIADA,Dilantik Yang di-Pertuan Agong,TIADA,,,,M,bumiputera,TIADA,TIADA,,09.03.2020 hingga 08.03.2023,2020-03-09,
759,15,Zulkifli bin Hasan,YB Senator Dr.,PROFESIONAL,Dilantik Yang di-Pertuan Agong,TIADA,,,,M,bumiputera,Timbalan Menteri Agama,Ahli Dewan Negara,,12.12.2023 - 11.12.2026,2023-12-12,2026-12-11
760,14,Zurainah Binti Musa,YB Senator Datuk Seri Hajjah,BN - UMNO,Dilantik Yang di-Pertuan Agong,TIADA,,,,M,bumiputera,TIADA,Ahli Dewan Negara,,22.12.2021 - 21.12.2024,2021-12-22,2024-12-21